uri,room_count,floor,max_floor,street,house_number,general_area,intersection,microdistrict,building_type,kitchen_area,living_area,condition,build_year,residential_complex,city,district,telephone,internet,balcony,is_balcony_glazed,door,bathroom,parking,furniture,floor_type,former_hostel,ceiling_height,bars_on_the_window,security,entry_phone,code_lock,alarm,video_security,video_entry_phone,concierge,exchange_possible,plastic_windows,non_angular,improved,rooms_isolated,studio_kitchen,kitchen_builtin,new_plumbing,pantry,counters,quiet_courtyard,air_conditioning,commercial_convenient,price,mortgaged,images_count,private_hostel,text
https://krisha.kz//a/show/677663362,3,5,5,Алтын Орда,6/19,80.0,nan,nan,монолитный,11.8,nan,хорошее,2020,Alma City,Алматы,Наурызбайский,nan,nan,балкон,False,деревянная,раздельный,nan,nan,линолеум,False,2.7,False,False,False,False,False,False,False,False,False,True,True,True,True,True,True,True,True,True,True,True,True,37000000,True,15,False,"Квартира в отличном состоянии, в чистовой отделке. Дом находится возле Школы и Садика, рядом находятся Мечеть, рынок Алтын Орда, ТРЦ Апорт, на нижней стороне ЖК будет проходит улица Толе би. Удобный выезд на проспект Райымбек и Абая. 
Реальному клиенту будет предложено резальная цена!"
https://krisha.kz//a/show/678055206,2,2,12,nan,nan,58.2,Алматы арены,Акбулак,монолитный,11.0,nan,хорошее,2019,Alatau City 2.0,Алматы,Алатауский,есть возможность подключения,проводной,балкон,False,металлическая,раздельный,паркинг,nan,ламинат,False,2.7,False,False,True,False,False,True,False,False,False,True,True,True,True,False,False,False,False,True,False,False,False,35000000,True,7,False,"Пластиковые окна, комнаты изолированы, улучшенная, неугловая, счётчики.
Срочно продам двухкомнатную квартиру в очень перспективном районе города. Рядом Алматы арена и один из самой большой мечети в центральной Азий. Требуется косметический ремонт."
https://krisha.kz//a/show/677439112,3,2,5,Суюнбая,292/4,64.0,nan,13-й военный городок,панельный,11.0,64.0,хорошее,1986,nan,Алматы,Турксибский,отдельный,ADSL,несколько балконов или лоджий,True,металлическая,совмещенный,рядом охраняемая стоянка,nan,ламинат,False,2.8,True,False,True,True,True,True,True,False,False,True,True,True,True,False,False,True,True,True,True,True,False,30000000,False,9,False,"Счётчики, улучшенная, тихий двор, пластиковые окна, кондиционер, комнаты изолированы, кладовка, неугловая, новая сантехника.
Кухня 11 квадратов, 2 балкона, во дворе садик, тренажёрный зал, дзюдо, магазины, рынки, аэропорт и ж/д вокзал в 10мин, большая школа 32-я, балкон утеплён, отдельная кладовка. Очень тихий двор, соседи хорошие. Не угловая!"
https://krisha.kz//a/show/664558812,3,11,17,nan,nan,100.4,Торайгырова,Орбита-1,монолитный,9.0,57.3,nan,2014,Шахристан,Алматы,Бостандыкский,отдельный,оптика,лоджия,True,бронированная,2 с/у и более,nan,частично,ламинат,False,3.0,False,True,True,False,False,True,False,True,False,True,True,True,True,True,True,True,True,True,True,True,True,85000000,False,16,False,"Продаётся 3-хкомнатная квартира частично меблирована, в отличном состоянии. квартира светлая, солнечная, тёплая, уютная, просторная. Хороший дом, хорошие соседи. дом стоит не на проезжей части, а вдоль реки Малая Алматинка, все окна выходят во двор (летом свежо, при этом не слышно шума реки) ."
https://krisha.kz//a/show/673188318,2,4,10,Кенесары хана,nan,67.0,nan,Каргалы,монолитный,18.0,nan,nan,2011,Хан Тенгри,Алматы,Наурызбайский,nan,nan,лоджия,True,металлическая,раздельный,рядом охраняемая стоянка,частично,ламинат,False,nan,False,True,True,False,False,False,False,False,False,True,False,True,False,False,False,False,True,False,True,False,False,46000000,False,15,False,"Пластиковые окна, улучшенная, тихий двор, кладовка.
ЖК «Хан Тенгри» находится в экологически чистом районе Алматы, горы в пешей доступности. Вдалеке от главной дороги, что обеспечивает покой и тишину за окном. Окна квартиры выходят на детскую площадку. 
 
Квартира находится на юго западной стороне, что обеспечивает большое количество попадающего в квартиру света. 
 
С хорошим ремонтом, доброкачественной кухней и электрической плитой, но также есть возможность подключения в квартиру газа. 
 
Квартира очень светлая и уютная с хорошей энергетикой. ) Продаётся только по необходимости расширения площади."
https://krisha.kz//a/show/676832931,1,10,10,Жунисова,nan,32.0,nan,nan,монолитный,nan,nan,свободная планировка,2022,Alma City,Алматы,Наурызбайский,nan,nan,nan,False,nan,nan,nan,nan,nan,False,nan,False,False,False,False,False,False,False,False,False,True,True,True,True,True,True,True,True,True,True,True,True,14700000,False,0,False,Документы через две недели
https://krisha.kz//a/show/677617803,3,5,5,Шагабутдинова,23,62.0,nan,nan,панельный,5.9,nan,хорошее,1977,nan,Алматы,Алмалинский,nan,проводной,лоджия,True,металлическая,совмещенный,рядом охраняемая стоянка,nan,ламинат,False,2.7,False,False,True,False,False,True,False,False,False,True,True,True,True,False,False,False,False,False,True,True,False,37500000,False,14,False,"Кондиционер, комнаты изолированы, улучшенная, пластиковые окна, неугловая, тихий двор.
Квартира в центре, рядом все есть, школы, магазины, дет. сады, базары. Теплая, не угловая. Тихий двор, парковка во дворе. С мебелью, техникой. в связи с переездом. 
Риэлторов просьба не беспокоить."
https://krisha.kz//a/show/666689107,2,1,10,Варламова,1/3,74.0,nan,nan,монолитный,12.0,68.0,свободная планировка,2021,nan,Алматы,Алмалинский,отдельный,оптика,лоджия,False,бронированная,2 с/у и более,паркинг,nan,nan,False,3.3,False,True,True,True,True,True,False,False,False,False,False,True,True,False,False,False,False,True,True,True,False,45500000,False,5,False,"Тихий двор, кондиционер, улучшенная, комнаты изолированы, счётчики.
Продам квартиру в новом ЖК Varlamova. Спешите купить, последние квартиры. Эта - отличный вариант. Обжитый комплекс. Отличное и работающее ОСИ. Подальше от шумных улиц. Окна выходят на Сайран. Алюминиевые большие окна. Цены от Застройщика. Красивый и дорогой фасад. Детская игровая площадка, workout, подземный паркинг, огромная гостевая парковка, детский сад, спортивная площадка, набережная. Выезд на Толе Би, Тлендиева, Абая. Все для комфортного проживания. Район в последнее время очень сильно преобразился и продолжает развиваться. Транспортная доступность по всем направлениям."
https://krisha.kz//a/show/678246501,4,5,6,nan,nan,87.0,nan,Жетысу-4 8,кирпичный,8.0,nan,хорошее,1997,nan,Алматы,Ауэзовский,отдельный,оптика,балкон и лоджия,True,металлическая,раздельный,рядом охраняемая стоянка,nan,линолеум,False,2.8,False,False,False,False,False,False,False,False,False,True,True,True,True,True,True,True,True,True,True,True,True,50000000,False,8,False,None
https://krisha.kz//a/show/673522223,1,2,5,nan,nan,41.0,Яссауи Т,Аксай-3А 69,панельный,9.0,nan,хорошее,1989,nan,Алматы,Ауэзовский,отдельный,проводной,nan,False,металлическая,раздельный,рядом охраняемая стоянка,nan,nan,False,2.8,False,False,True,False,False,True,False,False,False,False,False,False,False,False,False,False,False,False,True,False,False,25000000,False,7,False,"Тихий двор.
Светлая, просторная 1-комнатная кв. 1989 года. (Сейсмостойкая) Чистый подъезд, дружелюбные соседи, тихий, красивый двор. 
В этом районе очень хорошо развита инфраструктура: 
•2 детских садиков 
•Школа гимназия (каз. ) •Мед. центры, кафе, магазины (магнум) и многое другое 
квартира угловая, но теплая."
https://krisha.kz//a/show/677924334,1,3,9,nan,nan,48.0,nan,Думан-2 286,монолитный,nan,nan,nan,2021,nan,Алматы,Медеуский,nan,nan,nan,False,металлическая,раздельный,nan,nan,ламинат,False,2.8,False,False,False,False,False,False,False,False,False,True,True,True,True,True,True,True,True,True,True,True,True,28500000,False,2,False,"Продам новую квартиру с евроремонтом в связи с переездом в другой город. Квартира тёплая, уютная, 3 этаж, лифт работает. Можно переделать в двухкомнатную."
https://krisha.kz//a/show/677606858,4,8,9,nan,nan,78.0,Мендикулова,Самал-2 74,монолитный,9.7,nan,хорошее,1992,nan,Алматы,Медеуский,есть возможность подключения,ADSL,несколько балконов или лоджий,True,деревянная,2 с/у и более,рядом охраняемая стоянка,частично,паркет,False,2.75,False,False,True,False,False,True,False,False,False,True,False,True,False,False,True,False,True,True,True,True,False,75000000,False,22,False,"Пластиковые окна, тихий двор, кондиционер, улучшенная, встроенная кухня, кладовка, счётчики.
Продам 4-х комнатную квартиру с шикарным расположением в самом центре г. Алматы в верхней части Медеуского района на пересечении улиц Мендикулова и Бектурова с хорошей транспортной развязкой. Хорошие, вежливые, дружные соседи, тихий двор. Установлены шлагбаумы, камеры видеонаблюдения, фонари, озеленен двор. Во дворе несколько детских площадок, футбольный стадион с новым газоном. Квартира в отличном состоянии, после косметического ремонта, светлая, уютная, просторная. Гостинная, 2 спальни, отдельная кухня, 2 отдельных сан узла, длинный коридор, 2 балкона со встроенными шкафами, джакузи, собственная кладовая на этаже 4 кв. м. Шикарный вид с окон на Кок-тобе и горы Заилийского Алатау. В шаговой доступности: ТРЦ Рамстор, ТРЦ Алма-Ата, ТРЦ Dostyk Plaza, американское консульство, Терренкур, Парк имени фонда Первого Президента, Кок-Тобе в 5 мин езды, Медеу 15 мин езды, Дворец Школьников, Площадь Республики (ТРЦ Алмалы), гос и частные садики, школа-лицей 131, 92, кофейни и рестораны, супермаркеты, салоны красоты, магазины."
https://krisha.kz//a/show/677617818,1,1,9,Мкр,nan,36.0,nan,Атырау,монолитный,nan,nan,хорошее,2020,Vostochka.kz,Алматы,Медеуский,есть возможность подключения,nan,балкон,False,металлическая,раздельный,nan,nan,ламинат,False,2.7,False,False,True,False,False,False,False,False,False,True,True,True,True,True,True,True,True,True,True,True,True,25000000,True,4,False,"Пластиковые окна, неугловая, комнаты изолированы, встроенная кухня, новая сантехника, счётчики, тихий двор. 
Квартира находится в жилом комплексе Восточка. дом первой очереди с хорошим видом из окна. 
Крыша закрыта отлично, на тех. этаже отсутствует влага. Ни когда не заливало квартиру. Отличная шумоизоляция, квартира между несущими стенами. 
Частично мебелированная: кухонный гарнитур, прихожая. 
квартира чистая, уютная, отлично подойдёт для молодой семьи. 1 этаж. 
торг возможен, после осмотра на месте. 
Просьба риелторам не беспокоить."
https://krisha.kz//a/show/674467200,1,4,9,Асыл Арман,nan,40.6,Асыл Арман,nan,монолитный,11.5,17.0,хорошее,2014,nan,nan,nan,nan,nan,балкон,True,металлическая,совмещенный,nan,nan,линолеум,False,2.7,False,False,True,False,False,True,False,False,False,True,True,True,True,False,False,True,False,True,True,False,False,17500000,False,5,False,"Тихий двор, счётчики, неугловая, улучшенная, новая сантехника, комнаты изолированы, пластиковые окна.
Срочно Продаётся 1 комнатная квартира в с. Иргели, ЖК Асыл Арман. Прекрасно развита сеть общественного транспорта, до проспекта Абая 10 минут езды. Рядом есть «Магнум», «Тоймарт», аптеки, продуктовые магазины. Рынок Алтын Орда рядом. Инфраструктура хорошо развита. Возможен небольшой торг. Звоните, договоримся чтобы показать квартиру. Кухонный гарнитур, диван оставляем."
https://krisha.kz//a/show/679297491,2,2,12,Кармысова,84,56.0,nan,nan,монолитный,11.0,nan,черновая отделка,2022,Exclusive Star,Алматы,Медеуский,nan,nan,nan,False,nan,nan,паркинг,nan,nan,False,2.8,False,True,False,False,False,False,False,False,False,True,False,False,False,False,False,False,False,False,True,False,False,55000000,False,0,False,"Пластиковые окна, тихий двор.
✅ Квартира в центре города 
✅ Круглосуточная охрана, видеонаблюдение 
✅ Документы на руках 
✅ Блок 2 
✅ Окна восток-юг 
✅ Документы на руках 
✅ 1 этаж жилой 
✅ Паркинг на территории жилого комплекса 
❌Риэлторов просьба не беспокоить❌"
https://krisha.kz//a/show/678586815,4,6,9,Муканова,227,85.0,Кабанбай Батыра,nan,кирпичный,9.0,nan,хорошее,1986,nan,Алматы,Алмалинский,отдельный,оптика,лоджия,True,металлическая,раздельный,рядом охраняемая стоянка,частично,паркет,False,2.7,False,False,True,False,False,True,False,False,False,True,True,True,True,False,False,False,False,True,True,True,False,70000000,False,16,False,"Пластиковые окна, неугловая, улучшенная, комнаты изолированы, счётчики, тихий двор, кондиционер.
Продаётся квартира 4х комнатная перепланированная на 3 х, с большим залом, жилая площадь 81.5 кВ. м., дом кирпичный прекрасной инфраструктурой : школы, речка Есентай, телеком, ЦОН, рынок и много чего интересного, этаж 6 ой, прекрасный вид с окон, тёплая, уютная квартира владели единственные хозяева, кухня 9 кв., балкон, зал холл 35 кв., хорошие соседи, остальное по телефону"
https://krisha.kz//a/show/671772107,2,3,10,Алтын Орда,6/2,60.43,nan,Шугыла,монолитный,nan,nan,черновая отделка,2022,Alma City,Алматы,Наурызбайский,nan,nan,nan,False,металлическая,nan,nan,nan,nan,False,2.8,False,False,False,False,False,False,False,False,False,True,True,True,True,True,True,True,True,True,True,True,True,32000000,False,5,False,2×х комнатная квартира в свободной планировке по переуступке. Дом будет сдаваться в эксплуатацию во втором квартале 2022года.
https://krisha.kz//a/show/677279433,2,8,10,Сейфуллина,51,67.55,Ул,nan,монолитный,nan,nan,черновая отделка,2022,Теремки,Алматы,Турксибский,nan,nan,балкон,False,металлическая,nan,паркинг,nan,nan,False,2.7,False,False,False,False,False,False,False,False,True,True,False,False,False,False,False,False,False,False,False,False,False,31000000,False,18,False,"Пластиковые окна.
Пластиковые окна, тихий двор, состояние улучшенный черновой, что даёт возможность сделать ремонт по своему предпочтению. ключи и документы на руках."
https://krisha.kz//a/show/678216543,1,3,10,Жунисова,12/2,29.97,nan,nan,монолитный,29.97,nan,хорошее,2019,Alma City,Алматы,Наурызбайский,nan,nan,nan,False,nan,nan,nan,nan,nan,False,2.8,False,False,False,False,False,False,False,False,False,True,True,True,True,True,True,True,True,True,True,True,True,20000000,False,3,False,None
https://krisha.kz//a/show/675780305,4,nan,nan,ул,nan,130.1,nan,Нур Алатау,кирпичный,18.0,nan,черновая отделка,2021,nan,Алматы,Бостандыкский,nan,оптика,балкон,False,бронированная,2 с/у и более,nan,nan,nan,False,3.2,False,False,False,True,True,False,True,False,False,True,True,True,True,True,True,True,True,True,True,True,True,67000000,False,10,False,"Акция только до конца мая 62 000 000 Тг. Квартира в двух уровнях, в свободной планировки. Дом из красного кирпича, построен с соблюдением всех норм, по авторскому проекту не имеющий аналогов с хорошей звуко и теплоизоляцией. 1 этаж - прихожая, зал, кухня, с/у, котельная; 2 этаж - три спальни, с/у, балкон. Парковка на 2 машины, видеодомофон, автоматические ворота, перед домом полисад, за домом зона барбекю. Оконные системы Рихау с тройным стеклопакетом. Обогрев желобов. Газ, свет, вода. Дом расположен в экологически чистом районе с удобными подъездными путями. В шаговой доступности образовательный комплекс Тамос с детским садом, школой и спортивно-оздоровительным комплексом. Престижный район, элитное соседство. Спешите!"
https://krisha.kz//a/show/676339794,4,9,18,nan,nan,113.7,Шакарима,Тастак-2 167,монолитный,14.0,nan,хорошее,2013,Алтын Булак,Алматы,Алмалинский,nan,оптика,лоджия,True,nan,2 с/у и более,паркинг,nan,ламинат,False,2.8,True,True,True,False,True,True,False,False,False,False,True,False,True,False,False,False,False,False,False,True,False,75000000,False,12,False,"Комнаты изолированы, неугловая, кондиционер.
Продаётся, квартира с авторским ремонтом, выполненным дорогостоящими материалами европейского производства, дорогая Сантехника, Окна Rehau, на окнах установлены решетки выдерживающее до 80 кг, установлена сигнализация, датчики движения, полный пакетом мебели, выполненной по проекту, техникой, кондиционерами, текстилем, коврами, все продуманно до мелочей, 4 комнаты: кухня- малая гостиная, гостиная, хозяйская спальня с гардеробной, санузлом с ванной, Детская со своей гардеробной, балкон технический, большая лоджия, гостевой санузел. Вся квартира очень ухоженная, чистая во всех смыслах, регулярный профессиональный уход. В общем заходите только с личными вещами и сразу живите!"
https://krisha.kz//a/show/673645068,1,10,10,nan,nan,28.0,nan,Шугыла 8 корпус 10,монолитный,nan,nan,nan,2022,Alma City,Алматы,Наурызбайский,nan,nan,балкон,False,металлическая,совмещенный,nan,nan,nan,False,2.8,False,False,False,False,False,False,False,False,False,True,True,True,True,True,True,True,True,True,True,True,True,17300000,False,2,False,"Черновая отделка, квартира сдана в эксплуатацию, все документы и ключи на руках. торг."
https://krisha.kz//a/show/678090712,4,4,5,Пр,nan,72.0,nan,nan,кирпичный,7.5,nan,хорошее,1986,nan,Алматы,Ауэзовский,nan,проводной,балкон,False,металлическая,раздельный,nan,nan,ламинат,False,2.8,False,False,False,False,False,False,False,False,True,True,True,True,True,True,True,True,True,True,True,True,True,39000000,False,6,False,"Светлая, уютная и теплая квартира. 
Имеется длинный балкон с видом на город и горы 
Торг уместен в пределах разумного 
Рассмотрим варианты обмена на частный дом в радиусе 15км от города. 
По всем вопросам звоните/пишите"
