uri,room_count,floor,max_floor,street,house_number,general_area,intersection,microdistrict,building_type,kitchen_area,living_area,condition,build_year,residential_complex,city,district,telephone,internet,balcony,is_balcony_glazed,door,bathroom,parking,furniture,floor_type,former_hostel,ceiling_height,bars_on_the_window,security,entry_phone,code_lock,alarm,video_security,video_entry_phone,concierge,exchange_possible,plastic_windows,non_angular,improved,rooms_isolated,studio_kitchen,kitchen_builtin,new_plumbing,pantry,counters,quiet_courtyard,air_conditioning,commercial_convenient,price,mortgaged,images_count,private_hostel,text
https://krisha.kz//a/show/675778386,3,10,10,Жунисова,14/6,90.0,nan,nan,монолитный,14.0,25.0,nan,2021,Alma City,Алматы,Наурызбайский,есть возможность подключения,ADSL,лоджия,True,металлическая,раздельный,рядом охраняемая стоянка,nan,ламинат,False,2.8,True,True,True,False,False,True,True,False,False,True,True,True,True,False,False,True,False,True,True,True,False,41500000,False,19,False,"Пластиковые окна, новая сантехника, неугловая, тихий двор, кондиционер, комнаты изолированы, счётчики, улучшенная.
Продам 3 ком квартиру с 
Евро ремонтом в ЖК АлмаСити. 
Квартира в экологическом чистом районе, район хорошо развивается, рядом школы, детские сады, поликлиника, цон, т/ц Апорт, Магнум. 
Продаётся квартира с ремонтом, ремонт сделали для себя, все материалы дорогие, обои Yudashkin, и т.д. 
Решетки в окнах, видеокамера, кондиционеры, природный газ, Планируется строительство Метро, Рядом строятся две школы русская и казахская. 
пересечение проспект Толеби и пр. Алатау можно в ИПотЕКУ программа Алматы жастары, әскер бағдарлама, и. тд Ипотека ға 100% болады барлық бағдарламаға, құжаттар толықтай дайын. Өзім Хозяинмін. 
Продам в связи с переездом в другой город. 
РИЭЛТОРЫ не беспокоить! Срочно"
https://krisha.kz//a/show/679026022,2,4,13,Навои,nan,52.0,Торайгырова,nan,монолитный,14.0,nan,хорошее,2018,Шахристан,Алматы,Бостандыкский,есть возможность подключения,ADSL,nan,True,металлическая,nan,паркинг,nan,ламинат,False,2.95,False,False,False,False,False,False,False,False,False,True,True,True,True,True,True,True,True,True,True,True,True,57900000,False,5,False,"Жилой комплекс для комфортной жизни со всеми удобствами КЛАССА бизнес, один из лучших ЖК в городе, с чистым горным воздухом. В комплексе есть детский сад, учебные центры, магазины, аптеки, стоматология, йога центр, фитнес центр, коворкинг центр, салоны красоты, кафе, ателье, кондитерская, сеть магазинов Marwin. 
 Двор очень красивый, зелёный, много цветов, деревьев, ограждённый, большой, с круглосуточной охраной, с видеонаблюдением, в каждом подъезде консьерж, 2 лифта-пассажирский и грузовой, трёхуровневый паркинг. Во дворе 4 больших детских площадок, 3 спортивных площадок для футбола, волейбола итд. В комплексе также есть красивый фонтан, рядом речка Алматинка. 
 Квартира на солнечной стороне, светлая, тёплая, уютная, с видом на горы, на речку, не угловая, с мебелью (встроенный кухонный гарнитур, все техники новые марки Samsung, Electrolux, есть кондиционер зима-лето, гардеробная от фирмы Aristo, счетчики все установленные, в балконе есть батарея, утеплённый, застеклен, есть решетки и сетки на окнах, интернет, итд). 
 Рядом находится Мега центр, Президентский парк и самые лучшие школы города. В перспективе есть проект бассейна в комплексе. В ЖК Шахристан очень приятно жить и детям и взрослым. 
 
‼️Если вы ищете квартиру с хорошей локацией +качество и комфорт, тогда вам нужно к нам! 
 
‼️Можно изменить все, но локацию нет!"
https://krisha.kz//a/show/678853522,2,4,5,nan,nan,60.0,nan,Айнабулак-4,панельный,nan,nan,среднее,1989,nan,Алматы,Жетысуский,nan,nan,nan,False,бронированная,раздельный,рядом охраняемая стоянка,nan,линолеум,False,2.8,False,False,False,False,False,False,False,False,False,True,True,True,True,True,True,True,True,True,True,True,True,36000000,False,19,False,None
https://krisha.kz//a/show/678951222,2,17,17,Аль,nan,73.3,nan,nan,монолитный,nan,nan,черновая отделка,2021,Metropole,Алматы,Бостандыкский,nan,nan,несколько балконов или лоджий,False,nan,nan,паркинг,nan,nan,False,3.0,False,True,False,False,False,True,False,True,False,False,False,False,False,False,False,False,False,False,True,False,False,75000000,False,3,False,"Тихий двор.
Продаётся квартира в жк Метрополь в черновой отделке, планировка свободная. Панорамный вид. Есть балкон и лоджия. 
Удобное расположение. Рядом находятся крупные проспекты, бизнес центры, торговые центры. 
Застройщик ЖК Metropole - BAZIS-А. 
Продажа от хозяина."
https://krisha.kz//a/show/678981435,2,1,9,nan,nan,60.0,nan,Мамыр-4,монолитный,10.0,nan,хорошее,2005,nan,Алматы,Ауэзовский,nan,nan,несколько балконов или лоджий,True,металлическая,раздельный,nan,nan,ламинат,False,2.8,False,False,False,False,False,False,False,False,False,True,True,True,True,True,True,True,True,True,True,True,True,43500000,False,14,False,"Чистая, уютная квартира со свежим ремонтом, 2 утеплённых балкона"
https://krisha.kz//a/show/679289905,2,2,5,nan,nan,65.0,nan,Тастак-2 25,панельный,nan,nan,nan,1978,nan,Алматы,Алмалинский,nan,nan,nan,False,nan,nan,nan,nan,nan,False,nan,False,False,False,False,False,False,False,False,False,True,True,True,True,True,True,True,True,True,True,True,True,38000000,False,6,False,Продам 2 комнатную квартиру 65 кв 2 этаж очень хорошая светлая. Продажа только за наличку. Торг
https://krisha.kz//a/show/678541881,3,2,5,Маркова,nan,72.0,Выше бульвара Бухар Жырау,nan,кирпичный,9.2,nan,хорошее,1984,nan,Алматы,Бостандыкский,отдельный,оптика,балкон и лоджия,False,бронированная,совмещенный,паркинг,nan,ламинат,False,2.8,True,False,True,True,False,True,False,False,False,True,True,True,True,False,False,False,False,True,True,False,True,60000000,False,17,False,"Пластиковые окна, неугловая, улучшенная, комнаты изолированы, счётчики, тихий двор, удобно под коммерцию.
Предлагаем очень привлекательное предложение на рынке недвижимости, безопасной и комфортной среды проживания. 
Дом построен в советское время с повышенной сейсмической устойчивостью, железо-бетонный каркас с заполнением стен в два кирпича, что позволяет расширить/перепланировать стены и увеличить площадь квартиры до 100 м2, без нарушения требований по устойчивости здания. 
Расположен в очень просторном, тупиковом, зеленом и тихом дворе, с футбольной и баскетбольной полями, тренажерными и детскими зонами. 
Развитая инфраструктура центра Бостандыкского района Алматы, рядом расположены поликлинника и мед центры, школы и детские сады, трц и супермаркеты, рко и банкоматы, цон и драматический театр, государственные университеты (КазГУ и Политех, Академия спорта и Энерго, IT и КазГЮУ), Центральный стадион и дворец спорта. 
В шаговой доступности парковая зона Достык и Ботанический сад, а также незабываемые пешие и вело прогулки (теренкур) по бульвару Бухар Жырау и благоустроенной набережной реки Есентай (Весновка) вверх до улицы Оспанова. 
Мы прожили в этом доме незабываемые годы своей жизни, и уверены, что у нового обладателя квартиры они будут также счастливыми."
https://krisha.kz//a/show/678716500,5,nan,nan,nan,nan,200.0,nan,Горный Гигант,монолитный,nan,nan,хорошее,2006,Эдельвейс,Алматы,Медеуский,отдельный,ADSL,несколько балконов или лоджий,True,бронированная,2 с/у и более,паркинг,nan,паркет,False,3.0,False,False,False,False,False,False,False,False,False,True,True,True,True,True,True,True,True,True,True,True,True,387000000,False,15,False,"«Гарденфлет» с собственным участком в жк Эдельвейс. Три спальни, три сан, узла, гардероб, зал 40 квм. Тёплые застекленные балконы, тёплый паркинг. третий этаж +60 квм. Идеальное расположение в городке, прекрасный ремонт, дорогая итальянская мебель, паркет и мрамор, сантехника Villeroy & Boch. Много экстра. Подходит под ипотеку"
https://krisha.kz//a/show/679398329,3,2,4,Акпаева,59/1,62.0,nan,nan,иное,7.0,nan,хорошее,1972,nan,Алматы,Жетысуский,отдельный,оптика,балкон,False,металлическая,раздельный,nan,nan,nan,False,2.5,False,False,False,False,False,False,False,False,False,True,True,True,True,True,True,True,True,True,True,True,True,37000000,False,17,False,"Дом ригельный, построен по Чешскому проекту, большие лестничные проемы. Решетки на всех окнах. Кондиционеры в двух комнатах. Во дворе новая детская площадка, рядом 108 школа. Рядом магазины, аптеки. Тихий район, хорошие соседи. 10-15 минут езды до центра города. Во дворе достаточно места для парковки"
https://krisha.kz//a/show/679446871,2,2,10,nan,nan,61.0,nan,Шугыла 340,монолитный,nan,nan,nan,2022,Alem City,Алматы,Наурызбайский,nan,nan,nan,False,металлическая,nan,паркинг,nan,nan,False,2.8,False,False,False,False,False,False,False,False,False,True,True,True,True,True,True,True,True,True,True,True,True,26800000,False,9,False,"Продам полноценную 2-х комн квартиру в перспективном районе наурызбайского района от застройщика Qazaqstroy… ЖК комфорт класса, с понорамными окнами, Фасад ЖК покрыт фиброцементными панелями… ЖК в пяти метрах от улицы Абая…Возле жилого комплекса в пяти метрах находятся Акимат наурызбайского района, ЦОН, и детский Алем парк. 2024 году не далеко отЖК появится станция Метро…. Комплекс достроен на 90%, через месяц планируется выдача ключей дольщикам… все правообладающие документы на руках. продажа по переуступке прав, только за наличный рассчет."
https://krisha.kz//a/show/679383542,2,3,15,Толе би,273/5,64.2,nan,nan,монолитный,nan,nan,хорошее,2016,Панорама,Алматы,Алмалинский,nan,ADSL,лоджия,True,nan,совмещенный,паркинг,nan,ламинат,False,2.7,False,False,False,False,False,False,False,False,False,True,True,True,True,True,True,True,True,True,True,True,True,42500000,False,7,False,"ЖК Панорама располагается в тихом и уютном Алмалинском районе неподалеку от улиц Толе би и Тлендиева. 
 
2ух комнатная квартира после ремонта, частично меблирована, с видом на озеро Сайран и горы. 
 
Пластиковые окна, неугловая, улучшенная, комнаты изолированы, кухня-студия. 
 
Большой подземный паркинг; охраняемый двор без машин; Школы, детские сады, Сайранский Парк Спортивного отдыха, рынок ""Тастак"", рынок ""Тулпар"" супермаркет ""Магнум"", поликлиники, медицинские центры, ТРЦ ""Гранд Парк"", все в шаговой доступности."
https://krisha.kz//a/show/678554870,3,6,9,nan,nan,75.8,Абая,Жетысу-2 67,панельный,12.0,nan,хорошее,1992,nan,Алматы,Ауэзовский,отдельный,оптика,балкон,True,бронированная,раздельный,рядом охраняемая стоянка,nan,линолеум,False,2.8,False,False,False,False,False,False,False,False,True,True,True,True,True,True,True,True,True,True,True,True,True,49000000,False,34,False,"Продаем квартиру в спальном районе со всеми удобствами. 
 
Квартира неугловая, теплая, с хорошим ремонтом. 
Окна качественные дерево-алюминиевые. Санузел раздельный. Удобная планировка. Отличная шумоизоляция. Сейсмоустойчивость 9 баллов. 
 
Удобное расположение. На пересечении Абая-Саина, быстрый доступ в любую точку города. Обилие общественного транспорта. Панорамный вид на горы и город. Первый двор от ул. Абая. 
 
Рядом: Магнум (400м. ), русские, казахские школы, детские сады, станция метро, аптеки, магазины. 
Также неподалеку Парк Family, ТРЦ: Sputnik, Moskva, Grand park. 7 минут до Mega Alma-ata. 5 минут до Парка первого президента. 
 
Большой двор, много деревьев, приветливые соседи. 
 В данный момент проводят облагораживание двора (замена асфальта, детской площадки, бардюров). 
 
документы все в порядке. Кв не в залоге. Можно в ипотеку. Маклеров, риэлторов убедительная просьба не беспокоить. Продаем только напрямую."
https://krisha.kz//a/show/678417328,3,3,5,nan,nan,115.0,nan,Думан-2 18,монолитный,12.0,nan,nan,2010,nan,Алматы,Медеуский,нет,оптика,nan,True,бронированная,2 с/у и более,nan,nan,ламинат,False,2.7,False,False,False,False,False,False,False,False,False,True,True,True,True,True,True,True,True,True,True,True,True,54500000,False,7,False,"Заменяны все окна ( балкон витраж). Новая входная дверь. Новые батареи. Встроенные гардеробные шкафы (1-общий, 1 в спальне). Большая современная кухня с встроенной техникой. Теплая и уютная квартира."
https://krisha.kz//a/show/679359006,3,9,13,Шаляпина,21,110.0,Шаляпина,Мамыр-7,монолитный,18.0,63.0,хорошее,2015,Cordial,Алматы,Ауэзовский,отдельный,оптика,несколько балконов или лоджий,False,металлическая,2 с/у и более,рядом охраняемая стоянка,полностью,ламинат,False,3.0,False,True,True,False,False,True,False,False,False,False,True,False,True,False,False,True,False,True,True,False,False,75000000,False,10,False,"Неугловая, комнаты изолированы, новая сантехника, счётчики, тихий двор.
В шаговой доступности станция метро ""Момышулы"", несколько школ, детских садов, аптеки, ТРЦ, супермаркеты. 
Квартира продается в связи с выездом на ПМЖ, поэтому остается большая часть мебели и техники (в т. ч. холодильник, стиральная машина и т.д. ) . 
В доме прекрасный ОСИ (КСК), хорошие соседи. 
Ипотека - ок. 
Также рассмотрю предложения в российских рублях (ор. 12М) ."
https://krisha.kz//a/show/679047281,1,4,7,Федосеева,38В,40.4,Микрорайон Жас Канат,nan,монолитный,nan,nan,nan,2022,Suly’ Tan,Алматы,Турксибский,есть возможность подключения,оптика,nan,False,металлическая,nan,nan,nan,nan,False,2.8,False,False,False,False,False,False,False,False,False,True,True,True,True,True,True,True,True,True,True,True,True,23500000,False,27,False,"1. Монолитное строение 2022 года 
2. документы на руках. 
3. Кредит можно. ОТБАСЫ БАНК, АЛМАТЫ ЖАСТАРЫ, ШАҢЫРАҚ, БАҚЫТТЫ ОТБАСЫ, ҰМАЙ. Любое можно 
4. Ипотека можно ОТБАСЫ БАНК, freedom bank можно 
5. Пенсионные можно 
6. Не угловая. Вид с окон во двор на детскую площадку. 
7. ремонт: электричество проведено, только обои, ламинат и кафель нужен. 
8. Фото реальные 
9. Автобусы во все направления. 
10. Рядом школа, поликлиника, детские сады. 
Я хозяин, звонить реальным клиентам."
https://krisha.kz//a/show/678845366,4,11,21,Толе би,nan,138.1,Варламова,nan,монолитный,nan,nan,nan,2012,nan,Алматы,Алмалинский,nan,nan,nan,True,бронированная,2 с/у и более,рядом охраняемая стоянка,nan,ламинат,False,2.8,False,False,False,False,False,False,False,False,True,True,True,True,True,True,True,True,True,True,True,True,True,90000000,False,12,False,"ЖК Каусар 
В связи с переездом, продаем частично меблированную квартиру(без техники) с дорогим качественным ремонтом. 
 
В ванных комнатах джакузи и душевая фирмы Appolo, раковины из натурального дерева и камня 
Качесвенное освещение в квартире (установленно более 60 фирменных софитов) и люстры фирмы Maytoni и Eglo. 
Дорогие *умные* пластиковые окна со сложным открыванием, решетки на балконе и всех окнах, бронированная входная дверь с дополнительно врезанными замками, Большой утепленный балкон с двумя входами с зала и детской, в тамбуре большая кладовая огороженная пластиком и тамбур закрыт на кодовый замок с видеонаблюдением. 
 
Расположенние квартиры: коридор с гардеробом, с правой стороны детская с ванной комнатой с джакузи и игровой комнатой (выход на балкон), с левой стороны ванна с душевой, большой гардероб, комната с двумя окнами, кухня -студия посередине квартиры с выходом на балкон. 
Телевиденние выведенно во всех 4 -х комнатах, кондиционеры установленны в 3 -х комнатах. 
В подьезде 3 скоростных лифта, перебоев со светом и водой нет, на площадке всего две квартиры и соседей не слышно. 
 Квартира очень теплая зимой (температура отопления регулируется) летом в квартире прохладно 
 
Территория комплекса огороженна забором с домофонной системой и охраняется охранным агенством, двор без машин, бесплатное парковочное место на охраняемой стоянке для собственников, диспетчерская находится в соседнем доме и работает круглосуточно, так же в комплексе есть свой сантехник и электрик. 
 
обмен рассмотрим на 1, 2 комнатную квартиру, можно в строящемся доме (старые дома не предлагать), так же варианты обмена на автомобиль. 
Все документы впорядке и подходят для ипотеки 
По запросу отправим фото и видео обзор квартиры с мебелью которая остается"
