uri,room_count,floor,max_floor,street,house_number,general_area,intersection,microdistrict,building_type,kitchen_area,living_area,condition,build_year,residential_complex,city,district,telephone,internet,balcony,is_balcony_glazed,door,bathroom,parking,furniture,floor_type,former_hostel,ceiling_height,bars_on_the_window,security,entry_phone,code_lock,alarm,video_security,video_entry_phone,concierge,exchange_possible,plastic_windows,non_angular,improved,rooms_isolated,studio_kitchen,kitchen_builtin,new_plumbing,pantry,counters,quiet_courtyard,air_conditioning,commercial_convenient,price,mortgaged,images_count,private_hostel,text
https://krisha.kz//a/show/679262811,1,3,5,Мкр,nan,40.0,nan,Саялы,монолитный,13.0,nan,хорошее,2015,в мкр. Саялы,Алматы,Алатауский,отдельный,ADSL,балкон,True,металлическая,совмещенный,паркинг,частично,nan,False,2.8,False,False,True,False,False,True,False,False,False,True,True,True,True,False,True,True,True,False,True,False,False,24400000,False,9,False,"Пластиковые окна, неугловая, улучшенная, комнаты изолированы, встроенная кухня, новая сантехника, кладовка, тихий двор.
Утеплённый болкон, центре Саялы перед авто Цоном, рядом 2 детские сады, 2 школы поликлиника, безопасный тихий двор хорошие соседи дружелюбные, сами живём на квартиру не сдавали, автобусы любую точку города, квартира очень теплая."
https://krisha.kz//a/show/672330488,3,1,6,nan,nan,176.0,nan,Юбилейный 33,nan,nan,nan,nan,2013,Европолис,Алматы,Медеуский,отдельный,оптика,nan,True,бронированная,2 с/у и более,паркинг,nan,паркет,False,3.0,False,True,True,False,True,True,True,False,False,False,True,True,True,True,True,True,False,True,True,True,False,215000000,False,41,False,"Тихий двор, кондиционер, неугловая, улучшенная, комнаты изолированы, кухня-студия, встроенная кухня, новая сантехника, счётчики.
Выгодное предложение! Крытый паркинг входит в стоимость. квартира полностью укомплектована. Планировка супер удобная, две спальни с отдельными санузлами и гардеробными, просторная студия с кухней, из всех комнат выход на просторные лоджии, отдельно гостевой санузел. Ремонт выполнен по авторскому дизайну престижной дизайн-студии. Все окна панорамные в пол, установлены дорогие алюминиевые раздвижные системы. Немецкая конвекторная система отопления. Кондиционеры премиум качества в каждой комнате. квартира покупалась в свободной планировке. Все межкомнатные стены выполнены по самым высоких техническим условиям. отличная шумоизоляция. Тёплый пол установлен под керамогранитным покрытием по всей квартире, остальное-паркетная доска. Использовались самые дорогие отделочные материалы, дерево, кожа, много зеркал. Дорогие эксклюзивные коллекции кафеля в санузлах. Входная дверь увеличена почти до размеров полной высоты, бронированная, облагороженная деревом. Сантехника ведущих европейских фирм, таких как Villeroy & Boch, дорогая техника, кухня полностью укомплектована техникой Franke, два холодильника встроенных, индукционная плита, посудомоечная машина на 60 см., мощная вытяжка. Ремонт выполнен в современной классике, подходит всем и под общий образ ЖК. Готовили для себя, с любовью к каждой детали. Полностью меблирована й эксклюзивной мебелью и предметами интерьера. В каждой комнате телевизор, гардеробные, много мест хранения, поместится всё. Хотите сохранить время и нервы, заезжайте в роскошную комфортную квартиру. Климат просто чудесный, летом прохладно, зимой тепло. Просторные лоджии, где тоже на полную высоту панорамные системы, можно открыть и наслаждаться свежим воздухом. Всё проведено, телефон, телевидение, под охранной системой Кузет, интернет оптоволокно. Всё новое, не жили. Сам ЖК расположен в престижном месте, чудесный воздух, шикарное озеленение, живописен в любое время года. Развитая внутренняя инфраструктура, можно не выезжать за пределы, есть всё, детские, спортивные площадки, магазины, ресторан и др. Гуляйте, занимаетесь спортом. Для ценителей престижа и комфорта. Возможна рассрочка."
https://krisha.kz//a/show/678026639,3,nan,nan,nan,nan,72.6,nan,Карасу 42,nan,23.2,nan,nan,2015,nan,Алматы,Алатауский,nan,nan,nan,False,nan,совмещенный,nan,nan,ламинат,False,2.8,False,True,False,False,False,False,False,False,False,True,False,False,False,True,False,False,True,False,True,True,False,28000000,False,22,False,"Кондиционер, пластиковые окна, кухня-студия, кладовка, тихий двор.
Продается уютная 3-комнатная квартира в коттеджном городке Карасу. 
 
Мебилирована. В хорошем состоянии. Со своим земельным участком 0.0204 га. Хорошие, дружелюбные соседи. 
 
В этом же доме продается похожая квартира с участком чуть меньше. Рассматриваем вариант покупки двух квартир сразу. 
 
Риэлторам не беспокоить!"
https://krisha.kz//a/show/679049268,2,3,6,Кажымукана,37,62.5,nan,nan,монолитный,nan,nan,хорошее,2007,Рапсодия,Алматы,Медеуский,nan,nan,лоджия,False,nan,nan,паркинг,nan,nan,False,3.0,False,False,False,False,False,False,False,False,False,True,True,True,True,True,True,True,True,True,True,True,True,62500000,False,3,False,"ЖК от Базис-А в верхней части города, экологически благоприятный район с удобной транспортной доступностью. Закрытый безопасный двор, детская площадка. Потолки 3.0 м. В шаговой доступности ТРЦ, школа, детский сад."
https://krisha.kz//a/show/678904254,3,9,10,Жунисова,12/7,65.0,nan,Шугыла,монолитный,nan,nan,nan,2019,nan,Алматы,Наурызбайский,nan,nan,nan,False,nan,раздельный,nan,nan,nan,False,nan,False,False,False,False,False,False,False,False,False,True,True,True,True,True,True,True,True,True,True,True,True,32500000,False,25,False,"Продам шикарную 3-х комнатную квартиру в ЖК Алма-Сити. 
Ламинат с фаской 33-го класса. 
Кухонный гарнитур из крашеного МДФ. 
В квартире никто не жил. 
Толе би пробивающейся в скором времени. 
 
Установлен дорогая сантехника. 
ВСЕ материалы качественные. 
Дорогой ремонт в современном стиле, делали профессионалы. 
В квартире ВСЕ продумано до мелочей. 
- розетка для кондиционера; 
- розетка для фена и бритвы в ванной. 
 
Во дворе имеется футбольная, детская игровая и тренажёрная площадка. Неугловая. Лифт работает. 
 
В шаговой доступности находится ТРЦ Апорт, Леруа Мерлен, рынок Алтын Орда, Акимат, ЦОН, ЗАГС, налоговый, прокуратура, много школ и садиков. 
 
Квартира не в залоге. Только за наличку."
https://krisha.kz//a/show/679575466,3,2,5,nan,nan,62.0,nan,Казахфильм 26,панельный,6.0,nan,хорошее,1977,nan,Алматы,Бостандыкский,есть возможность подключения,через TV кабель,nan,True,металлическая,nan,рядом охраняемая стоянка,nan,ламинат,False,nan,False,False,False,False,False,False,False,False,False,True,True,True,True,True,True,True,True,True,True,True,True,57000000,False,9,False,"Не угловая, новая сантехник, тихий двор, Решетки, сигнализация, Меблирована"
https://krisha.kz//a/show/675689748,5,5,6,Есенберлина,155,257.0,nan,nan,монолитный,nan,nan,nan,2014,Парк Горького,Алматы,Медеуский,nan,nan,nan,False,nan,nan,nan,nan,nan,False,3.0,False,False,False,False,False,False,False,False,False,True,True,True,True,True,True,True,True,True,True,True,True,180000000,False,43,False,"Эксклюзивную, уютную квартиру, с шикарным видом на озеро, горы, город и парк. Все делалось для себя и большой семьи, из современных материалов, й отделкой, эксклюзивной мебелью и декором. Все соответствует Фен-шую. Квартира двухуровневая с огромной верандой с изумительным видом. Теплая, уютная квартира с качественной встроенной техникой, теплыми полами с регуляторами, датчиками на каждое помещение и дополнительно смонтированными иновациями для безопасности всей семьи. Все строилось специалистами высшей категории (Умный дом). Бронированные двери с современной системой защиты. Кухонное оборудование немецкой фирмы BOSCH. Два сан узла. Две гардеробные. Окна с тройным стеклопакетом. Все стены с гидро, термо, паро – изоляцией. Дополнительно в стенах смонтирована Шумоизоляция. Много современных новшеств в строительстве. Круглосуточная охрана комплекса. Лифт. Дом граничит с большим парком и другими объектами социума. звоните, приходите, смотрите – всем Добра."
https://krisha.kz//a/show/679048857,1,2,4,nan,nan,33.0,Аносова,Тастак-3 42,панельный,nan,nan,хорошее,1978,nan,Алматы,Алмалинский,нет,оптика,балкон,True,металлическая,совмещенный,паркинг,nan,линолеум,False,2.8,False,False,True,True,False,True,False,False,False,True,False,False,False,False,True,True,False,True,True,False,False,25000000,False,12,False,"Пластиковые окна, встроенная кухня, новая сантехника, счётчики, тихий двор.
Состояние отличное 
заходи и живи. 
Рядом школы, поликлиника, оптовый рынок и т.д 
2 - ой этаж ! 
залогов нет, кредитов нет. 
В квартире не пьют, не курят."
https://krisha.kz//a/show/679363665,1,5,5,Шашкина,nan,34.0,Аль,nan,кирпичный,10.0,nan,хорошее,1990,nan,Алматы,Медеуский,nan,ADSL,nan,False,nan,nan,nan,nan,nan,False,2.7,False,False,False,False,False,False,False,False,False,True,True,True,True,True,True,True,True,True,True,True,True,60000000,False,7,False,"Во дворе школа и детский сад, парковка для авто, тихий двор, живописный вид из окон"
https://krisha.kz//a/show/678056090,2,7,17,Муканова,nan,120.0,Шевченко Муканова,nan,монолитный,23.0,nan,хорошее,2011,Театральный,Алматы,Алмалинский,отдельный,оптика,несколько балконов или лоджий,True,деревянная,2 с/у и более,паркинг,nan,паркет,False,3.0,False,True,True,False,True,False,False,True,False,False,True,False,True,False,False,True,False,False,True,False,False,95000000,False,7,False,"Тихий двор, комнаты изолированы, новая сантехника, неугловая.
Ремонт делали в марте 2022 года для себя, отличное состояние как техники, так и инженерии. 
На полу паркет, мрамор/гранит, двери шпон, стены ровные, тиккурила, сантехника, фурнитура Италия, кухня из высококлассных материалов с фурнитурной, Италия, Franke, техника Ariston практически новая, холодильник двухдверный LG. По всему дому тёплый пол, сигнализация. Авторский дизайн. Три Кондиционера GREE, выведены на одну сторону, что удобно для техобслуживания. Наша квартира вложений не требует. 
 
отдельно есть колясочная, удобная кладовка, вход из под’езда, внутри удобные стеллажи. По планировке это трехкомнатная квартира, так как в этой планировке ЖК идёт кухня студия, но у нас изолировано. Все комнаты огромные, коридоры и прихожая широкие. В доме три лифта, консьерж. 
Единственный дом в Алматы в котором не страшны землятресения, так как даже внутренние стены монолит. Внешние стены 50 см. монолит. Рядом парки, цирк, метро, магазины, рестораны, вся необходимая инфраструктура. 
 
ЖК для тех, кто ценит качество! До сих пор в ЖК живут архитекторы проекта, проектировщик и застройщик (!) ."
https://krisha.kz//a/show/675846883,1,3,13,nan,nan,45.0,Садвакасова,Аксай-5,монолитный,12.0,nan,хорошее,2014,Арыстан,Алматы,Ауэзовский,nan,nan,балкон,True,металлическая,совмещенный,рядом охраняемая стоянка,nan,ламинат,False,2.8,False,True,True,False,False,True,False,False,False,True,True,True,True,True,True,True,True,True,True,True,True,31500000,False,16,False,"Улучшенная тёплая однокомнатная квартира после ремонта, не угловая, третий этаж, входная дверь под видео наблюдением. В режиме онлайн можно смотреть за сохранностью входа в квартиру. Имеется большая прихожая, балкон остеклён. Новый ламинат, покрашены стены и потолки, новые окна, новая дверь металическая входная, новые межкомнатные двери, туалет и ванная в хорошем состояние. Люстры, шкаф и пуфик, встроенная большая кухня в длину более 4 метров, офисный стол на два компьютера, стиральная машина LG, холодильник, телевизор и кондиционер маРКи Samsung б/у все в отличном состоянии. При продажи мебель и техника остаётся. Коридоры и лифт освещены все под видеонаблюдением. Двор и детская площадка огорожены под видеонаблюдением и охраной. На этаже 4 квартиры. Рядом рынок Арыстан, Нархоз, магазин Small, школа, детский сад, салон красоты, магазины вся инфраструктура и выше станция метро имени Б. Момышулы. Все документы юридически в порядке. С момента постройки дома мы первые владельцы. Рассматриваем ипотеку. Продаём без посредников. Особая просьба риэлторов и агентов по недвижимости и т.д. не беспокоить. Спасибо за понимание. звонить с 09ч. 30м. до 22ч. ночи. С 12ч.30м. до 15ч. Обед."
https://krisha.kz//a/show/679359576,2,1,5,Тастак,2,50.0,nan,Тастак-2,панельный,10.0,30.0,nan,1987,nan,Алматы,Алмалинский,отдельный,nan,nan,True,бронированная,совмещенный,nan,без мебели,nan,False,2.5,False,False,False,False,False,False,False,False,False,True,True,True,True,True,True,True,True,True,True,True,True,29750000,False,7,False,"Дом расположен вдоль улицы Тлендиева, есть возможность под коммерцию: два балкона (кухня, зал), 5-ти этажный дом, возможность парковки для будущих клиентов вдоль ул. Тлендиева, удобно под магазин, салон, аптеку и т.д. 
Для жизни - тихий двор, спокойные соседи. квартира не угловая, теплая. 
Проведены все черновые затратные работы: электрика, отопление, подводка под кондиционеры, ТВ и т.д., балконы застекленные и утепленные (качественный пластик, немецкая фурнитура, система теплого пола), стены выровнены на чистовую (под обои/покраску). Будущему хозяину доделать только ""косметику"" на свой вкус. 
Развитая инфраструктура: рядом магазины, школа, детский сад, колледж, недалеко рынок Тастак, оз. Сайран в пешей доступности. Транспортная доступность - недалеко пр-т Райымбека, ул. Толе би. 
продается хозяевами, без риелторов. Под ипотеку проходит. Для реального покупателя возможен разумный торг."
https://krisha.kz//a/show/679509408,3,3,3,Алмалы,34/1,135.0,nan,nan,монолитный,nan,nan,свободная планировка,2022,Mountain Park,nan,nan,nan,проводной,nan,False,металлическая,2 с/у и более,паркинг,nan,nan,False,3.0,False,False,False,False,False,False,False,False,False,True,True,True,True,True,True,True,True,True,True,True,True,72000000,False,23,False,"Собственная терраса 105 кв отличный панорамный вид с квартиры также с террасы, закрытый охраняемый комплекс, чистый горный воздух, если не доступен звоните"
https://krisha.kz//a/show/678405399,3,3,5,nan,nan,61.0,nan,Алатау,панельный,6.0,nan,хорошее,1979,nan,Алматы,Медеуский,отдельный,ADSL,балкон,True,металлическая,совмещенный,nan,частично,линолеум,False,nan,False,False,False,False,False,False,False,False,False,True,True,False,True,False,True,True,True,True,True,True,False,28500000,False,8,False,"Пластиковые окна, тихий двор, кондиционер, неугловая, комнаты изолированы, встроенная кухня, новая сантехника, кладовка, счётчики.
Срочно продаётся квартира с мебелью и техникой, балкон утепленный. В ипотеку можно рассмотреть."
https://krisha.kz//a/show/673418622,3,2,13,Сатпаева,90/20,83.0,nan,nan,монолитный,12.0,nan,хорошее,2015,Симфония,Алматы,Бостандыкский,отдельный,оптика,балкон,True,металлическая,2 с/у и более,nan,без мебели,ламинат,False,2.8,True,False,True,False,False,False,False,False,False,True,False,True,True,False,True,False,False,True,True,False,True,61500000,False,10,False,"Пластиковые окна, улучшенная, комнаты изолированы, встроенная кухня, счётчики, тихий двор, удобно под коммерцию.
Площадь квартиры 84 м², три комнаты, два санузла, застекленный балкон, большой коридор и кухня, оборудованная кухонным гарнитуром, стиральной, посудомоечной машинами, духовым шкафом, индукционной плитой. ремонт. 
квартира находится на втором этаже 13-этажного дома, на первом этаже (под квартирой) расположены объекты коммерческой недвижимости. 
Рядом с ЖК «Симфония» расположены ТРЦ «АДК», станция метро «Сайран», протекает речка большая Алматинка."
https://krisha.kz//a/show/677909146,2,5,9,nan,nan,63.7,nan,Жас Канат 1,монолитный,9.0,nan,хорошее,2016,nan,Алматы,Турксибский,есть возможность подключения,проводной,балкон,True,деревянная,раздельный,nan,nan,линолеум,False,2.7,False,False,True,False,False,False,False,False,False,True,False,False,False,False,False,False,False,False,False,True,False,30000000,True,11,False,"Пластиковые окна, кондиционер.
Квартира в хорошем состоянии, тёплая, уютная, просторная, в ванной теплый пол, рядом парк, школа, садик, магазины, базары, магнум, аэропорт, соседи отзывчивые и приятные люди. Реальному покупателю хороший торг уместен. Ещё продаётся бизнес салон красоты за 2000000 торг есть!"
