uri,room_count,floor,max_floor,street,house_number,general_area,intersection,microdistrict,building_type,kitchen_area,living_area,condition,build_year,residential_complex,city,district,telephone,internet,balcony,is_balcony_glazed,door,bathroom,parking,furniture,floor_type,former_hostel,ceiling_height,bars_on_the_window,security,entry_phone,code_lock,alarm,video_security,video_entry_phone,concierge,exchange_possible,plastic_windows,non_angular,improved,rooms_isolated,studio_kitchen,kitchen_builtin,new_plumbing,pantry,counters,quiet_courtyard,air_conditioning,commercial_convenient,price,mortgaged,images_count,private_hostel,text
https://krisha.kz//a/show/678512215,1,11,12,Дарабоз,nan,44.8,nan,nan,монолитный,15.0,nan,хорошее,2018,Alatau City 2.0,Алматы,Алатауский,nan,ADSL,балкон,False,металлическая,совмещенный,паркинг,nan,ламинат,False,2.7,False,False,True,False,False,True,False,False,False,True,True,False,False,False,False,False,False,False,False,False,False,28500000,True,10,False,"Пластиковые окна, неугловая.
Теплая квартира, не угловая. Толстые стены, соседей за стеной вообще не слышно. есть детские площадки, места для парковки, красивый вид из окна на горы, дружные соседи, места для парковки всегда найдутся. есть два лифта грузовой и пассажирский, также есть лестница для любителей ходить пешком. рядом Алматы Арена, спорткомплекс, мечеть, есть где погулять, бегать и покататься на велосипеде. рядом есть детские сады, Магнум, магазинчики у дома."
https://krisha.kz//a/show/678564232,3,2,5,Зенкова,nan,83.0,Достык джамбула,nan,кирпичный,10.0,nan,nan,1975,nan,Алматы,Медеуский,nan,проводной,nan,False,бронированная,совмещенный,рядом охраняемая стоянка,полностью,nan,False,28.0,False,True,True,False,False,False,False,False,True,True,False,True,True,True,True,True,False,True,True,False,True,80000000,False,7,False,"Пластиковые окна, улучшенная, комнаты изолированы, кухня-студия, встроенная кухня, новая сантехника, счётчики, тихий двор, удобно под коммерцию.
Идеальный район, золотой квадрат, вид на Терренкур, двор огорожен, красивый, тихий, отличная детская площадка, мини-поле для футбола, охрана совмин безопасный район, имеется своя кладовая в подвале, тихий двор, готова ""к применению"", евроремонт, в 5 минутах 35 школа-гимназия. 
с мебелью ВНИМАНИЕ : ВАРИАНТЫ обмена НА г. МОСКВА"
https://krisha.kz//a/show/677679198,3,5,12,nan,nan,75.0,nan,Акбулак 1,монолитный,16.0,nan,хорошее,2022,Alatau City 2.0,Алматы,Алатауский,есть возможность подключения,ADSL,балкон и лоджия,True,nan,совмещенный,паркинг,nan,ламинат,False,2.8,False,False,False,False,False,False,False,False,False,True,True,True,True,False,True,True,False,False,False,True,False,46000000,False,13,False,"Улучшенная, кондиционер, пластиковые окна, комнаты изолированы, встроенная кухня, новая сантехника, неугловая.
Квартира с евро ремонтом вложений не требует. Заходи и живи !"
https://krisha.kz//a/show/672234099,1,4,5,nan,nan,36.0,nan,Айнабулак-3,панельный,6.0,nan,хорошее,1985,nan,Алматы,Жетысуский,отдельный,проводной,балкон,True,металлическая,совмещенный,рядом охраняемая стоянка,полностью,линолеум,False,nan,False,False,True,False,False,True,False,False,False,True,True,False,False,False,True,False,False,True,True,False,False,19800000,False,26,False,"Счётчики, встроенная кухня, неугловая, тихий двор, пластиковые окна.
Светлая и тёплая квартира. Свежий ремонт, новая сантехника. Отличные соседи и тихий двор. 
Риелторов просьба не беспокоить￼!"
https://krisha.kz//a/show/679221081,1,2,5,Масанчи,3,31.0,Масанчи,nan,панельный,6.0,nan,хорошее,1974,nan,Алматы,Алмалинский,nan,nan,балкон,True,nan,совмещенный,рядом охраняемая стоянка,nan,ламинат,False,nan,False,False,True,False,False,False,False,False,False,True,True,False,False,False,False,False,False,False,True,False,True,30000000,False,7,False,"Пластиковые окна, удобно под коммерцию, неугловая, тихий двор.
Квартира в центре города! Дом тёплый, шлагбаумы для заезда во дворы, детская площадка, рядом есть школа, садик, поликлиника, ТРЦ и удобная транспортная развязка! Все по шаговой доступности! продается все мебелью и бытовой техникой!"
https://krisha.kz//a/show/679208093,2,2,2,nan,nan,57.0,nan,Алмагуль 55,иное,6.0,nan,требует ремонта,1987,nan,Алматы,Бостандыкский,nan,nan,nan,False,nan,nan,nan,nan,nan,False,nan,False,False,False,False,False,False,False,False,False,True,True,True,True,True,True,True,True,True,True,True,True,30000000,False,5,False,"Срочно продаём квартиру, в хорошем районе, рядом есть всё (школа, детский сад, магазины, торговые дома) мы сами хозяева, сами проживаем тоже в этом районе, идеальные условия для семейных!"
https://krisha.kz//a/show/677933489,2,16,17,Толе би,185А,55.0,nan,nan,монолитный,nan,nan,хорошее,2022,Assem Plaza,Алматы,Алмалинский,nan,nan,nan,False,деревянная,nan,паркинг,частично,ламинат,False,3.0,True,True,True,False,False,True,False,True,False,True,False,False,False,True,True,True,False,True,True,True,False,53000000,False,26,False,"Пластиковые окна, кухня-студия, встроенная кухня, новая сантехника, счётчики, тихий двор, кондиционер.
Продается квартира в новом ЖК бизнес класса, который расположен в старом центе нашего города. Мега 
развитая инфраструктура, позволяет легко добраться до любой точки города. Рядом в пяти минутах ходьбы, находятся две школы. В квартире сделан полностью чистовой ремонт, использованны только дорогие материалы. высота потолков 3 м. Квартира светлая и очень уютная, никто не жил, вы будете первым хозяином. Частично мебелированная, заезжай и живи!"
https://krisha.kz//a/show/676258642,5,2,3,Природа,70,255.0,Дулати,nan,монолитный,19.99,nan,nan,2022,California,Алматы,Бостандыкский,nan,nan,nan,False,nan,2 с/у и более,паркинг,nan,nan,False,3.3,False,False,False,False,False,False,False,False,False,True,True,True,True,True,True,True,True,True,True,True,True,150000000,False,7,False,"CALIFORNIA — это современные таунхаусы класса премиум на территории престижного района в предгорье Алматы. Недалеко от Президентского парка, в 6 минутах от пр. Аль-Фараби по ул. Дулати. 
 
Преимущества: 
 
💥На территории 20 таунхаусов класса Элит 
 
💥Ворк-аут зона 
 
💥Паркинг личный и гостевой 
 
💥Личная прилегающая территория каждого таунхауса 
 
💥Барбекю зона 
 
💥Собственная большая терраса у каждого таунхауса 
 
💥Максимально зелёная территория (Ели, Ивы, Туи тд) 💥КПП и Кузет 24/7 
 
💥Детская площадка 
 
💥Приватный элитный городок из 20 таунхаусов 
 
В подарок от Застройщика: 
 
Паркинг на 2 машины 
Терраса под ключ 
Внутренние стены под ваш план 
Теплые полы (водяные) Стяжка 
Газовый котел 
 
Архитектура 
 
CALIFORNIA включают более двадцати комфортабельных двухэтажных таунхаусов с большими панорамными окнами, открытыми балконами и продуманными эргономичными планировками. дома спроектированы в едином архитектурном стиле хай-тек. Таунхаусы построены из качественных и экологически безопасных материалов по монолитно-каркасной технологии, которая отвечает высоким показателям сейсмостойкости. Внешние стены домов утеплены долговечным и экологичным теплоизолятором. Облицовка фасадов выполнена из натуральных отделочных материалов. 
 
Что находится рядом? 
 
В ближайшем окружении Таунхаусов CALIFORNIA есть все необходимое для комфортной городской жизни – кафе, магазины, детские сады, образовательные учреждения, аптеки, школы NGS и TAMOS. На расстоянии чуть более чуть более километра есть рынок, медицинские учреждения, салоны красоты и спортивный комплекс. На машине всего за 10 минут можно доехать до крупного ТРЦ и городского парка. От таунхаусов есть удобный выезд на проспект, позволяющий добраться практически в любую часть города. Удобный выезд на проспект Аль-Фараби, до которого можно добраться за шесть минут, позволит без труда доехать в нужную часть Алматы. 
 
Внутри жилого комплекса 
 
Таунхаусы CALIFORNIA в Алматы находятся на полностью огороженной территории, куда закрыт вход для посторонн"
https://krisha.kz//a/show/679202258,1,8,10,Жунисова,10,29.0,nan,Шугыла,монолитный,6.0,nan,хорошее,2020,Alma City,Алматы,Наурызбайский,nan,nan,балкон,False,металлическая,совмещенный,рядом охраняемая стоянка,nan,ламинат,False,2.8,False,False,True,False,False,True,False,False,False,True,False,False,False,True,False,True,False,True,True,False,False,23000000,False,7,False,"Пластиковые окна, кухня-студия, новая сантехника, счётчики, тихий двор."
https://krisha.kz//a/show/672709122,3,4,5,nan,nan,90.0,nan,Думан-2 1-30,монолитный,20.0,nan,хорошее,2015,Меркур Град,Алматы,Медеуский,есть возможность подключения,ADSL,балкон и лоджия,True,металлическая,2 с/у и более,рядом охраняемая стоянка,nan,паркет,False,2.5,True,True,True,True,True,True,False,False,True,True,True,True,True,True,True,True,True,True,True,True,False,72000000,False,13,False,"Тихий двор, счётчики, кухня-студия, неугловая, пластиковые окна, комнаты изолированы, новая сантехника, встроенная кухня, улучшенная, кладовка, кондиционер.
Мы первые хозяева, дома практически не жили. ремонт делали для себя, в аренду не сдавали, рядом Магнум, школа, садик, магазины. От центра города 10 минут. Очень удобно. Свежий воздух и очень тихо на районе."
https://krisha.kz//a/show/675571690,2,2,19,Брусиловского,167,75.0,nan,nan,монолитный,nan,nan,хорошее,2012,Алтын Булак,Алматы,Алмалинский,нет,оптика,балкон,True,металлическая,2 с/у и более,паркинг,nan,ламинат,False,2.8,True,True,True,False,False,False,False,False,False,False,False,True,False,True,True,True,False,True,True,True,False,55000000,False,18,False,"Кондиционер, улучшенная, кухня-студия, встроенная кухня, новая сантехника, счётчики, тихий двор.
В СТОИМОСТЬ ВХОДИТ +2 парковочных места. 
Вашему вниманию 2х комнатная квартира в жк Алтынбулак-2. Общая квадратура 75 кв. м. 
Второй этаж! 
В зимнее время очень тёплая, даже можно сказать слишком. В каждой комнате кондиционеры, которые почти не включали. Дорогая кухня, сделанная на заказ, со встроенной техникой. Квартира удобная для молодой семьи. Коммунальная квартплата ~ 30.000 тг. 
В квартире два санузла. Большая и малая ванные комнаты. Вся сантехника качественная и дорогая. При ремонте использованы дорогие материалы. Большой хол. Квартира очень светлая. Чтобы бы вы понимали общее количество лампочек по всей квартире 68 шт. Дорогие люстры. 
Дорогие замки входной двери. На всех окнах защитные решётки от выпадения детей. 
К квартире прилагаются два парковочных места, которые расположены рядом. Парковочные места расположены прям возле лифта. Что очень удобно. 
Все документы чистые, не в залоге, готовые к сделке. 
На уровне P1 где расположен паркинг имеются большое количество магазинов, нотариус, компьютерный клуб, ателье, развивашки для детей, салон красоты, химчистка, и диспетчерская жилого комплекса. А также в двух шагах имеются различные спортивные секции для взрослых и детей. 
А самый жирный плюс этого жк, большая детская площадка, куда не запускают транспорт. Где ваши дети смогут кататься на самокатах, велосипедах, и вы не будете переживать за своих детей. Детская площадка отлично проветривается. 
В шаговой доступности находится метро. 
Жк охраняется и имеет кпп для контроля въезда автотранспорта. 
С риэлторами не работаем!"
https://krisha.kz//a/show/679012008,2,7,12,Райымбека,524,74.6,Момышулы,nan,монолитный,11.0,nan,хорошее,2022,Shahar,nan,nan,nan,ADSL,лоджия,False,металлическая,раздельный,паркинг,nan,ламинат,False,2.7,False,True,True,False,True,True,False,False,False,True,True,True,True,True,True,True,True,True,True,True,True,48000000,False,20,False,"Светлая и уютная квартира в новом доме с паркингом и охраняемой территорией; закрытый двор, два шлагбаума; отличная инфраструктура. В квартире все новое: мебель и техника, никто не жил ранее. Прямая продажа от собственника. 
В ипотеку проходит. 
Полный пакет документов, без долгов и залогов. 
К риэлторам просьба не беспокоить."
https://krisha.kz//a/show/670042299,3,1,13,Муратбаева,14/6,96.0,Макатаева,nan,монолитный,22.0,nan,хорошее,2021,12 месяцев,Алматы,Алмалинский,nan,ADSL,nan,False,nan,совмещенный,nan,nan,ламинат,False,2.8,True,True,True,False,False,True,True,True,False,True,True,True,False,False,True,True,False,True,True,True,True,61000000,False,30,False,"Пластиковые окна, тихий двор, кондиционер, удобно под коммерцию, неугловая, улучшенная, встроенная кухня, новая сантехника, счётчики.
Место хорошее. Жк 12 месяцев. Связи с переездом продаётся светлая квартира. Ремонт делали для себя. Тёплые полы. Евроремонт. Встроенная мебель и техника. С мебелью. дом новый. Рядом Мега, школы, садики."
https://krisha.kz//a/show/678503847,3,3,7,Вахтангова,nan,97.4,Вахтангова,nan,монолитный,nan,nan,хорошее,2015,nan,Алматы,Бостандыкский,отдельный,nan,лоджия,False,бронированная,раздельный,рядом охраняемая стоянка,nan,ламинат,False,nan,False,True,False,False,True,False,False,False,False,True,True,True,True,True,True,True,True,True,True,True,True,72000000,False,47,False,"Квартира на 3 этаже, хороший ремонт, мебель, большой гардероб, светлая. Парковка у дома. Рядом магазины. Школы. Потолки 2.75 . Со всей бытовой техникой. Возможно под ипотеку"
https://krisha.kz//a/show/671904892,3,2,9,Сейфуллина,nan,78.0,Абая,nan,кирпичный,15.0,nan,хорошее,1984,nan,Алматы,Алмалинский,nan,через TV кабель,балкон и лоджия,True,бронированная,раздельный,рядом охраняемая стоянка,nan,ламинат,False,2.8,True,False,True,False,False,True,False,False,False,True,True,True,True,False,True,True,True,True,True,True,False,60000000,False,12,False,"Пластиковые окна, неугловая, улучшенная, комнаты изолированы, встроенная кухня, новая сантехника, кладовка, счётчики, тихий двор, кондиционер.
Продам 3 ком квартиру с евроремонтом большая круговая лоджия и кладовая ремонт сделана по дизайну шикарный ремонт решоточный болкон окна. пол подогрев тёплая уютная ухоженная. с белым ремонтом. Рядом центральный стадион школа центральный цирк зелёная парк. роддом Аптека супермаркет и магазины ресторан центральный стадион. Онкологический центр глазная больница детсад стомотолгический центр 
."
https://krisha.kz//a/show/679404495,3,10,12,Жандосова,94А,80.0,nan,nan,монолитный,nan,nan,nan,2022,Rams City,Алматы,Бостандыкский,nan,nan,nan,False,nan,nan,nan,nan,nan,False,2.7,False,False,False,False,False,False,False,False,False,True,True,True,True,True,True,True,True,True,True,True,True,53900000,False,2,False,"Too RAMS Qazaqstan, 1 очередь, 2022 год 4 квартал, Реклама размещена с целью изучения спроса. 
Договоры о долевом участии будут заключаться только после предоставления гарантии от Единого оператора жилищного строительства или выдачи разрешения на привлечение денег дольщиков местным исполнительным органом"""
https://krisha.kz//a/show/675427969,1,7,7,nan,nan,50.0,nan,Мирас 31,монолитный,nan,nan,хорошее,2016,Miras Park,Алматы,Бостандыкский,nan,nan,nan,False,nan,nan,паркинг,nan,nan,False,3.3,False,False,False,False,False,False,False,False,False,True,True,True,True,True,True,True,True,True,True,True,True,51000000,False,9,False,None
https://krisha.kz//a/show/675438578,4,4,13,Макатаева,131,120.0,Муратбаева,nan,монолитный,15.0,nan,хорошее,2020,Atlant,Алматы,Алмалинский,есть возможность подключения,оптика,nan,False,бронированная,2 с/у и более,паркинг,nan,паркет,False,2.8,False,False,True,False,False,True,False,False,False,True,True,True,True,False,True,True,True,True,True,True,False,91000000,False,67,False,"Пластиковые окна, тихий двор, кондиционер, неугловая, улучшенная, комнаты изолированы, встроенная кухня, новая сантехника, кладовка, счётчики.
Продаётся шикарная квартира в отличном районе Алматы. Ремонт выполнен в стиле неоклассики. Стены потолки выровнены г.псокартоном. Вся техника встроенная Италия FRANKE. Все окна были заменены, замки со сложным открыванием. Мебель вся сделана под заказ МДФ крашенный. По дому имеются тёплые полы. Сантехника вся дорогая GROHE. Очень уютная, тёплая квартира, просто заезжай и живи. Самое главное это район и расположение дома. Все рядом, базары, школы, сады, mega и т.д. Очень развитая инфраструктура. Один раз пожив в этом районе, больше не захотите съезжать."
https://krisha.kz//a/show/672408442,3,3,5,nan,nan,72.0,Жандосова,Мамыр 3,кирпичный,11.0,nan,nan,1992,nan,Алматы,Ауэзовский,отдельный,проводной,nan,True,металлическая,раздельный,рядом охраняемая стоянка,nan,линолеум,False,2.6,False,False,True,False,False,False,False,False,False,True,True,True,True,True,True,True,True,True,True,True,True,41000000,False,13,False,"Квартира находится экологический чистом районе, тёплая, уютная, светлая все доступно магазины, супермаркеты не дорогие, рядом школа, детский сад в общем классное расположение, не угловая, не залоговая, новая обновленная площадка, все комнаты изолированные, туалет с ванной комнаты раздельные, только звонить реальному покупателю это район Жандосова Яссауи мкр Мамыр срочная продажа"
