uri,room_count,floor,max_floor,street,house_number,general_area,intersection,microdistrict,building_type,kitchen_area,living_area,condition,build_year,residential_complex,city,district,telephone,internet,balcony,is_balcony_glazed,door,bathroom,parking,furniture,floor_type,former_hostel,ceiling_height,bars_on_the_window,security,entry_phone,code_lock,alarm,video_security,video_entry_phone,concierge,exchange_possible,plastic_windows,non_angular,improved,rooms_isolated,studio_kitchen,kitchen_builtin,new_plumbing,pantry,counters,quiet_courtyard,air_conditioning,commercial_convenient,price,mortgaged,images_count,private_hostel,text
https://krisha.kz//a/show/679229055,2,2,9,Мкр Сайран,1,52.1,nan,Сайран,панельный,7.9,29.7,хорошее,1979,nan,Алматы,Ауэзовский,отдельный,nan,балкон и лоджия,True,металлическая,раздельный,паркинг,полностью,линолеум,False,2.5,True,False,True,False,True,False,False,False,False,False,True,False,True,False,False,False,True,True,True,True,False,37000000,False,16,False,"Неугловая, комнаты изолированы, кладовка, счётчики, тихий двор, кондиционер.
Светлая и уютная 2-х комнатная квартира. Полностью меблирована, квартира с изолированными комнатами на 2-м. этаже в спальном районе с развитой инфраструктурой. Из квартиры прекрасны вид на горы, свежий воздух, хорошие соседи. Удобное расположение в пешей доступности метро и все магазины. 
Торг уместен! 
Можно рассмотреть вариант ипотеки."
https://krisha.kz//a/show/679583961,1,12,14,1,nan,40.0,nan,Акбулак,монолитный,nan,nan,хорошее,2017,Алмалы,Алматы,Алатауский,nan,nan,балкон,False,nan,совмещенный,nan,nan,nan,False,nan,False,False,False,False,False,False,False,False,False,True,True,True,True,True,True,True,True,True,True,True,True,28700000,False,13,False,"Продам квартиру 1-комнатную в мкр. Алмалы, напротив Алматы Арена, не угловая, солнечная сторона, свежий ремонт, по квартире остается вся мебель и техника. Можно через банк! Все нужное находится рядом с домом."
https://krisha.kz//a/show/678745298,4,1,2,Кастеева,nan,123.0,nan,nan,кирпичный,14.0,72.0,хорошее,2005,nan,Алматы,Медеуский,отдельный,оптика,nan,False,металлическая,2 с/у и более,паркинг,без мебели,ламинат,False,2.7,True,False,False,False,False,True,True,False,False,True,True,True,True,True,True,True,True,True,True,True,True,139000000,False,33,False,"Продается квартира на 1 этаже дуплекса, расположенного в хорошем районе городе. Удобный выезд в сторону ""золотого квадрата"", на ВОАД, пр. Аль-Фараби и улицу Толе-Би. К квартире прилагается огороженная парковка на 3 машины, цокольный этаж для хранения какого-либо инвентаря или мелочей по дому. На картинках отражена 3D визуализация всех комнат, в соответствии с которыми будут завершены СМР. В продажную цену входит: завершенные ремонтные работы по потолкам, по полу всей квартиры, стенам включая декоративные элементы из лепнины, латуни, зеркалам, 3D панелям. Будут установлены инсталляций под унитазы и гигиенические души в санузлах, двери и обналичники к ним, кондиционеры в каждой комнате. На въезде на парковку квартиры есть ограждение и автоматические ролл-ворота. 
 
Покупателю необходимо купить и подобрать по своему вкусу и предпочтению гигиеническую технику в санузлы, бытовую технику на кухню и по квартире, люстры и мебель. 
 
Строительно-монтажные работы будут завершены к дате 31.10.2022. На втором этаже дуплекса будет проживать семья, которая не прочь заранее познакомиться со своими будущими соседями :-)"
https://krisha.kz//a/show/679091220,2,4,9,Райымбека,590/7,61.5,nan,Шугыла,монолитный,9.5,nan,nan,2022,Nurly Dala,Алматы,Наурызбайский,nan,проводной,балкон,False,металлическая,совмещенный,nan,nan,nan,False,2.7,False,False,False,False,False,False,False,False,False,True,True,True,True,True,True,True,True,True,True,True,True,29400000,False,10,False,"Продам двухкомнатную квартиру. Жилой район NURLY DALA, расположен по проспекту Раймбека напротив торгово-развлекательного комплекса APORT MALL. Перспективный, развивающийся район с хорошей транспортной доступностью. квартира после ремонта, светлая, теплая. год постройки 2022год. Общая площадь 61.5. Кухня 9.5 Распашонка. 4 этаж. На этаже четыре квартиры. Лифт. Окна выходят на двор и на улицу Раймбека. Большая парковка. Рядом остановка, базар, Magnum. документы на руках. Срочно. Торг. Обращаться по тел"
https://krisha.kz//a/show/679093084,3,3,12,Басенова,10,80.0,Гагарина,nan,монолитный,nan,nan,хорошее,2022,Basenova 10,Алматы,Бостандыкский,есть возможность подключения,оптика,лоджия,True,металлическая,совмещенный,паркинг,nan,ламинат,False,3.0,False,False,False,False,False,False,False,False,False,True,True,True,True,True,True,True,True,True,True,True,True,79800000,False,21,False,"В стоимость входит вся корпусная мебель и встраиваемая техника 
📌* Кухня изготовлена из качественных материалов, каменная столешница, полностью укомплектована лучшей техникой Electrolux, samsung, фильтр Ecosoft (немецкий). 
📌* Все смесители Grohe 
📌* Дорогая корпусная и мягкая мебель. 
📌* Итальянский широкоформатный керамогранит 
📌* Немецкий ламинат 
 
* Шикарный район в шаговой доступности есть все, поликлиника, роддом, парки, трц Mega, базары, рестораны, magnum, развитая транспортная инфраструктура, при этом ЖК достаточно удалён от шума 
📌Окна не смотрят на соседние блоки 
📌Так же большим плюсом является то что все квартиры по соседству закончили ремонт 
📌По соседству нет съёмных квартир."
https://krisha.kz//a/show/679583961,1,12,14,1,nan,40.0,nan,Акбулак,монолитный,nan,nan,хорошее,2017,Алмалы,Алматы,Алатауский,nan,nan,балкон,False,nan,совмещенный,nan,nan,nan,False,nan,False,False,False,False,False,False,False,False,False,True,True,True,True,True,True,True,True,True,True,True,True,28700000,False,13,False,"Продам квартиру 1-комнатную в мкр. Алмалы, напротив Алматы Арена, не угловая, солнечная сторона, свежий ремонт, по квартире остается вся мебель и техника. Можно через банк! Все нужное находится рядом с домом."
https://krisha.kz//a/show/678745298,4,1,2,Кастеева,nan,123.0,nan,nan,кирпичный,14.0,72.0,хорошее,2005,nan,Алматы,Медеуский,отдельный,оптика,nan,False,металлическая,2 с/у и более,паркинг,без мебели,ламинат,False,2.7,True,False,False,False,False,True,True,False,False,True,True,True,True,True,True,True,True,True,True,True,True,139000000,False,33,False,"Продается квартира на 1 этаже дуплекса, расположенного в хорошем районе городе. Удобный выезд в сторону ""золотого квадрата"", на ВОАД, пр. Аль-Фараби и улицу Толе-Би. К квартире прилагается огороженная парковка на 3 машины, цокольный этаж для хранения какого-либо инвентаря или мелочей по дому. На картинках отражена 3D визуализация всех комнат, в соответствии с которыми будут завершены СМР. В продажную цену входит: завершенные ремонтные работы по потолкам, по полу всей квартиры, стенам включая декоративные элементы из лепнины, латуни, зеркалам, 3D панелям. Будут установлены инсталляций под унитазы и гигиенические души в санузлах, двери и обналичники к ним, кондиционеры в каждой комнате. На въезде на парковку квартиры есть ограждение и автоматические ролл-ворота. 
 
Покупателю необходимо купить и подобрать по своему вкусу и предпочтению гигиеническую технику в санузлы, бытовую технику на кухню и по квартире, люстры и мебель. 
 
Строительно-монтажные работы будут завершены к дате 31.10.2022. На втором этаже дуплекса будет проживать семья, которая не прочь заранее познакомиться со своими будущими соседями :-)"
https://krisha.kz//a/show/679091220,2,4,9,Райымбека,590/7,61.5,nan,Шугыла,монолитный,9.5,nan,nan,2022,Nurly Dala,Алматы,Наурызбайский,nan,проводной,балкон,False,металлическая,совмещенный,nan,nan,nan,False,2.7,False,False,False,False,False,False,False,False,False,True,True,True,True,True,True,True,True,True,True,True,True,29400000,False,10,False,"Продам двухкомнатную квартиру. Жилой район NURLY DALA, расположен по проспекту Раймбека напротив торгово-развлекательного комплекса APORT MALL. Перспективный, развивающийся район с хорошей транспортной доступностью. квартира после ремонта, светлая, теплая. год постройки 2022год. Общая площадь 61.5. Кухня 9.5 Распашонка. 4 этаж. На этаже четыре квартиры. Лифт. Окна выходят на двор и на улицу Раймбека. Большая парковка. Рядом остановка, базар, Magnum. документы на руках. Срочно. Торг. Обращаться по тел"
https://krisha.kz//a/show/679093084,3,3,12,Басенова,10,80.0,Гагарина,nan,монолитный,nan,nan,хорошее,2022,Basenova 10,Алматы,Бостандыкский,есть возможность подключения,оптика,лоджия,True,металлическая,совмещенный,паркинг,nan,ламинат,False,3.0,False,False,False,False,False,False,False,False,False,True,True,True,True,True,True,True,True,True,True,True,True,79800000,False,21,False,"В стоимость входит вся корпусная мебель и встраиваемая техника 
📌* Кухня изготовлена из качественных материалов, каменная столешница, полностью укомплектована лучшей техникой Electrolux, samsung, фильтр Ecosoft (немецкий). 
📌* Все смесители Grohe 
📌* Дорогая корпусная и мягкая мебель. 
📌* Итальянский широкоформатный керамогранит 
📌* Немецкий ламинат 
 
* Шикарный район в шаговой доступности есть все, поликлиника, роддом, парки, трц Mega, базары, рестораны, magnum, развитая транспортная инфраструктура, при этом ЖК достаточно удалён от шума 
📌Окна не смотрят на соседние блоки 
📌Так же большим плюсом является то что все квартиры по соседству закончили ремонт 
📌По соседству нет съёмных квартир."
https://krisha.kz//a/show/678973958,2,9,9,nan,nan,60.4,Улугбека,Аксай-4 57,панельный,12.0,nan,хорошее,1985,nan,Алматы,Ауэзовский,nan,nan,nan,False,nan,nan,nan,nan,nan,False,nan,False,False,False,False,False,False,False,False,False,True,True,True,True,True,True,True,True,True,True,True,True,39000000,False,23,False,"Лучшая Аксайская квартира! Заходи и живи. Встроенная мебель по дизайнерскому проекту, бытовая техника, окна пластиковые с москитными сетками, снаружи вся квартира утеплена дополнительно, в подъезде свежий ремонт и новый лифт."
https://krisha.kz//a/show/677439130,1,3,12,Абишева,36/6,37.5,nan,nan,монолитный,nan,nan,хорошее,2021,Gulder,Алматы,Наурызбайский,есть возможность подключения,nan,балкон,True,металлическая,совмещенный,рядом охраняемая стоянка,частично,ламинат,False,2.7,False,True,True,True,False,True,False,False,False,True,True,True,True,False,True,True,False,True,True,False,False,27800000,False,12,False,"Пластиковые окна, неугловая, улучшенная, комнаты изолированы, встроенная кухня, новая сантехника, счётчики, тихий двор.
Улучшенная новая квартира, качественный ремонт, хорошая фурнитура (турецкие розетки, полипропиленовый плинтусы, хорошие межкомнатные двери с итальянскими ручками, с красивыми люстрами, ламинат с фаской), встроенный вместимый кухонный гарнитур с качественной бытовой техникой, новая сантехника, охраняемая территория с красивой и безопасной детской и игровой площадкой, по периметру жилого комплекса парковка и видеонаблюдение, развитая транспортная инфраструктура, рядом поликлиники, магазины, торговые дома и рынки, документы в порядке, возможно под ипотеку"
https://krisha.kz//a/show/677157286,3,1,5,nan,nan,76.0,nan,Саялы 127,монолитный,12.0,nan,nan,2018,в мкр. Саялы,Алматы,Алатауский,nan,nan,nan,False,nan,2 с/у и более,паркинг,nan,линолеум,False,2.7,False,False,False,False,False,False,False,False,False,True,False,True,True,False,False,True,False,False,True,False,True,36000000,False,7,False,"Комнаты изолированы, тихий двор, новая сантехника, удобно под коммерцию, пластиковые окна, улучшенная.
Продаётся квартира с лучшей квадратурой в мкр Саялы. Рядом школа детский сад, авто ЦОН. Можно подкомерцию."
https://krisha.kz//a/show/678579855,1,4,5,Утеген батыра,21,34.0,nan,nan,панельный,10.0,nan,nan,1986,nan,Алматы,Ауэзовский,nan,nan,nan,True,металлическая,совмещенный,рядом охраняемая стоянка,nan,линолеум,False,2.8,False,False,False,False,False,False,False,False,False,True,True,True,True,True,True,True,True,True,True,True,True,25100000,False,8,False,"Однокомнатная квартира с мебелью на 4 этаже 5 этажного дома с большим балконом. 
Не угловая, не в залоге, можно через ипотеку. Просьба риэлторов не беспокоить."
https://krisha.kz//a/show/676624895,5,3,7,Мкр,nan,213.0,nan,Мирас,монолитный,nan,nan,nan,2016,Miras Park,Алматы,Бостандыкский,nan,nan,nan,True,металлическая,2 с/у и более,паркинг,nan,nan,False,3.3,False,False,False,False,False,False,False,False,False,True,True,True,True,True,True,True,True,True,True,True,True,190000000,False,12,False,"Новый ремонт, новая мебель. никто не жил. 
4 изолированные спальни и большая гостиная, совмещённая с кухней-столовой. плита изолирована от основного помещения кухни, чтобы не разносились запахи. красивый интерьер. ручное декорирование стен. 
полный набор мебели. 
все сделано качественно. 
в каждой комнате есть балкон."
https://krisha.kz//a/show/675704949,3,1,9,nan,nan,91.4,nan,Калкаман-2 24,монолитный,nan,nan,хорошее,2009,nan,Алматы,Наурызбайский,есть возможность подключения,оптика,несколько балконов или лоджий,True,металлическая,раздельный,nan,полностью,ламинат,False,2.7,False,False,True,True,False,True,False,False,False,True,False,False,False,True,True,True,False,True,False,True,False,43000000,False,25,False,"Пластиковые окна, кухня-студия, встроенная кухня, новая сантехника, счётчики, кондиционер.
Квартира. Капитальный ремонт проводилась 2019 году. (не путать с косметическим ремонтом). Ремонт делали на совесть и для себя. Заменены все окна (Salamander и Rehau). Пол утеплен. В прихожке, на кухне, в туалете и в ванной теплый пол. Заменена полностью проводка и распределены розетки по принципу ""квартира без удлинителя"". Установлены французские перекидные выключатели и розетки. Сантехнические трубы и и трубы отопления заменены. В туалете немецкая система Grohe. Унитаз Roca. Ламинат польского производства (33 класс). В квартире 4 точки Ethernet. На стене обои под покрас. Краска Marshal (латексная). полностью с мебелью. Встроенная техника тоже остается. Из техники забираем телевизор и холодильник. так же есть парковочное место с навесом на одну машину. Реальному покупателю торг. Время освобождения квартиры после покупки 15 дней."
https://krisha.kz//a/show/679328241,2,10,17,Егизбаева,7/7,65.0,nan,Алмагуль,монолитный,12.0,nan,хорошее,2014,Асыл Тау,Алматы,Бостандыкский,nan,nan,nan,True,nan,раздельный,рядом охраняемая стоянка,nan,nan,False,2.7,False,False,False,False,False,False,False,False,False,True,False,True,True,False,False,False,False,True,True,False,False,55000000,False,8,False,"Пластиковые окна, счётчики, комнаты изолированы, улучшенная, тихий двор.
Квартира чистая, после ремонта, застройщик bi group, вид на горы."
https://krisha.kz//a/show/679170572,3,15,16,Егизбаева,5,73.0,nan,nan,монолитный,nan,nan,хорошее,2022,ALA Park,nan,nan,есть возможность подключения,nan,балкон,True,бронированная,совмещенный,паркинг,полностью,ламинат,False,2.7,False,True,True,True,True,True,True,False,False,True,True,True,True,True,True,True,False,True,True,True,False,66900000,False,17,False,"Пластиковые окна, неугловая, улучшенная, комнаты изолированы, кухня-студия, встроенная кухня, новая сантехника, счётчики, тихий двор, кондиционер.
Светлая, теплая, уютная квартира в современном жилом комплексе, расположенном в центральной части города. 
 
В квартире сделан дизайнерский ремонт, все делалось для себя, использовались только качественные материалы и продуманные решения: встроенные шкафы, встроенная бытовая техника, дорогая фурнитура, вся электрика Schneider, квартира меблирована. 
 
Формат квартиры: европейская 3-ка (кухня-гостиная + 2 отдельные спальни). 
 
Застройщик: BI Group. 
 
Стиль: современный интерьер с элементами минимализма. 
 
Планировка: продуманный цельный и функциональный дизайн проект, в котором эффективно использовано всё пространство. 
- большая кухня – гостиная площадью 30+ м2; 
- отдельная спальня с балконом; 
- просторная ванная комната; 
- широкие окна; 
- предусмотрено много мест под хранение личных вещей."
https://krisha.kz//a/show/679013088,3,1,5,Валиханова,nan,60.0,Маметовой,nan,панельный,6.0,nan,хорошее,1972,nan,Алматы,Медеуский,nan,nan,nan,False,nan,раздельный,nan,nan,nan,False,nan,False,False,False,False,False,False,False,False,False,False,True,False,True,False,False,False,False,False,True,False,True,31500000,False,7,False,"Неугловая, комнаты изолированы, тихий двор, удобно под коммерцию.
Продам квартиру от хозяина, удобно под бизнес и аренду, комнаты раздельные. 
Рядом мечеть, зелёный базар, школы, детсады, ГУМ. 
Автобусы во все части города, пригороды. 
Метро в шаговой доступности. 
Недалеко ЦУМ, автовокзал Саяхат"
