uri,room_count,floor,max_floor,street,house_number,general_area,intersection,microdistrict,building_type,kitchen_area,living_area,condition,build_year,residential_complex,city,district,telephone,internet,balcony,is_balcony_glazed,door,bathroom,parking,furniture,floor_type,former_hostel,ceiling_height,bars_on_the_window,security,entry_phone,code_lock,alarm,video_security,video_entry_phone,concierge,exchange_possible,plastic_windows,non_angular,improved,rooms_isolated,studio_kitchen,kitchen_builtin,new_plumbing,pantry,counters,quiet_courtyard,air_conditioning,commercial_convenient,price,mortgaged,images_count,private_hostel,text
https://krisha.kz//a/show/678672992,8,10,13,Бузурбаева,33а,188.6,Бузурбаева,nan,монолитный,nan,nan,nan,2008,Gorky Park Residence,Алматы,Медеуский,nan,nan,nan,False,nan,nan,nan,nan,nan,False,2.8,False,False,False,False,False,False,False,False,False,True,True,True,True,True,True,True,True,True,True,True,True,130445190,False,26,False,"Все документы на руках. 
 
В жилом ЖК ""Gorky Park Residence"" в Алматы 
находится по адресу г. Алматы, ул. Бузурбаева 33а (уг. Гоголя), возле парка культуры и отдыха им. Горького. 
Сдано в эксплуатацию в 2008 году. 
В черновой отделке. 
Свободная планировка. 
Охраняемый двор. 
Общая площадь 188, 6 кв метров; 
691 650 тг за м² = 130 445 190 тг 
Этажность: 13. 
Этаж 10. 
Идеальное расположение для семьи. 
Закрытая территория. 
Детская площадка. 
Имеется паркинг отдельно за 7 155 000 тг; 
Открывается потрясающий вид на горы. 
Два лифта. 
Продажа от хозяина. 
 
Также, рассматривается варианты: 
- Аренда; 
- обмен; 
 
О жилом комплексе: 
 
 Жилой комплекс бизнес-класса «Gorky Park Residence» то, что Вы искали. Здесь всегда свежий воздух благодаря центральному парку культуры и отдыха имени Горького. На территории комплекса ""Gorky Park Residence "" детские и спортивные площадки, прогулочные дорожки и места отдыха. Для Вас работают фитнес-клуб, тренажерный зал и бассейн. Рядом магазины, рестораны, школа и банки. Цена меняется в зависимости от курса $."
https://krisha.kz//a/show/673479124,7,3,5,Кабанбай Батыра,nan,173.0,nan,nan,кирпичный,23.99,117.0,хорошее,1980,nan,nan,nan,отдельный,nan,несколько балконов или лоджий,True,металлическая,2 с/у и более,рядом охраняемая стоянка,без мебели,паркет,False,2.75,False,False,True,False,False,False,False,False,False,True,False,True,True,False,True,True,False,True,True,True,False,190000000,False,5,False,"Пластиковые окна, улучшенная, комнаты изолированы, встроенная кухня, новая сантехника, счётчики, тихий двор, кондиционер.
Район ""Золотого квадрата"". В шаговой доступности продуктовые магазины, кафе, рестораны, банки, школы, ГАТОБ им. Абая, Дворец Республики, филармония. Квартира после ремонта. Новая сантехника Grohe и Ideal Standard, на кухне мойка Blanco посудомоечная встроенная машина Bosch. 
С каждой комнаты выход на лоджию или балкон. Межкомнатные двери деревянные. 
Въезд во двор через автоматические ворота. Во дворе дома места для парковки личного автомобиля. Во дворе детская площадка."
https://krisha.kz//a/show/678948820,2,13,18,Абая,nan,65.09,Брусиловского,nan,монолитный,14.0,nan,nan,2022,Terracotta,Алматы,Бостандыкский,nan,nan,nan,False,nan,nan,nan,nan,nan,False,3.0,False,False,False,False,False,False,False,False,False,True,True,True,True,True,True,True,True,True,True,True,True,42500000,False,7,False,"Квартира в новом ЖК, черновая отделка, свободная планировка, потолки более 3 метров, витражные окна, двери и радиаторы есть, подземный паркинг, двор охраняемый. 
Инфраструктура развитая, рядом ТД АДК, Магнум, станция метро Сайран, школы и детский сады в пошаговой доступности."
https://krisha.kz//a/show/675521175,3,6,9,Мкр Калкаман,nan,90.0,nan,Калкаман-1,монолитный,13.0,90.0,хорошее,2008,nan,Алматы,Наурызбайский,nan,проводной,балкон,True,металлическая,раздельный,паркинг,полностью,линолеум,False,2.8,False,False,True,False,False,False,False,False,False,True,True,False,True,False,False,True,False,True,True,False,False,33499990,False,16,False,"Пластиковые окна, неугловая, комнаты изолированы, новая сантехника, счётчики, тихий двор.
Срочно продаётся трех комнатная квартира. Чистая, ухоженная с хорошей аурой. Состояние ничего вкладывать не нужно заезжайте и живите в уютной, светлой и тёплой квартире. Торг уместен в пределах разумного. Спокойный тихий район, соседи и двор. Рядом все имеется детская площадка, магазины, базар, школа, дет сад, больница, трц молл Апорт и многое другое. Развитая инфраструктура, удобно доезжать до любой части города и за её пределы. Район очень хорошо развивается и строится на ближайшее будущее квартиры тут будут стоить намного дороже в перспективе. 
Ипотеку тоже рассматриваем, документы все имеются и все в порядке. 
звоните или пишите договоримся. 
Просьба риелторов не беспокоить."
https://krisha.kz//a/show/679209670,3,2,5,Манаса,33,75.0,Трц глобус,nan,кирпичный,9.0,nan,хорошее,1985,nan,Алматы,Бостандыкский,nan,оптика,лоджия,True,металлическая,раздельный,nan,nan,дерево,False,2.5,False,False,False,False,False,False,False,False,False,True,True,True,True,True,True,True,True,True,True,True,True,63000000,False,9,False,"3-комнатная квартира в кирпичном доме, санузел раздельный, 2 балкона, комнаты изолированные, окна юг+север, неугловая, незалоговая, ухоженный тихий двор, удобные подъездные пути, рядом школа, недалеко станция метро. Торг уместен"
https://krisha.kz//a/show/678726461,1,2,6,nan,nan,40.0,nan,Жулдыз-2 8в,кирпичный,8.0,nan,nan,2008,nan,Алматы,Турксибский,нет,проводной,nan,False,бронированная,совмещенный,рядом охраняемая стоянка,nan,линолеум,False,2.8,False,False,False,False,False,False,False,False,False,True,True,True,True,True,True,True,True,True,True,True,True,23000000,False,29,False,"Чистый теплый дом. 
Рядом школа и детский сад. 
МАгнум магазины все рядом."
https://krisha.kz//a/show/679352002,2,2,11,Райымбека,522,74.0,Возле Азия парк,nan,монолитный,20.0,nan,хорошее,2022,Shahar,nan,nan,отдельный,проводной,nan,False,металлическая,совмещенный,паркинг,nan,ламинат,False,3.0,False,False,False,False,False,False,False,False,False,True,True,True,True,True,True,True,True,True,True,True,True,57000000,False,10,False,"Продам. Рядом трц Азия парк все в шаговой доступности школа гимназия 133 супермаркеты магазины, магазин 12 месяцев. Все готово заезжай и живи."
https://krisha.kz//a/show/674828398,3,7,9,nan,nan,78.0,nan,Жас Канат 1,nan,nan,nan,хорошее,2017,nan,Алматы,Турксибский,есть возможность подключения,nan,nan,False,металлическая,раздельный,рядом охраняемая стоянка,nan,ламинат,False,2.8,False,False,True,False,False,False,False,False,False,False,True,False,False,False,False,True,False,False,True,False,False,35000000,False,20,False,"Неугловая, новая сантехника, тихий двор.
Дом тёплый. Не угловая. Вся инфоструктура по близости. (школа, детский сад, магазины, поликлиника, оброзовательные центры) Квартира светлая. Панорамный вид с окон и балкона. Светлая и уютная квартира."
https://krisha.kz//a/show/676838027,3,4,7,Тайманова,136,156.0,nan,nan,монолитный,nan,nan,хорошее,2017,Tau-House,Алматы,Медеуский,nan,nan,nan,False,nan,nan,паркинг,nan,nan,False,3.7,False,False,False,False,False,False,False,False,False,True,True,True,True,True,True,True,True,True,True,True,True,165000000,False,47,False,"Продаётся квартира в ЖК премиум-класса. квартира с качественным, дорогим ремонтом, авторский дизайн. Свежий ремонт, выполненный 1.06.2022г. Вся сантехника от Grohe. Высота потолков 3.7м. 
В квартире имеется 2 гардероба, прачечная, тёплые полы, собственная кухня, два санузла. Наружная отделка дома из травертина. Французский балкон с шикарным видом на горы и на город. заезд с Улицы Назарбаева, Искандерова. Огороженный тихий двор, охраняемая зона 24/7. 
Техника вся Bosch. 
Торг реальному клиенту ! СРОЧНО"
https://krisha.kz//a/show/674872335,3,5,5,Макаренко,nan,61.6,nan,nan,кирпичный,9.5,39.4,хорошее,1988,nan,Алматы,Жетысуский,nan,nan,балкон и лоджия,True,металлическая,раздельный,рядом охраняемая стоянка,полностью,nan,False,nan,False,False,True,False,False,False,False,False,False,True,True,True,True,False,True,False,False,True,True,True,False,35000000,False,11,False,"Пластиковые окна, неугловая, улучшенная, комнаты изолированы, встроенная кухня, счётчики, тихий двор, кондиционер."
https://krisha.kz//a/show/679249777,2,5,9,Мкр,nan,65.0,nan,Аккент,монолитный,12.0,nan,хорошее,2010,Аккент,Алматы,Алатауский,есть возможность подключения,проводной,балкон,False,металлическая,совмещенный,паркинг,nan,ламинат,False,2.8,False,True,True,False,False,False,False,False,False,True,True,True,True,True,True,True,True,True,True,True,True,35000000,False,16,False,"Продам хороший и теплый квартиру, в хорошем районе, очень удобный место положение, по цене торг будет."
https://krisha.kz//a/show/678885942,3,4,9,Сейфуллина,51,71.0,nan,nan,монолитный,16.0,nan,хорошее,2021,Теремки,Алматы,Турксибский,nan,оптика,nan,False,металлическая,nan,паркинг,nan,ламинат,False,2.7,False,False,False,False,False,False,False,False,False,True,True,True,True,True,True,True,True,True,True,True,True,55500000,False,31,False,"Шикарная квартира, готовая к проживанию! Рядом парк, стадион, ТЦ."
https://krisha.kz//a/show/679269149,1,8,10,Жунисова,4/14,40.0,nan,nan,монолитный,nan,nan,хорошее,2019,Alma City,Алматы,Наурызбайский,nan,nan,лоджия,True,nan,nan,nan,полностью,ламинат,False,2.8,False,False,False,False,False,False,False,False,False,True,True,True,True,True,True,True,True,True,True,True,True,28000000,False,7,False,"Квартира светлая, остается вся мебель и техника."
https://krisha.kz//a/show/677914827,1,1,10,Алтын орда,10,47.64,nan,nan,монолитный,nan,nan,требует ремонта,2022,Alma City,Алматы,Наурызбайский,nan,nan,nan,False,nan,nan,nan,nan,nan,False,2.8,False,False,False,False,False,False,False,False,False,True,True,True,True,True,True,True,True,True,True,True,True,19000000,False,7,False,"Продам квартиру в хорошем районе, выше Ташкенской, рядом школа, магазины, тихо, свежий воздух. Удобное расположение, к жк есть проезд как с ул. Абая так и с ул. Ташкенской. ключи получили."
https://krisha.kz//a/show/678711259,2,7,8,Арайлы,12,51.0,nan,nan,монолитный,nan,nan,nan,2019,Сакура,Алматы,Бостандыкский,отдельный,оптика,nan,False,nan,2 с/у и более,nan,nan,ламинат,False,3.3,False,False,False,False,False,False,False,False,False,True,True,True,True,True,True,True,True,True,True,True,True,46990000,False,18,False,"Отличная уютная квартира для небольшой семьи с новым ремонтом, техникой и мебелью! 
2 сан узла, система охлаждения фанкоилы, с климат контролем в каждой комнате, полы с подогревом, спальня с гардеробом и сан узлом. посудомоечная машина, духовой шкаф, 2 телевизора, стиральная машина. 
ЖК расположен в экологически благоприятном районе, с бассейном, теннисным кортом, игровыми и спортивными площадками. 
И шикарный вид на горы!"
https://krisha.kz//a/show/679464779,2,12,12,Сатпаева,nan,60.0,Туркебаева,nan,монолитный,10.0,nan,хорошее,2018,Акварель,Алматы,Бостандыкский,есть возможность подключения,ADSL,балкон,True,металлическая,раздельный,рядом охраняемая стоянка,nan,ламинат,False,2.8,False,True,True,False,False,True,False,False,False,True,True,True,False,False,True,True,False,False,True,False,False,50000000,False,9,False,"Пластиковые окна, неугловая, улучшенная, встроенная кухня, новая сантехника, тихий двор.
В паре минут ходьбы Трк «АДК», набережная реки большая Алматинка. Чуть более 1 км отделяют новостройку от водохранилища Сайран. 
 Рядом школы №65, 140, институт горноГО дела. Ясли-сад №91, №155, №39. Недалеко от дома диагностический центр"
https://krisha.kz//a/show/678383337,1,1,4,nan,nan,17.0,Ул,Шугыла 76,кирпичный,nan,nan,хорошее,2017,nan,Алматы,Наурызбайский,nan,nan,nan,False,металлическая,раздельный,nan,nan,nan,False,2.8,True,False,True,False,False,False,False,False,False,True,False,False,False,False,False,False,False,False,False,False,False,11000000,False,7,False,"Пластиковые окна.
Срочно продам квартиру в Наурызбайском районе, мкр. Шугыла. Напротив ТРЦ АППОРТ и ЛЕРУА МЕРЛЕН. Квартира просторная, чистая. Вся инфраструктура в шаговой доступности. Ремонт по желанию. Возможно обмен на машину за 15.000 000 тенге."
https://krisha.kz//a/show/678903460,3,1,5,Омаровой,25/1,100.0,nan,nan,монолитный,nan,nan,хорошее,2018,Европолис,Алматы,Медеуский,есть возможность подключения,ADSL,nan,False,бронированная,2 с/у и более,паркинг,nan,паркет,False,3.0,False,False,False,False,False,False,False,False,False,True,True,True,True,True,True,True,True,True,True,True,True,85000000,False,39,False,"В ЖК находящемся в экологично-чистом районе, с двумя продуктово-хозяйственными магазинами, аптекой, салонами красоты и СПА центром, детскими площадками, автомойкой, охраной, фонтанами, рестораном, собственной парковкой, детским мини садом и образовательным центром, продаётся элитная 3х комнатная квартира в хорошем состоянии, после косметического ремонта! Квартира на 1м этаже на уровне второго 
 
Сантехника Villeroy & boch, GROHE, Kerasan, Franke 
Окна REHAU 
Межквартирные стены обшиты дополнительной шумоизоляцией 
Встроенная техника SMEG, Electrolux 
Керамогранит Kerama Marazzi 
Кухонная столешница из натурального камня и алюминия 
Кухонный гарнитур, гостиная, детская комната, гардеробная, коридор выполнены по специальному заказу дизайнерского решения 
Телевизионная зона обшита тканью алькантара для лучшего аудио воспроизведения 
Стены в гостиной расписаны художником в узоры камня «оникс» 
Стены в прихожей выполнены по специальному заказу из дерева 
Полы паркет, полы керамической плиткой с регулируемым электрическим подогревом 
Стены выкрашены краской и художественной штукатуркой от фирмы TIKKURILA, также использовались итальянские обои в спальной комнате и деревянные эко декорпанели в гостиной 
Кондиционеры фирмы SAMSUNG 
Напольная мебель и спальный гарнитур DOGTAS 
Световые выключатели и резетки Schneider Electric 
Двери про-ва Россия, дверные ручки ИТАЛИЯ MANDELLI 
В двух санузлах выложен натуральный стабилизированный мох, не требующий ухода! 
 
Гардероб выполнен по личному дизайну из деревянных реек для оптимизации пространства 
 
Имеется трапециевидная ванна и стеклянная душевая 
Столешница в ванной под мрамор 
Гримерное зеркало с отдельным освещением 
 
Авторский обзор дизайна квартиры можно увидеть на сайте youtube, желающим посмотреть, писать по номеру 
 
Рассматриваем все виды оплат"
https://krisha.kz//a/show/679557442,1,2,2,Мкр Мамыр,nan,30.0,nan,Мамыр,кирпичный,7.4,nan,хорошее,1970,nan,Алматы,Ауэзовский,есть возможность подключения,через TV кабель,балкон,False,металлическая,совмещенный,nan,nan,линолеум,False,2.8,False,False,False,False,False,False,False,False,False,True,True,True,True,True,True,True,True,True,True,True,True,20000000,False,8,False,"Очень тихий спальный район, пешая доступность станции метро Бауыржан Момышулы, торговые центры Спутник, Алматы молл. Школа #158, #176, #173 в шаговой доступности. Хорошо развиты район в транспортном смысле (автобусы 126, 52, 128, 22 и т.д. ) Для молодых семей поликлиника рядом, спорткомплекс рядом, есть кафешки, ТРЦ. 
Окна новые пластиковые. Стены толстые хорошая звукоизоляция. 
Окна квартиры выходят на южную сторону."
https://krisha.kz//a/show/666473202,2,13,13,nan,nan,78.7,Момышулы,Аксай-5 3б,монолитный,11.3,23.5,хорошее,2015,Арыстан,Алматы,Ауэзовский,отдельный,оптика,балкон и лоджия,True,металлическая,раздельный,рядом охраняемая стоянка,частично,линолеум,False,2.8,True,True,True,False,False,True,False,False,True,True,True,True,True,False,True,True,False,True,True,False,False,45000000,False,47,False,"Пластиковые окна, тихий двор, неугловая, улучшенная, комнаты изолированы, встроенная кухня, новая сантехника, счётчики.
Продаётся светлая, уютная и просторная квартира. Тихий, охраняемый двор, видеонаблюдения, со всех сторон Ж. К, даже перед дверью квартиры. Доброжелательные соседи. Закрытая, огороженная территория Ж. К. Шикарный вид на город из окон (восток и запад). Все в шаговой доступности, рядом рынок-Арыстан, Small, Magnum, ТРЦ - “Үш Сұңқар”, Мечта, школы, гимназии, сады, поликлиника -10, лаборатории. квартира зимой очень теплая. Планировка квартиры в виде распашонки (сквозная). квартира полна счастья и детского смеха. Купив данную квартиру вы не пожалеете. Торг. Срочно! Риэлторов прошу не беспокоить!"
https://krisha.kz//a/show/679261309,3,8,9,nan,nan,76.7,nan,Аккент 62,монолитный,12.0,nan,хорошее,2021,nan,Алматы,Алатауский,nan,nan,nan,False,металлическая,совмещенный,паркинг,частично,ламинат,False,2.7,False,False,False,False,False,False,False,False,False,True,True,True,True,True,True,True,True,True,True,True,True,42000000,False,16,False,None
https://krisha.kz//a/show/679220435,3,7,10,Кенесары хана,nan,90.0,nan,Карагайлы,монолитный,12.0,nan,хорошее,2014,Хан Тенгри,Алматы,Наурызбайский,отдельный,оптика,лоджия,True,металлическая,совмещенный,nan,частично,ламинат,False,2.8,False,False,True,False,False,True,False,False,False,True,False,False,False,False,False,False,False,False,False,True,False,60000000,True,6,False,"Кондиционер, пластиковые окна."
