uri,room_count,floor,max_floor,street,house_number,general_area,intersection,microdistrict,building_type,kitchen_area,living_area,condition,build_year,residential_complex,city,district,telephone,internet,balcony,is_balcony_glazed,door,bathroom,parking,furniture,floor_type,former_hostel,ceiling_height,bars_on_the_window,security,entry_phone,code_lock,alarm,video_security,video_entry_phone,concierge,exchange_possible,plastic_windows,non_angular,improved,rooms_isolated,studio_kitchen,kitchen_builtin,new_plumbing,pantry,counters,quiet_courtyard,air_conditioning,commercial_convenient,price,mortgaged,images_count,private_hostel,text
https://krisha.kz//a/show/666661191,2,2,3,Шолохова,nan,49.2,Сейфуллина,nan,кирпичный,9.0,27.5,хорошее,1981,nan,Алматы,Турксибский,отдельный,оптика,несколько балконов или лоджий,True,металлическая,раздельный,nan,nan,ламинат,False,2.6,False,False,True,False,False,False,False,False,False,True,True,True,True,False,False,True,False,True,True,False,False,28000000,False,14,False,"Пластиковые окна, неугловая, улучшенная, комнаты изолированы, новая сантехника, счётчики, тихий двор.
СРОЧНО продам! Уютная теплая квартира с новым евроремонтом, новая сантехника, трубы, подвесные потолки, в кухне кафель, тихий двор, детская площадка. Развитая инфраструктура: рядом школа, дет сад, поликлиника, в шаговой доступности - Магнум, базар, парк, ТРЦ Mart. торг"
https://krisha.kz//a/show/671100181,4,6,7,Кашгарская,69/102,228.0,nan,nan,монолитный,nan,nan,черновая отделка,2015,Престиж Алатау,nan,nan,nan,nan,nan,False,nan,nan,паркинг,nan,nan,False,2.7,False,False,False,False,False,False,False,False,False,True,True,True,True,True,True,True,True,True,True,True,True,130000000,False,15,False,"Пентхаус в черновой отделке в элитном жилом комплексе ""Престиж Алатау"" в самом центре города Алматы. Здания богато отделаны натуральным гранитом, травертином, керамической плиткой благородных цветов. Высота потолков в квартирах — 3 м. В подъездах скоростные лифты иностранного производства. Жилой комплекс имеет подземный паркинг. Прилегающая территория огорожена и оборудована системой контроля доступа, осуществляется видеонаблюдение. На территории двора расположены детские и спортивные площадки, клумбы, газоны и другие места для отдыха жителей. Инфраструктура района очень развита. В радиусе 300 метров от жилого комплекса находятся детский сад № 16, школа-гимназия № 36, дом-музей и сквер им. Ахмета Байтурсынова, Объединённая университетская клиника казахского национального медицинского университета им. С. Д. Асфендиярова. В 15 минутах пешком — Центральный стадион, река Есентай, парк «Мир фантазий», казахский государственный цирк, Дворец спорта и культуры имени Балуана Шолака, а также почти все культурные и развлекательные объекты центральной части города. Просмотр по предварительной записи."
https://krisha.kz//a/show/675687048,2,3,10,бульвар Бухар Жырау,35,68.0,Шагабудинова,Коктем-1,монолитный,25.0,nan,хорошее,2019,Престиж,Алматы,Бостандыкский,nan,nan,nan,False,nan,совмещенный,паркинг,полностью,nan,False,3.0,False,True,True,False,True,False,False,False,False,True,True,True,True,True,True,True,False,False,True,True,False,82000000,False,7,False,"Пластиковые окна, тихий двор, кондиционер, неугловая, улучшенная, комнаты изолированы, кухня-студия, встроенная кухня, новая сантехника.
Квартира выполнена под дизайнерским надзором. Каждый уголок продуман до мелочей. Вся мебель встроена и сделана под заказ. квартира сделана с душой и для себя. 
 
квартира не требует вложений, оставляем всю мебель и технику. Заходи и живи :) ПРОСЬБА не звонить. Писать. 
Так же могу отправить видео квартиры. 
 
посмотреть квартиру можно 1 раз в неделю в воскресенье. 
 
Скидка для тех кто хочет оплатить криптовалютой. 
 
риэлторы, просьба не беспокоить. 
обмен не интересует"
https://krisha.kz//a/show/678073642,2,1,12,nan,nan,73.0,nan,Нуркент,монолитный,30.0,nan,хорошее,2018,Нуркент,Алматы,Алатауский,nan,nan,балкон,True,металлическая,2 с/у и более,паркинг,nan,ламинат,False,2.8,True,False,True,False,False,True,False,False,False,True,True,True,True,True,True,True,True,True,True,True,True,34500000,False,14,False,"Уютная квартира в Нуркенте со свежим ремонтом. 
Рядом Алматы арена. Школа. Детские садики. Баня. 
 
Тихий район. Далеко от шума трассы. есть балкон. Гардеробная. Видеонаблюдение. Подъезд чистый. 
 
Мебель абсолютно новая. Не нужно думать как обставлять. (при покупке забираем с собой только электронную технику). 
 
Очень удобна под коммерцию. Именно в этом дворе нет продуктового магазина. 
 
Возможен обмен на однокомнатную квартиру в акбулаке с доплатой с вашей стороны."
https://krisha.kz//a/show/677283764,3,5,5,nan,nan,76.2,nan,Саялы,монолитный,12.4,nan,хорошее,2016,nan,Алматы,Алатауский,nan,ADSL,балкон,False,металлическая,раздельный,nan,nan,линолеум,False,2.8,False,False,True,False,False,True,False,False,False,True,True,True,True,False,True,True,False,True,True,False,False,35500000,False,14,False,"Пластиковые окна, неугловая, улучшенная, комнаты изолированы, встроенная кухня, новая сантехника, счётчики, тихий двор.
Всё в шаговой доступности свежий ремонт, новая сантехника частично с мебелью ."
https://krisha.kz//a/show/678604514,1,2,5,nan,nan,39.1,nan,Кулагер,монолитный,9.8,nan,хорошее,2006,nan,Алматы,Жетысуский,nan,nan,балкон,True,металлическая,совмещенный,рядом охраняемая стоянка,частично,линолеум,False,2.8,False,False,True,False,False,False,False,False,False,True,True,False,False,False,True,False,False,True,True,False,False,24700000,False,18,False,"Пластиковые окна, неугловая, встроенная кухня, счётчики, тихий двор.
Продаётся уютная 1-комнатная квартира в микрорайоне Кулагер. 
 
Пластиковые окна, встроенная кухня, застеклённый балкон, счётчики, тихий двор. 
 
документы в порядке, подходит под ипотеку, не в залоге, без перепланировок. 
 
Преимущества: 
✅Чистый подъезд без постороннего запаха. 
✅Дружные соседи. 
✅2 этаж. 
✅Рядом с домом вся необходимая инфраструктура. 
 
Двор дома оборудован детской площадкой, а для взрослого поколения поставлены скамейки. 
 
Инфраструктура окружающего района хорошо развита. Многие важные объекты находятся в пешей доступности: школа-гимназия № 148, детский сад, большой парк Гулдер, Ипподром, Магнум, Акимат и ЦОН Жетысуского района. 
 
Риелторов просьба не беспокоить."
https://krisha.kz//a/show/678291534,2,18,20,Прокофьева,148,74.0,nan,nan,монолитный,nan,nan,хорошее,2011,Манхеттен (29 квартал),Алматы,Алмалинский,отдельный,проводной,балкон,True,металлическая,совмещенный,паркинг,частично,ламинат,False,3.0,False,True,False,False,False,False,False,False,False,False,True,False,False,True,False,False,False,False,False,True,False,60000000,False,16,False,"Кондиционер, неугловая, кухня-студия.
Квартира бизнесс класса. Витражные окна. Великолепный вид на оз. Сайран. Станция метро 10 мин. ходьбы. 15 мин. ТЦ АДК, Магнум. Хорошие соседи. Почти вся мебель остаётся. Квартира очень светлая и тёплая."
https://krisha.kz//a/show/676895277,2,12,13,Навои,nan,70.4,Торайгырова,nan,монолитный,nan,nan,хорошее,2015,Шахристан,Алматы,Бостандыкский,nan,nan,nan,False,nan,nan,паркинг,nan,nan,False,2.95,False,False,False,False,False,False,False,False,False,True,True,True,True,True,True,True,True,True,True,True,True,58000000,False,7,False,Теплая и уютная квартира для комфортного проживания
https://krisha.kz//a/show/678219317,3,1,10,Мкр,nan,83.0,nan,Мамыр-3,монолитный,10.0,nan,хорошее,2012,Мамыр,Алматы,Ауэзовский,nan,оптика,nan,False,nan,совмещенный,паркинг,nan,ламинат,False,2.7,True,False,False,False,False,False,False,False,True,False,False,False,True,False,False,False,False,False,False,False,True,47000000,True,7,False,"Удобно под коммерцию, комнаты изолированы.
Очень тёплая квартира благодаря отапливаему цокольному этажу, в котором находятся офисы. 
Шумоизоляция в доме хорошая. Жили сами, нужно только освежить стены эмульсией или обоими. хороший двор, место для паРКовки. рядом есть школы дет сады, скиф и магнум. 
Продаём срочно в связи с переездом! торга нет!"
https://krisha.kz//a/show/679015142,4,4,5,nan,nan,84.5,nan,Тастак-1 24,панельный,10.5,nan,требует ремонта,1990,nan,Алматы,Ауэзовский,nan,nan,несколько балконов или лоджий,False,nan,раздельный,nan,nan,nan,False,2.8,False,False,False,False,False,False,False,False,False,True,True,True,True,True,True,True,True,True,True,True,True,39900000,False,15,False,"Большая просторная квартира с удобной планировкой, все комнаты изолированные. Два балкона. Рядом магнум, 2 детских сада, гимназия 130 под окнами. Все в шаговой доступности. Хозяин! торг символический! 
Звоните если недоступен"
https://krisha.kz//a/show/679131711,1,5,5,Ратушного,92/2,38.0,Ратушного,Кулагер,панельный,nan,nan,хорошее,1989,nan,Алматы,Жетысуский,нет,ADSL,балкон,True,металлическая,совмещенный,nan,nan,линолеум,False,2.8,False,False,True,False,False,False,False,False,True,True,True,True,False,False,True,False,False,True,True,True,False,20500000,False,10,False,"Кондиционер, пластиковые окна, неугловая, улучшенная, встроенная кухня, тихий двор, счётчики.
Дом в хорошем состоянии, район очень хороший, чистый"
https://krisha.kz//a/show/677114447,1,10,10,Шолом,nan,44.0,nan,nan,монолитный,nan,nan,свободная планировка,2018,Алма,Алматы,Бостандыкский,отдельный,оптика,балкон,False,металлическая,совмещенный,паркинг,без мебели,nan,False,3.0,False,True,True,True,False,True,False,False,False,True,True,False,False,False,False,False,False,True,True,False,False,33500000,False,5,False,"Пластиковые окна, неугловая, счётчики, тихий двор.
На продажу выставлена 1 комнатная квартира в удобном районе Алматы, рядом с микрорайоном Коктем, набережная реки Есентай. 
 
Окна на юг, кухня студия. Совмещённый санузел. 
 
Рядом также находятся казГУ Алматинский университет энергетики и связи им. Г. Даукеева 
Satbayev University 
 
В шаговой доступности все необходимые объекты инфраструктуры, от наличия которых зависит качество жизни. 
 
Поблизости расположены магазины, бизнес-центры, супермаркеты, автосервисы, кафе, кофейни, аптеки, стоматологические клиники. 
 
Ближайшая остановка общественного транспорта расположена в 50 метрах от дома, здесь пролегает более десяти автобусных маршрутов. 
 
Придомовая территория огорожена и закрыта для посторонних. Во дворе стоят ворота, въезд только для жителей дома, работает охранная служба. 
 
На территории большая детская игровая площадка с безопасным покрытием, зона отдыха со скамейками. Территория озеленена."
https://krisha.kz//a/show/679292812,2,18,18,Навои,208/8,80.0,Торайгырова,nan,монолитный,nan,nan,хорошее,2015,Шахристан,Алматы,Бостандыкский,нет,оптика,nan,False,nan,2 с/у и более,паркинг,nan,ламинат,False,2.95,False,False,False,False,False,False,False,False,True,True,True,True,True,True,True,True,True,True,True,True,True,66500000,True,8,False,"Уютная и тёплая квартира с прекрасным видом. 
Квартира находится на 18 этаже в ЖК Шахристан. Арочные окна передают всю красоту от рассвета до заката. 
Полностью меблирована. 
Спальня, 2 детские, кухня студия, 2 санузла, кладовая, просторная прихожая. 
Вся техника остается: встроенная электрическая плита Hansa, духовой шкаф Hansa, холодильник Lg, посудомоечная машина Samsung, стиральная машинка Samsung, 2 кондиционера Gree, телевизор LG и посудомоечная машина. 
Жилой комплекс находится в очень удобном месте. Рядом Mega, спортивные залы, школы, сады, остановки. 
На территории ЖК имеются продуктовые, мясные, овощные магазины, салоны красоты, китайский салон точечного массажа, детский магазин игрушек, магазин Marwin, химчистка, ателье, barbershop, кафе, футбольное поле и детские площадки. 
Квартира переделана из двухкомнатной в четырехкомнатную. 
Квартиру можно приобрести по переуступке прав от застройщика (остаток 20 млн) 
46.500.000 тг на руки нам, остаток в компанию застройщика"
https://krisha.kz//a/show/679559607,2,5,10,Нурмакова,150,60.0,Кабанбай батыра,nan,монолитный,nan,nan,свободная планировка,2022,Status,Алматы,Алмалинский,nan,оптика,nan,False,металлическая,nan,паркинг,nan,nan,False,3.0,False,False,False,False,False,False,False,False,False,True,True,True,True,True,True,True,True,True,True,True,True,42600000,False,8,False,"Продаётся 2х комнатная квартира в новом жк, один дом, муравейника не будет, рядом есть все школы, садики, супермаркеты, аптеки и т.д., построен качественно, застройк Капитал Инвест 
тихий уютный район. 
ЦЕНА ОКАНЧАТЕЛЬНАЯ. цена в долларах 89 100"
https://krisha.kz//a/show/679588898,3,5,9,Толе би,175,74.0,Уг,nan,панельный,11.0,nan,хорошее,1986,nan,Алматы,Алмалинский,отдельный,ADSL,nan,False,деревянная,совмещенный,рядом охраняемая стоянка,nan,ламинат,False,2.8,False,False,False,False,False,False,False,False,False,True,True,True,True,True,True,True,True,True,True,True,True,58000000,False,13,False,"Светлая, тёплая, меблированная квартира после ремонта, комнаты изолированы, большая кухня, новый кухонный гарнитур со встроенной техникой, в каждой комнате кондиционер (охлаждение/обогрев), на каждом окне установлен детский замок. 
 Очень удобное расположение в самом центре города, в шаговой доступности сады, школы, университеты, колледжи, аптеки, мед. учреждения, супермаркет Small, магазины, рынок. Тихий район, хорошие соседи. 
 
Из мебели оставляем практически все что есть на фото."
https://krisha.kz//a/show/679477339,3,5,9,nan,nan,72.0,nan,Жетысу-1,nan,11.0,45.0,хорошее,1990,nan,Алматы,Ауэзовский,nan,проводной,nan,True,металлическая,раздельный,nan,частично,ламинат,False,2.8,False,False,True,False,False,False,False,False,False,True,False,True,True,False,True,True,False,False,True,True,False,44500000,False,10,False,"Пластиковые окна, улучшенная, комнаты изолированы, встроенная кухня, новая сантехника, тихий двор, кондиционер.
Продается 3-х ком. квартира в одном из востребованных районов города. Рядом находится торговый дом НУР, салоны красоты, бани ""Эйфория"" и ""ЕМ-БУ-СУ"", школа с новым спортивным стадионом."
https://krisha.kz//a/show/676250225,1,4,10,Жунисова,10,47.5,nan,nan,монолитный,nan,nan,свободная планировка,2022,Alma City,Алматы,Наурызбайский,nan,nan,nan,False,металлическая,nan,паркинг,nan,nan,False,2.8,False,False,False,False,False,False,False,False,False,True,True,True,True,True,True,True,True,True,True,True,True,20000000,False,7,False,"Алма сити 5/2. Кілт берілген, Толка ремонт жасап кіреберіуге болады, двор ішінде мектеп бар (207 ші мектеп) 2 тоқсан бастап мектеп өз жумысін бастайды. Лифт бәры қосылған…. Наличка …"
https://krisha.kz//a/show/671706387,2,7,10,Бекхожина,15а,72.0,nan,nan,монолитный,nan,nan,хорошее,2018,Art Residence,Алматы,Медеуский,nan,nan,nan,False,nan,раздельный,паркинг,nan,nan,False,3.0,False,False,False,False,False,False,False,False,False,True,True,True,True,True,True,True,True,True,True,True,True,88000000,False,23,False,None
https://krisha.kz//a/show/677853670,2,3,8,nan,nan,54.0,nan,Нуркент,монолитный,11.0,nan,хорошее,2017,nan,Алматы,Алатауский,nan,ADSL,балкон,False,nan,совмещенный,паркинг,nan,линолеум,False,nan,False,False,True,True,False,True,False,False,False,True,False,False,True,False,True,True,True,True,True,True,False,33000000,False,15,False,"Комнаты изолированы, кладовка, пластиковые окна, встроенная кухня, кондиционер, тихий двор, новая сантехника, счётчики.
Продается 2-х комнатная квартира, в перспективном районе города, в ж/к “Атлетическая деревня”. 
Закрытый ж/к - как отдельный городок, все рядом: школа, садик, развивашки, магазины, нотариус. Поликлиника и ЦОН Алатауского района - на территории ж/к. 
“Алматы Арена” в шаговой доступности. 
Очень интересная планировка в квартире: панорамные окна, кладовка на кухне. Балкон через спальню. 
В квартире свежий качественный ремонт. Новая входная дверь. Новые межкомнатные двери. Новая сантехника. 
Встроенная мебель в спальне, в прихожей, на кухне. 
В зале стоит новый кондиционер зима/лето. 
Недавно рядом с ж/к постоилась мечеть. Открылась новая гостиница и теннисный корт. В данный момент на территории ж/к строится дворец школьников, а в шаговой доступности строится новый ВУЗ. 
Квартира не в залоге, под ипотеку подходит. 
Реальным покупателям - реальная уступка!"
https://krisha.kz//a/show/678591793,2,4,12,улица Жандосова,94,49.5,Жандосова,nan,монолитный,nan,nan,nan,2023,nan,Алматы,Бостандыкский,nan,nan,nan,False,nan,2 с/у и более,nan,nan,nan,False,2.7,False,False,False,False,False,False,False,False,False,True,True,True,True,True,True,True,True,True,True,True,True,29000000,False,0,False,В строящем доме-сдача в декабре 2023 года. По переуступке прав по договору долевого участия. Отличный жилой комплекс! Дом будет сдан без задержек. цена после сдачи в эксплуатацию будет в два раза дороже. Продаём всвязи с переездом в другую страну.
