uri,room_count,floor,max_floor,street,house_number,general_area,intersection,microdistrict,building_type,kitchen_area,living_area,condition,build_year,residential_complex,city,district,telephone,internet,balcony,is_balcony_glazed,door,bathroom,parking,furniture,floor_type,former_hostel,ceiling_height,bars_on_the_window,security,entry_phone,code_lock,alarm,video_security,video_entry_phone,concierge,exchange_possible,plastic_windows,non_angular,improved,rooms_isolated,studio_kitchen,kitchen_builtin,new_plumbing,pantry,counters,quiet_courtyard,air_conditioning,commercial_convenient,price,mortgaged,images_count,private_hostel,text
https://krisha.kz//a/show/677866392,2,9,16,Жуалы,19,73.0,nan,Шугыла,монолитный,12.0,nan,хорошее,2012,Премьера,Алматы,Наурызбайский,nan,nan,лоджия,True,металлическая,совмещенный,паркинг,nan,ламинат,False,2.8,False,False,True,False,False,True,False,False,True,True,True,True,True,True,False,False,True,True,False,True,False,27999999,False,11,False,"Пластиковые окна, кондиционер, неугловая, улучшенная, комнаты изолированы, кухня-студия, кладовка, счётчики.
Срочно Продаю квартиру в микрорайоне Шугыла, жк премьера, ТОРГ! 
 
однокомнатная переделанная в двухкомнатную, большая квадратура, зал двадцать две, кухня двенадцать, гардероб около 4.5кв. м, спальня двадцать, санузел совмещённый около десяти квадратов, ремонт свежий, остаётся только кондер, остальную мебель забираю или продаю, кухня без техники четыреста тыс, дерево, гардероб триста пятьдесят тыс, спальный гарнитур шестьсот пятьдесят тыс, диваны и кресла полтора миллиона, зеРКало с консолью двести тыс, торг не большой, цена до конца месяца"
https://krisha.kz//a/show/671325931,2,3,6,Кенесары хана,83/5,45.0,nan,nan,монолитный,nan,nan,хорошее,2014,Аскар Тау,Алматы,Бостандыкский,есть возможность подключения,ADSL,nan,False,металлическая,совмещенный,паркинг,полностью,ламинат,False,2.7,False,True,True,False,False,True,False,False,False,True,True,True,True,True,True,True,True,True,True,True,True,32500000,False,7,False,"Квартира с удобной планировкой. Пластиковые окна, неугловая. Тихий двор. Идеальный вариант для молодой семьи. 
Уютная чистая. Жили только сами. Продаем связи с переездом. Рядом школа, детские сады, учебные центры, аптеки, супермаркеты и все что необходимо для комфортного жилья. Просмотр квартиры возможен в любой день. Любые можете задавать по телефону"
https://krisha.kz//a/show/679558046,3,3,5,Халиуллина,196/1,80.0,nan,nan,монолитный,10.0,nan,хорошее,2021,Medeu City,Алматы,Медеуский,nan,nan,nan,False,nan,nan,паркинг,nan,nan,False,2.8,False,False,False,False,False,False,False,False,False,True,True,True,True,True,True,True,True,True,True,True,True,48000000,False,10,False,Новая квартира
https://krisha.kz//a/show/679599866,3,9,9,nan,nan,76.0,nan,Зердели,монолитный,12.0,nan,хорошее,2013,nan,Алматы,Алатауский,nan,nan,балкон,False,металлическая,раздельный,рядом охраняемая стоянка,nan,линолеум,False,2.75,False,False,True,False,False,True,False,False,False,True,True,True,True,False,False,True,False,True,True,True,False,32000000,False,17,False,"Кондиционер, пластиковые окна, неугловая, улучшенная, комнаты изолированы, новая сантехника, счётчики, тихий двор."
https://krisha.kz//a/show/679522109,2,1,9,nan,nan,60.0,nan,Мамыр-4 300,кирпичный,15.1,nan,хорошее,2005,nan,Алматы,Ауэзовский,nan,проводной,nan,False,металлическая,раздельный,рядом охраняемая стоянка,nan,ламинат,False,2.8,False,False,False,False,False,False,False,False,False,True,True,True,True,True,True,True,True,True,True,True,True,42000000,False,13,False,"Продам 2-х комнатную квартиру 60 кв. м., в хорошем доме 2005 года постройки, техническое состояние отличное. 
Удачная планировка, которая позволяет рационально использовать пространство. 
Светлая и просторная кухня 15 кв., жилая площадь 30 кв., санузел раздельный. Квартира находится на первом этаже, в доме чистые подъезды и лифты. 
Полностью меблированная, встроенная кухня с техникой. На территории дома огорожена детская площадка. В шаговой доступности метро Момышулы, Магнум, ТРЦ Спутник."
https://krisha.kz//a/show/679161532,5,9,9,nan,nan,170.0,nan,Самал-2 74,монолитный,12.0,nan,nan,1991,nan,Алматы,Медеуский,nan,nan,nan,False,nan,2 с/у и более,nan,nan,паркет,False,2.8,False,False,False,False,False,False,False,False,False,True,True,True,True,True,True,True,True,True,True,True,True,130000000,False,23,False,"Дом расположен в престижном районе города с прекрасным видом на Коктобе и развитой инфраструктурой. В непосредственной близости расположены детские сады (один садик дворе дома), несколько школ (131), ТРЦ (Достык Плаза, Ramstore all in). Хорошая продуваемость круглый год. Квартира в двух уровнях, одна из пяти комнат, на втором уровне и прекрасно подходит под детскую игровую или домашний кинозал и др. Мебель и техника остаётся в полном объёме. Сейсмоустойчивость дома высокая. На этаже имеется собственная кладовка. Окна выходят на восток, юг и запад."
https://krisha.kz//a/show/674017497,2,2,9,nan,nan,64.0,nan,Зердели,монолитный,11.0,nan,хорошее,2014,nan,Алматы,Алатауский,nan,через TV кабель,nan,False,металлическая,раздельный,nan,nan,линолеум,False,2.7,True,False,True,False,False,True,False,False,False,False,True,True,True,False,True,False,False,False,False,False,False,32500000,False,20,False,"Неугловая, улучшенная, комнаты изолированы, встроенная кухня."
https://krisha.kz//a/show/679292029,3,2,12,проспект Абая,165,110.0,Тургут Озала,nan,монолитный,16.0,nan,хорошее,2022,O'NER,nan,nan,nan,nan,лоджия,True,металлическая,2 с/у и более,nan,без мебели,ламинат,False,2.7,False,True,True,True,False,True,True,False,False,True,False,True,True,False,False,True,False,False,False,True,False,83000000,False,36,False,"Пластиковые окна, улучшенная, комнаты изолированы, новая сантехника, кондиционер.
СРОЧНО, ключи на руках, продается 3х комнатная квартира в ЖК Oner-1.1 дом сдан в эксплуатацию. Свежий ремонт, никто не жил, качественные материалы строения и ремонта, 3-кондиционера расчитанные на 36кв. м каждый, 3-санузла (инсталляции Grohee), ванна 180см, Отдельно душевая, керамогранит от лучших поставщиков, на стенах декоративный шелк и эмульсия, на полу ламинат 8мм-33класс с плотной подложкой, стеклопакеты, радиаторы, споты Philips -1год гарантии, все комнаты светлые, на потолке Сатин-натяжной потолок средней толщины с парящим эффектом, деври качественные, плинтус мдф, видео-домофон с возможностью просмотра периметра и разных ракурсов. На площадке футбольное поле, спортивный инвентарь, баскетбольное кольцо и детская площадка, есть зеленые деревья, большой холл, колясочные, 2лифта -Hyundai. Продаем в связи с расширением. квартира на гарантии от BI Group, хорошая локация, рядом школ, садики, Смолл продуктовый, Спортивные учреждения, бассейн, станция метро Алатау, удобная транспортная развязка."
https://krisha.kz//a/show/679533500,3,6,18,Розыбакиева,237,100.0,Розабакиева,nan,монолитный,nan,nan,хорошее,2021,R-House,Алматы,Бостандыкский,nan,проводной,лоджия,False,металлическая,2 с/у и более,паркинг,nan,ламинат,False,3.0,False,False,False,False,False,False,False,False,False,True,True,True,True,True,True,True,True,True,True,True,True,95000000,False,10,False,С панорамным видом
https://krisha.kz//a/show/679536053,1,12,12,nan,nan,42.89,nan,Тастак-3,монолитный,nan,nan,черновая отделка,2022,Lifetown,Алматы,Алмалинский,nan,nan,nan,False,nan,nan,паркинг,nan,nan,False,2.7,False,False,False,False,False,False,False,False,False,True,True,True,True,True,True,True,True,True,True,True,True,33000000,False,3,False,"Квартира продается в жилом комплексе комфорт-класса Lifetown - расположенный в спальном районе возле пересечения проспектов Сейфуллина и Райымбека, вблизи с ТРЦ MEGA Park. 
Преимущества покупки: 
Высота потолков 2, 7 метра; 
Сквозные подъезды; 
Крытый паркинг; 
Видеонаблюдение 24/7; 
Электрозамки; 
Видеодомофония; 
Ограниченный доступ во двор."
https://krisha.kz//a/show/677852990,3,7,9,Алтынсарина,68/3,99.6,nan,№1,монолитный,nan,nan,nan,2016,Сары Арка,Алматы,Ауэзовский,nan,nan,nan,False,nan,nan,nan,nan,nan,False,2.8,False,False,False,False,False,False,False,False,False,True,True,True,True,True,True,True,True,True,True,True,True,67000000,True,12,False,"Продам 3-х комнатную квартиру в ЖК Сарыарка. Тихий двор, охрана, камеры и игровая площадка. Светлая, уютная квартира с мебелью. Торг уместен"
https://krisha.kz//a/show/678753305,1,5,6,Жайлау,4/1,46.18,Алатау,nan,монолитный,nan,nan,черновая отделка,2022,Alma City,Алматы,Наурызбайский,nan,nan,балкон,False,nan,nan,nan,nan,nan,False,2.8,False,False,False,False,False,False,False,False,False,True,True,True,True,True,True,True,True,True,True,True,True,18500000,False,0,False,"Ключ можете получит, только за наличный расчёт, по переуступке"
https://krisha.kz//a/show/679449421,1,4,9,nan,nan,42.0,Саина Маречека,Аксай-2,панельный,12.0,nan,nan,1984,nan,Алматы,Ауэзовский,nan,оптика,nan,False,nan,совмещенный,рядом охраняемая стоянка,nan,ламинат,False,2.8,False,False,False,False,False,False,False,False,False,True,True,True,True,True,True,True,True,True,True,True,True,28200000,False,8,False,"Чистая светлая квартира, ремонт делали для себя, отдельно гардеробная узаконена, документы все в порядке 
Рядом школы, садики, маркеты, остановка, парковка"
https://krisha.kz//a/show/676071878,1,12,15,Толе би,273/9,56.0,nan,nan,монолитный,21.0,nan,nan,2016,Панорама,Алматы,Алмалинский,nan,nan,балкон,True,nan,совмещенный,паркинг,nan,ламинат,False,2.8,False,True,True,False,False,False,False,False,False,True,True,True,False,True,True,True,False,True,False,True,False,37000000,True,7,False,"Улучшенная, новая сантехника, кухня-студия, счётчики, неугловая, пластиковые окна, встроенная кухня, кондиционер."
https://krisha.kz//a/show/678734801,1,2,10,Алтын орда,5/2,47.4,nan,nan,монолитный,nan,nan,черновая отделка,2022,Alma City,Алматы,Наурызбайский,nan,nan,nan,False,nan,nan,nan,nan,nan,False,2.8,False,False,False,False,False,False,False,False,False,True,True,True,True,True,True,True,True,True,True,True,True,20500000,False,6,False,"Продаётся 1 комнатная квартира, по переуступке прав, за наличные, расходы по переуступке по полам. 
Продаётся ещё одна Квартира блок 19 кв 17.3 этаж 51, 6 кв метров 21, 5 млн"
https://krisha.kz//a/show/679190887,1,10,10,nan,nan,31.5,nan,Шугыла 340,монолитный,nan,nan,свободная планировка,2022,nan,Алматы,Наурызбайский,есть возможность подключения,оптика,балкон,False,металлическая,совмещенный,рядом охраняемая стоянка,nan,nan,False,2.8,False,True,True,False,False,False,False,False,False,False,True,False,False,True,False,False,False,False,True,False,False,16000000,False,0,False,"Неугловая, кухня-студия, тихий двор.
ЖК Алем сити. Новый перспективный район с развитой инфраструктурой (Акимат, ЦОН, школы, метро и тд) документы на руках. 
Подходит под ипотеку!"
https://krisha.kz//a/show/675989489,2,4,4,Чайковского,29,45.0,Макатаева,nan,панельный,6.0,nan,хорошее,1972,nan,Алматы,Алмалинский,отдельный,nan,балкон,True,металлическая,совмещенный,рядом охраняемая стоянка,полностью,nan,False,2.5,False,False,False,False,False,False,False,False,False,True,True,True,True,True,True,True,True,True,True,True,True,30500000,False,7,False,"2 х комнатная квартира в Алмалинском районе. квартира не угловая, тихий двор, дружные соседи, благоустроенный двор с детскими площадками. В шаговой доступности два детских садика, школа 90, школа 54, школа 15, ТЮЗ, ТРК Мega park, ЦУМ, Арбат. 
документы все в порядке, один собственник. Подходит под ипотеку. 
обмен НЕ ИНТЕРЕСУЕТ!"
https://krisha.kz//a/show/679049769,2,4,5,nan,nan,57.3,nan,Кулагер,иное,13.4,nan,хорошее,2006,nan,Алматы,Жетысуский,отдельный,оптика,лоджия,True,металлическая,раздельный,nan,полностью,линолеум,False,2.7,False,False,True,False,True,False,False,False,False,True,False,False,True,False,False,False,False,False,True,True,False,37000000,False,20,False,"Пластиковые окна, комнаты изолированы, тихий двор, кондиционер.
Светлая, очень тёплая! Один хозяин! 
Окна со стороны кухни выходят во двор, со стороны комнаты на пешеходную зону ( без парковки автотранспорта). 
 
В квартире установлены два кондиционера, счётчики воды и газа, сигнализация, интернет. Санузел раздельный. 
 
В шаговой доступности : гимназия, детский сад, Магнум, поликлиника, ЦОН и Акимат Жетысуйского района, зелёный парк для прогулок и занятия спортом, автобусная остановка (маршрут 56, 123, 17, 46, 77) ."
https://krisha.kz//a/show/677958432,3,11,21,Аль,nan,128.0,nan,nan,монолитный,17.8,nan,хорошее,2014,AFD PLAZA,Алматы,Бостандыкский,nan,nan,nan,True,nan,2 с/у и более,рядом охраняемая стоянка,nan,nan,False,3.0,False,False,False,False,False,False,False,False,False,False,True,False,False,False,False,False,False,False,False,False,False,135000000,False,9,False,"Неугловая.
Продается чистая, тихая квартира с мебелью в классическом стиле в охраняемом ЖК АФД Плаза! 2 отдельных санузла. Просторная отдельная кухня, техника Bosch. Мебель сделана в Италии, На окнах дополнительно установлены ролл-шторы - Дизайнерская немецкая сантехника от фирм Laufen, Villeroy & Boch, Grohe."
https://krisha.kz//a/show/669259034,4,3,6,Омаровой,37,104.0,nan,Юбилейный,монолитный,nan,nan,хорошее,2011,Европолис,Алматы,Медеуский,отдельный,ADSL,nan,False,бронированная,2 с/у и более,паркинг,полностью,ламинат,False,3.4,False,True,False,False,False,False,False,True,False,True,False,False,True,False,False,False,False,False,True,True,False,85000000,False,10,False,"Пластиковые окна, комнаты изолированы, тихий двор, кондиционер.
Удобная квартира, освещенная естественным светом, с видом на горы, для семьи, с современным дизайном интерьера, удобной планировкой, окнами в каждой комнате, просторным залом, стильной кухней, дизайнерской душевой, вторым санузлом, встроенными шкафами. Все отличного качества, как отделки, так и материалов, от сантехники, до мебельной фурнитуры, и самой мебели."
https://krisha.kz//a/show/678890237,3,5,7,nan,nan,113.0,nan,Горный Гигант 254,монолитный,nan,nan,хорошее,2017,Тау Шатыр,Алматы,Медеуский,отдельный,оптика,nan,False,металлическая,2 с/у и более,паркинг,nan,паркет,False,3.8,False,False,False,False,False,False,False,False,False,True,True,True,True,True,True,True,True,True,True,True,True,155000000,False,24,False,"Дизайн: нео-классика. 
Кухня/студия с посудомоечной машиной, электрической плитой, холодильником, морозильником, духовкой, и микроволновой печи. 
Также есть био-камин и стиральная машина 2в1 с сушкой."
https://krisha.kz//a/show/679440459,2,2,5,Райымбека,502а,62.0,nan,nan,кирпичный,16.0,nan,хорошее,1989,nan,Алматы,Ауэзовский,отдельный,nan,балкон и лоджия,False,металлическая,раздельный,рядом охраняемая стоянка,nan,линолеум,False,2.8,True,False,False,False,False,False,False,False,True,True,True,True,True,False,False,False,False,True,True,True,False,35000000,False,13,False,"Кондиционер, пластиковые окна, неугловая, улучшенная, комнаты изолированы, счётчики, тихий двор.
Продам тёплую уютную квартиру на 2 этаже. Всё в шаговой доступности рядом ТД Азия парк, детские сады, школы, магазины."
https://krisha.kz//a/show/679481968,3,4,10,Толе би,285,61.0,Отеген батыра,nan,монолитный,nan,57.0,nan,2022,CITY PLUS,Алматы,Ауэзовский,nan,nan,лоджия,True,бронированная,совмещенный,nan,частично,ламинат,False,2.8,False,False,False,False,False,False,False,False,False,True,True,False,False,True,True,True,False,True,True,False,False,39000000,False,13,False,"Пластиковые окна, неугловая, кухня-студия, встроенная кухня, новая сантехника, счётчики, тихий двор.
Продам классную квартиру в новом ЖК. Спальня, детская, зал и кухня ниша. Очень удобная планировка. Все окна смотрят во двор. Востребованный средний этаж. Сделан качественный ремонт. Большая лоджия с витражными окнами. Установлен современный кухонный гарнитур, шкаф в спальне. Подоконники из керамогранита. Все в светлых тонах. Рассмотрим наличку и пенсионные. Очень выгодное вложение как для себя, так и для сдачи в аренду. Спокойно можно сдать за 500-600тыс. Просмотр возможен по предварительной договорённости."
https://krisha.kz//a/show/679437865,3,9,14,Брауна,20,100.1,nan,Алмагуль,монолитный,12.0,nan,хорошее,2020,Braun,Алматы,Бостандыкский,есть возможность подключения,оптика,лоджия,True,бронированная,2 с/у и более,паркинг,nan,ламинат,False,2.85,False,True,True,True,False,True,True,False,False,False,False,False,True,False,False,False,False,False,False,False,False,150000000,False,11,False,"Комнаты изолированы.
Продаётся шикарная 3-х комнатная квартира для комфортной жизни, с прекрасной локацией, в шаговой доступности Мега Алматы, Магнум, множество кафе, баров, ресторанов, Российско- Казахстанская гимназия, развивайки и множество всякого. Квартира с хорошей энергетикой, с хорошим панорамным видом, в квартире ещё никто не жил, что очень важно. Продаётся со всем содержимым (Мебель, б. техника). Уютный охраняемый дворик с детской площадкой, террасой и т.д. Подземный паркинг. Риэлторам просьба не беспокоить."
