uri,room_count,floor,max_floor,street,house_number,general_area,intersection,microdistrict,building_type,kitchen_area,living_area,condition,build_year,residential_complex,city,district,telephone,internet,balcony,is_balcony_glazed,door,bathroom,parking,furniture,floor_type,former_hostel,ceiling_height,bars_on_the_window,security,entry_phone,code_lock,alarm,video_security,video_entry_phone,concierge,exchange_possible,plastic_windows,non_angular,improved,rooms_isolated,studio_kitchen,kitchen_builtin,new_plumbing,pantry,counters,quiet_courtyard,air_conditioning,commercial_convenient,price,mortgaged,images_count,private_hostel,text
https://krisha.kz//a/show/679038673,1,5,13,Журавлева,26,31.5,nan,nan,монолитный,nan,nan,черновая отделка,2022,Four Seasons,Алматы,Бостандыкский,nan,nan,nan,False,nan,nan,паркинг,nan,nan,False,3.0,False,False,False,False,False,False,False,False,False,True,True,True,True,True,True,True,True,True,True,True,True,29300000,False,4,False,"Продается однокомнатная квартира ! 
фотографии свежие 
расположение : 
Дом сдан в эксплуатацию. Располагается южнее Журавлева, восточнее Кекибайулы. Район активно застраивается, развитая инфраструктура, при этом достаточно отдален от шумных улиц. отличный вид из окна. Недалеко: ТРЦ ""Mega Center"", ALMA University, Парк первого Президента и Южный парк. Удобное расположение для выезда в любую точку города. Есть детские сады и общеобразовательные школы. 
Квартира 
Высота потолков 3 м. квадратура 31.5м2. все в черновой отделке и в свободной планировке. С проведенными работами по стяжке полов с установленными радиаторами. входная дверь с электрозамком. ЖК уровень ""бизнес"". 
обмен не предлагать. можно в ипотеку."
https://krisha.kz//a/show/679109100,3,2,3,Тайманова,224Б,142.0,Тайманова,nan,монолитный,19.0,nan,черновая отделка,2022,Luxury Park,nan,nan,nan,nan,nan,False,nan,2 с/у и более,паркинг,nan,nan,False,3.15,False,True,False,False,False,False,False,False,False,True,True,True,True,True,True,True,True,True,True,True,True,157000000,False,4,False,"На фото указана планировка для 3х комнатного варианта, можно легко переделать на 4х комнатный. Район очень тихий, и при этом не далеко от кольцевой пр-та Сейфуллина. Квартира с видом на сосновую рощу и во двор. Комплекс почти завершен, сдача в начале Ноября 2022."
https://krisha.kz//a/show/679493243,3,nan,nan,Мкр Калкаман,nan,143.0,nan,Калкаман-2,кирпичный,13.0,nan,черновая отделка,2022,nan,Алматы,Наурызбайский,nan,nan,балкон,False,металлическая,2 с/у и более,паркинг,nan,nan,False,3.2,False,False,False,False,False,False,False,False,False,True,True,True,True,True,True,True,True,True,True,True,True,78000000,False,16,False,"Продаётся таунхаус в двух уровнях. Шикарное местоположение, тихая тупиковая улица. Развитая инфраструктура. Рядом метро, американская школа, гимназия, детские сады. паРКинг на 2 машины (каждому), большой внутренний двор с беседкой и детской площадкой. Отдельная огороженная зона барбекю и небольшой палисадник. Маленький оазис в шумном городе. Дом из красного кирпича, утеплённый очень уютный. На первом этаже находятся: кухня, санузел, кладовая и зал 30 кВ. м. На втором расположены две спальни по 25кв. м. и 2 санузла. Всё сделано добротно и с любовью. Установлены автоматические ворота, кодовый замок, проведён видеодомофон. Российские металические двери, стеклопакеты Рихау."
https://krisha.kz//a/show/675945419,2,5,5,nan,nan,43.0,Паладина,Айнабулак-2 73,монолитный,6.0,45.0,хорошее,1985,nan,Алматы,Жетысуский,есть возможность подключения,ADSL,балкон,True,металлическая,совмещенный,паркинг,полностью,ламинат,False,2.8,False,False,True,False,False,True,False,False,True,True,True,False,False,False,True,False,False,True,True,True,False,28000000,False,11,False,"Кондиционер, пластиковые окна, неугловая, встроенная кухня, счётчики, тихий двор.
Хорошую квартиру 
в Айнабулаке 2 
Пластиковые окна, комнаты изолированы, кухня встроенная, полностью мебелерованая, новая сантехника, счётчики тихий двор, рядом парк, рядом поликлиника 11, клиники, мед центры общеобразовательные школы, спорткомплекс агаин, рынок торговые центры magnum, скиф, белес выгодные финансовые вложения для дальнейшего проживания. 
вся мебелерованая заезжай и живи! 
По всем интересующим вопросам обращайтесь любое удобное для вас время 
торг уместен при покупке !"
https://krisha.kz//a/show/679540886,2,13,17,Абая,164,44.0,Брусиловского,nan,монолитный,nan,nan,nan,2022,Terracotta,Алматы,Бостандыкский,nan,оптика,лоджия,True,металлическая,совмещенный,nan,nan,ламинат,False,3.0,False,True,True,False,False,False,False,False,False,True,True,False,False,True,True,True,False,False,False,False,False,43000000,False,13,False,"Пластиковые окна, неугловая, кухня-студия, встроенная кухня, новая сантехника.
Кухня-студия! только после ремонта. Всё новое и все остаётся."
https://krisha.kz//a/show/666564495,2,8,22,Бухар жырау,27/5,86.0,Шагабудэтдинова,nan,монолитный,nan,nan,nan,2009,Бухар Жырау Тауэрс,Алматы,Бостандыкский,отдельный,оптика,лоджия,True,металлическая,2 с/у и более,nan,полностью,ламинат,False,2.8,False,True,True,False,False,False,False,True,False,True,False,False,False,True,True,True,False,False,False,True,False,77000000,False,8,False,"Пластиковые окна, кондиционер, кухня-студия, встроенная кухня, новая сантехника."
https://krisha.kz//a/show/677439882,3,13,19,Брусиловского,167,71.0,nan,nan,монолитный,nan,nan,хорошее,2015,Алтын Булак,Алматы,Алмалинский,есть возможность подключения,ADSL,лоджия,False,металлическая,раздельный,паркинг,nan,ламинат,False,2.8,False,True,True,False,False,False,False,False,False,True,True,True,False,True,False,False,False,True,False,True,False,45300000,False,11,False,"Улучшенная, счётчики, пластиковые окна, неугловая, кондиционер, кухня-студия.
Вся бытовая техника и Мебель остаётся, Небольшой торг уместен"
https://krisha.kz//a/show/679170296,3,nan,nan,6 этаж,nan,115.6,nan,nan,монолитный,nan,nan,nan,2021,4YOU,Алматы,Бостандыкский,nan,nan,nan,False,nan,nan,nan,nan,nan,False,3.0,False,False,False,False,False,False,False,False,False,True,True,True,True,True,True,True,True,True,True,True,True,130000000,False,8,False,"Квартира в ЖК Фор Ю, бизнес класс, потолки 3 м"
https://krisha.kz//a/show/678664658,4,1,4,Жубанова,1,75.0,nan,nan,панельный,9.0,nan,хорошее,1971,nan,Алматы,Ауэзовский,nan,nan,nan,False,металлическая,раздельный,nan,nan,линолеум,False,nan,False,False,False,False,False,False,False,False,False,True,True,True,True,True,True,True,True,True,True,True,True,35500000,False,26,False,"Срочно продам улучшенную 4-х комнатную квартиру в центре ауэзовского р-на, не угловая, не сырая, тёплая зимой, соседи дружные смотрят за двором и оазисом. В шаговой доступности школы, университеты, базар Сары - Арка, метро, остановки, хорошая аура в квартире, очень удобно под коммерцию на пересечение двух улиц, можно вывести крыльцо, новая детская площадка и спортивная площадка work- out. от хозяина. 
Цена финальная и за наличный расчет."
https://krisha.kz//a/show/678966913,4,2,10,nan,nan,197.0,nan,Керемет 5 к13,монолитный,nan,nan,nan,2008,Керемет,Алматы,Бостандыкский,nan,оптика,балкон,True,бронированная,2 с/у и более,nan,nan,nan,False,3.0,False,False,False,False,False,False,False,False,False,True,True,True,True,True,True,True,True,True,True,True,True,165000000,False,13,False,"В квартиру вложено на ремонт и технику более 50млн. тг. Вся мебель, детали и техника брендовая дорогая. квартира светлая просторная и уютная. Продаем со всей мебелью и техникой. Вид на ТЦ «Forum». В залоге не состоит"
https://krisha.kz//a/show/678747479,1,4,9,Сейфуллина,51,26.0,Будденого,nan,монолитный,nan,nan,черновая отделка,2022,Теремки,nan,nan,nan,nan,балкон,False,металлическая,совмещенный,паркинг,nan,nan,False,2.7,False,False,False,False,False,False,False,False,False,True,True,False,False,False,False,False,False,True,False,False,False,14800000,False,11,False,"Пластиковые окна, неугловая, счётчики.
•Продаю квартиру-студию; 
отличная локация до центра 10 минут на машине, автобусы во все направления; рядом школа, дет сады - вся инфраструктура развита! 
 
•Идеально для молодой семьи или в аренду (всегда актуальна) ! 
 
• Немного вложений, квартира станет конфеткой; солнечная сторона, окна выходят не во двор. 
 
• ТОЛЬКО за наличный расчёт; ключи на руках! 
 
p.s. продажа напрямую от хозяина, в связи с расширением; риелторов прошу не беспокоить."
https://krisha.kz//a/show/678850386,1,5,9,Розыбакиева,45,39.0,Толе би,nan,кирпичный,8.0,nan,хорошее,1989,nan,Алматы,Алмалинский,nan,nan,nan,False,nan,совмещенный,nan,nan,nan,False,2.8,False,False,False,False,False,False,False,False,False,True,True,True,True,True,True,True,True,True,True,True,True,28500000,False,10,False,"Представляю вашему вниманию квартиру, расположеную в одном из перспективных районов города, с лучшей транспортной развязкой во все направления города. Квартира уютная, чистая. В данный момент живут арендаторы, более 2-х лет. В аренду сдается в день подачи объявления. Во двор посторонние машины не заезжают, т. к стоит шлагбаум организованный жильцами данного дома. Соседи спокойные. Продаю в связи с расширением семьи. Все что видите на фотографиях, все остается. Квартира по очень хорошей цене на сегодняшний день! Заезжай и живи!"
https://krisha.kz//a/show/673135003,1,2,4,nan,nan,47.4,nan,Зердели,nan,17.4,20.4,nan,2014,nan,Алматы,Алатауский,nan,nan,nan,False,металлическая,совмещенный,рядом охраняемая стоянка,nan,ламинат,False,3.0,False,True,True,False,False,False,False,False,False,True,True,True,False,False,True,True,False,True,True,False,False,23000000,False,14,False,"Встроенная кухня, тихий двор, пластиковые окна, новая сантехника, улучшенная, счётчики, неугловая.
Отличная квартира в Алатуском районе, микрорайоне Зердели 47, 4 кв. м! Дом крепкий, построен из качественных материалов. 
Квартира очень тёплая и уютная (не угловая), большая кухня - 17, 4 кв. м. можно кровать поставить, светлая, потолки 2.8 м, с тёплыми полами. На площадке всего 3 квартиры. Солнечная сторона, шикарный этаж, дом стоит на первой линии (100 метров до остановки) ! Тихий огороженный двор с игровой площадкой, мест для парковки достаточно, большой остекленный балкон. есть возможность взять место в подвале. Рядом находятся садики, школы, поликлиника, аптеки, медцентры, салоны красоты, воркаут площадки, футбольные площадки, большой спортивный комплекс Алматы Арена, супермаркет Магнум, Автоцон, ЦОН. Мебель остается в квартире. Ипотеку проходит, заезжай и живи! звонить и просмотр квартиры в любое время! ХОЗЯИН. СРОЧНО ТОРГ!"
https://krisha.kz//a/show/679306940,2,9,10,Толе би,285,52.0,Отеген батыра,nan,монолитный,nan,nan,хорошее,2022,CITY PLUS,Алматы,Ауэзовский,есть возможность подключения,оптика,nan,True,металлическая,совмещенный,рядом охраняемая стоянка,nan,ламинат,False,2.8,False,False,True,False,False,False,False,False,False,True,True,True,False,True,False,False,False,False,False,False,False,34000000,False,15,False,"Пластиковые окна, неугловая, улучшенная, кухня-студия.
Уютная квартира с хорошим ремонтом и удачной планировка, большая кухня студия, спальня, гардероб. ремонт делался для себя из качественных материалов, ламинат 33 класса, натяжные потолки, стены под покраску, качественный кераморгранит, остекленный балкон, подоконники из искусственного камня, удачное местоположение вдоль одной из главных артерий города - ул. толе би, в шаговой доступности ТРЦ City Plus."
https://krisha.kz//a/show/679428120,3,2,6,Манаева,92,70.0,nan,Горный Гигант,монолитный,nan,nan,хорошее,2017,Bloom House,Алматы,Медеуский,nan,nan,nan,False,металлическая,совмещенный,паркинг,nan,ламинат,False,3.0,False,True,False,False,False,True,False,False,False,True,True,True,True,True,True,True,True,True,True,True,True,76000000,False,25,False,"Квартира в Горном Гиганте, Медеуский район. Пластиковые окна, комнаты изолированы, кухня студия, встроенная кухня, новая сантехника, теплые полы, 2 клодовки, паРКинг на две машины, тихий двор. Вся бытовая техника. Охрана, видео наблюдение, в центре города, удобное расположение, прямой выход в 5 минутах на Аль-Фараби., безопасная территория охраняемая 24/7."
https://krisha.kz//a/show/677338834,2,1,2,nan,nan,40.0,ул мустафина,Карагайлы 1,кирпичный,21.0,nan,хорошее,1975,nan,Алматы,Наурызбайский,отдельный,ADSL,nan,False,металлическая,совмещенный,паркинг,nan,ламинат,False,2.8,True,False,False,False,False,True,False,False,False,True,True,True,True,True,True,True,False,True,True,False,False,21000000,False,15,False,"Пластиковые окна, неугловая, улучшенная, комнаты изолированы, кухня-студия, встроенная кухня, новая сантехника, счётчики, тихий двор.
Квартира хорошая 
в квартире эвро ремонт 
пластиковые окна 
решётки на окнах 
стоянка для машины возле окна 
садик. магазины в пешом расстоянии 
остановка конечноя. квартира уютная, чистая. продаём есть торг"
https://krisha.kz//a/show/669099628,3,2,9,Карасай батыра,156,74.5,Ауэзова,nan,панельный,12.0,42.0,хорошее,1990,nan,Алматы,Алмалинский,nan,оптика,лоджия,True,бронированная,раздельный,nan,nan,ламинат,False,2.85,False,False,True,False,False,True,False,False,False,True,True,True,True,False,False,False,False,True,True,False,False,49000000,False,8,False,"Пластиковые окна, неугловая, улучшенная, комнаты изолированы, счётчики, тихий двор.
Квартира с большой кухней 12кв. м., Центр. 
 
Высота потолков 2.85 метров 
 
Не угловая, *Королевский* этаж, теплая, зимой дети ходят в майке и шортах. 
 
Не залоговая. документы в полном порядке, Окна на две стороны, видно деток во дворе, хорошо проветривается. Все комнаты и санузлы раздельные 
 
Качественной постройки 
Двор ухоженный, имеются новые спортивные и детские площадки, тренажёры 
 
Рядом много школ, садиков, магазинов 
Перед домом огромная бесплатная парковка"
https://krisha.kz//a/show/679539902,2,8,10,Мкр,nan,52.4,nan,Шугыла,монолитный,18.0,nan,черновая отделка,2022,Alem City,Алматы,Наурызбайский,nan,nan,nan,False,nan,nan,паркинг,nan,nan,False,2.7,False,False,False,False,False,False,False,False,False,True,True,True,True,True,True,True,True,True,True,True,True,23500000,False,4,False,"Дом расположен в очень хорошем районе с развивающей инфаструкторой, рядом акимат, Цон, детский парк 《Алем》, все шаговой доступность, вид с окон на горы, Дом расположен ближе к проспекту АБАЯ Все документы есть на руках, квартира не угловая, скоро метро тоже будеть."
https://krisha.kz//a/show/679349572,3,4,9,Аскарова Асанбая,21,98.0,nan,Мирас,nan,nan,nan,хорошее,2017,Аль-Фараби,Алматы,Бостандыкский,есть возможность подключения,оптика,лоджия,False,металлическая,2 с/у и более,паркинг,nan,паркет,False,3.0,False,True,True,False,False,True,False,False,False,True,True,True,True,True,True,True,True,True,True,True,False,88000000,False,9,False,"Кондиционер, пластиковые окна, неугловая, улучшенная, комнаты изолированы, кухня-студия, встроенная кухня, новая сантехника, кладовка, счётчики, тихий двор."
https://krisha.kz//a/show/674362699,3,4,4,Культобе,nan,114.0,nan,nan,монолитный,nan,nan,nan,2022,Nef Uptown,nan,nan,есть возможность подключения,оптика,несколько балконов или лоджий,False,бронированная,2 с/у и более,nan,nan,nan,False,4.0,False,True,True,True,False,True,True,True,False,True,True,True,True,True,True,True,True,True,True,True,True,120000000,False,12,False,"3 стороны квартиры - витражные бронированные 4-х метровые витражи в пол, шикарный панорамный вид. Таких квартир в комлексе всего 8. По всей квартире вкруговую террасы. ключи от квартиры выдали, на руках. Можно начинать ремонт. Все современные фишки от электронных замков до системы foldhome, в которую входят: банкетные залы, гостевые номера для ваших гостей, караоке, фитнес зал, детский клуб, игровая комната, музыкальная студия, кинотеатр крытый и открытый, смотровая вышка, spa, meeting room, винотека, бассейн и еще море других ништячков. На указанный номер не звонить. Писать по указанному номеру, я отвечу и созвонимся!"
