uri,room_count,floor,max_floor,street,house_number,general_area,intersection,microdistrict,building_type,kitchen_area,living_area,condition,build_year,residential_complex,city,district,telephone,internet,balcony,is_balcony_glazed,door,bathroom,parking,furniture,floor_type,former_hostel,ceiling_height,bars_on_the_window,security,entry_phone,code_lock,alarm,video_security,video_entry_phone,concierge,exchange_possible,plastic_windows,non_angular,improved,rooms_isolated,studio_kitchen,kitchen_builtin,new_plumbing,pantry,counters,quiet_courtyard,air_conditioning,commercial_convenient,price,mortgaged,images_count,private_hostel,text
https://krisha.kz//a/show/679300265,2,5,9,nan,nan,61.0,nan,Думан-2 57,монолитный,37.0,nan,хорошее,2021,Green City,Алматы,Медеуский,есть возможность подключения,проводной,nan,False,бронированная,раздельный,паркинг,nan,ламинат,False,nan,False,True,True,True,False,True,True,True,False,True,True,True,False,False,True,True,True,False,True,True,False,52000000,False,21,False,"Пластиковые окна, тихий двор, неугловая, новая сантехника, встроенная кухня, кондиционер, кладовка, улучшенная.
Новый дом, свежий, капитальный ремонт, делали для себя. Встроенная мебель, кухня, кондиционер, дорогая сантехника, витражные окна. Чистый и спокойный район, свежий воздух, вид на горы. Большая, закрытая детская площадка, все удобства. Рядом находится Магнум, рестораны, салоны красоты, магазины, спорт комплекс «Халык арена», мечеть, детские сады и школы, все для комфортного проживания. ЖК Гринсити -комфорт плюс. Заезжай и живи, вы экономите своё время и нервы на ремонт. Квартира узаконена после перепланировки. Не в залоге, документы в порядке. Не большой торг реальным клиентам. Тел"
https://krisha.kz//a/show/675380452,1,10,10,Мкр,nan,48.0,nan,Шугыла,монолитный,nan,nan,nan,2022,Alem City,Алматы,Наурызбайский,nan,nan,nan,False,nan,nan,nan,nan,nan,False,nan,False,False,False,False,False,False,False,False,False,False,False,False,False,True,False,False,False,False,False,False,False,18100000,False,3,False,"Кухня-студия.
«Alem City» - это новый проект от компании «Qazaq Stroy» в котором учтено всё, на что обращают внимание при выборе квартиры. Удобное месторасположение, развитая инфраструктура района, современный дизайн фасадов, доступная цена, не отменяющая высокое качество постройки. 
 
расположение: Наурызбайский район по ул. Жунисова 
Каркас: железобетонный монолит 
Бесшумные высокоскоростные лифты 
Будут предусмотрены комфортные места для отдыха и пеших прогулок 
 
Особым преимуществом для жителей ЖК «Alem City» будет являться возможность пользоваться уже существующей инфраструктурой района. Все административные здания, муниципальные объекты, рынки, торговые комплексы и многое другое находится в пределах шаговой доступности. Расширение города обеспечит удобную развязку и транспорт во все направления. 
 
Сдача квартиры по документам - сентябрь 2022 года по переуступке, только за наличный расчет. 
 
После проведения метро до района Шугыла, квартиры станут перспективные и заметно подорожают. Сейчас цена ниже, чем у застройщика."
https://krisha.kz//a/show/678259413,3,4,9,Сейфуллина,51,61.0,nan,nan,монолитный,nan,nan,черновая отделка,2022,Теремки,Алматы,Жетысуский,nan,nan,nan,False,nan,nan,паркинг,nan,nan,False,2.8,False,False,False,False,False,False,False,False,False,True,True,True,True,True,True,True,True,True,True,True,True,29500000,False,0,False,"Квартиру в жк Теремки 61квадрат, 4этаж, свободная планировка, черновая отделка, сдан в эксплуатацию ключи на руках 
Ипотеки нет."
https://krisha.kz//a/show/672688681,4,12,16,nan,nan,132.0,nan,Шугыла 1-29,монолитный,20.0,nan,хорошее,2012,Премьера,Алматы,Наурызбайский,нет,проводной,лоджия,True,бронированная,2 с/у и более,рядом охраняемая стоянка,nan,ламинат,False,3.0,False,False,True,False,False,True,False,False,False,True,False,True,True,False,True,True,False,True,True,False,False,55000000,False,36,False,"Комнаты изолированы, улучшенная, счётчики, пластиковые окна, новая сантехника, встроенная кухня, тихий двор.
Пластиковые окна, улучшенная, комнаты изолированные. квартира светлая, теплая, уютная. Хорошие соседи, в подъезде установлены пассажирский и грузовой лифты. Удобное расположение, перспективный район, рядом школы, детские садики, рынки. Скоро откроют «метро». Полностью меблирована. квартира чистая, ухоженная. Заезжай и живи."
https://krisha.kz//a/show/674620097,1,2,5,nan,nan,42.3,Омарова,Кулагер 53,кирпичный,10.0,24.1,требует ремонта,2005,nan,Алматы,Жетысуский,nan,nan,nan,False,nan,совмещенный,nan,полностью,линолеум,False,2.7,False,False,True,False,False,False,False,False,False,True,False,True,False,False,True,False,False,False,False,True,False,22000000,False,7,False,"Пластиковые окна, улучшенная, встроенная кухня, кондиционер.
1-х комнатная теплая на 2-м этаже в кирпичном доме напротив школы №148 необходим косметический ремонт, идеальная квартира для сдачи, с готовыми жильцами Инфраструктура развитая, рядом парк, поликлиника, цон, 2 школы, детские сады, ипподром. Можно за наличный расчёт и в ипотеку Новый техпаспорт, расширение зала за счет балкона узаконено!. У КОГО НЕТ ВЫШЕУПОМЯНУТОЙ СУММЫ, ПРОШУ НЕ ЗВОНИТЬ И ЗРЯ НЕ БЕСПОКОИТЬ. ЕСЛИ реальный покупатель, возможен ТОРГ В РАЗУМНЫХ ПРЕДЕЛАХ! Мы никуда не торопимся! В подарок сухой подвал площадью 38 кв м со светом и железной дверью."
https://krisha.kz//a/show/672426203,4,16,16,Жуалы,1-29,160.0,nan,Шугыла,монолитный,19.0,100.0,хорошее,2014,Премьера,Алматы,Наурызбайский,отдельный,ADSL,лоджия,True,бронированная,2 с/у и более,паркинг,частично,линолеум,False,2.8,True,False,True,False,False,False,False,False,False,True,False,True,True,False,True,False,False,True,False,False,False,45000000,False,7,False,"Пластиковые окна, улучшенная, комнаты изолированы, встроенная кухня, счётчики.
Срочно продается большая квартира, теплые полы, новые межкомнатные двери, окна, бронированная входная дверь, решетки на окнах для защиты от выпадения детей, две гардеробные с полками. Последний этаж дает прекрасный вид на город, горы и чистый воздух. Есть лифты (грузовой и пассажирский), поэтому нет разницы на каком этаже живешь 6 или 16, плюс никто не шумит сверху. документы все в порядке. торг уместен!"
https://krisha.kz//a/show/679299868,2,1,5,Геологов,7,50.0,Камаз,Кокжиек,панельный,nan,nan,nan,1987,nan,Алматы,Жетысуский,отдельный,ADSL,nan,True,металлическая,совмещенный,рядом охраняемая стоянка,nan,линолеум,False,2.7,True,False,True,False,False,True,False,False,False,True,True,True,True,False,False,False,False,True,True,False,False,29000000,False,8,False,"Пластиковые окна, неугловая, улучшенная, комнаты изолированы, счётчики, тихий двор."
https://krisha.kz//a/show/678192243,3,1,9,nan,nan,76.2,nan,Шугыла 341,монолитный,12.7,46.8,хорошее,2019,Шугыла,Алматы,Наурызбайский,nan,проводной,лоджия,True,металлическая,раздельный,рядом охраняемая стоянка,nan,линолеум,False,2.8,True,False,True,False,False,False,False,False,False,True,True,True,True,False,True,True,False,True,True,False,True,43200000,True,23,False,"Пластиковые окна, тихий двор, удобно под коммерцию, неугловая, улучшенная, комнаты изолированы, встроенная кухня, новая сантехника, счётчики.
Чистая Квартира на 1-ом этаже, есть возможность переделать под коммерций."
https://krisha.kz//a/show/677463056,2,4,5,Гоголя,174,51.4,nan,nan,кирпичный,7.4,nan,требует ремонта,1981,nan,Алматы,Алмалинский,nan,nan,несколько балконов или лоджий,False,металлическая,раздельный,рядом охраняемая стоянка,nan,линолеум,False,2.7,False,False,True,False,False,False,False,False,False,False,True,False,False,False,False,False,True,True,True,False,False,45000000,False,10,False,"Неугловая, счётчики, кладовка, тихий двор.
Продам двухкомнатную квартиру в кирпичном доме. Обустроенная современная детская площадка во дворе, рядом есть школы, детский сад прямо около дома, поликлиника. Дом качественной постройки, но в квартире уже давно не было ремонта. 
Потолок 2, 7м. 
В квартире есть зал 18кв м., спальня 13 кв м., кухня 7, 4 кВ м., раздельно: ванная комната (2, 4 кВ м) и отдельно туалет (1, 2 кВ м), также имеется кладовка можно сделать гардеробную (2, 4кв. м), коридор 7, 4 кВ м. Есть два балкона, один со стороны зала и один со спальни, оба идут на Южную сторону, квартира солнечная, Зимой не холодно. 
Есть возможность провести в квартиру оптоволоконный интернет (ID net) и любой другой, есть телефон и домофон."
https://krisha.kz//a/show/673702536,3,3,5,Санаторий Алматы,4,59.0,nan,nan,панельный,6.1,nan,nan,1979,nan,Алматы,Бостандыкский,отдельный,проводной,nan,True,металлическая,совмещенный,nan,nan,линолеум,False,2.6,False,False,True,False,False,False,False,False,False,True,True,True,True,True,True,True,True,True,True,True,True,35000000,False,12,False,None
https://krisha.kz//a/show/679107214,2,4,5,Толе Би,nan,56.8,Ади Шарипова,nan,кирпичный,9.0,28.6,хорошее,1986,nan,Алматы,Алмалинский,nan,nan,балкон и лоджия,True,металлическая,раздельный,рядом охраняемая стоянка,полностью,линолеум,False,2.7,False,False,True,False,False,True,False,False,False,True,False,True,True,False,True,True,False,True,True,False,False,50000000,False,11,False,"Пластиковые окна, улучшенная, комнаты изолированы, встроенная кухня, новая сантехника, счётчики, тихий двор.
Квартира в центре города, дом кирпичный (совминовский, толщина стен 60-70 см) теплый, сейсмоустойчивый, двор изолированный, тихий, спокойные интеллегентные соседи. Район с развитой инфраструктурой: рядом банки, гимназия, университеты (КазНУ, КазТУ), детсад, супермаркет Магнум, остановка. Квартира улучшенная, комнаты изолированы, встроенная кухня, новая сантехника, счетчики, раздельный санузел, два застекленных балкона (в техплан не внесены, это + 8 кв. м). Продается со всей мебелью и техникой. Спальный гарнитур, кухонный гарнитур (дерево, пр-во Румыния), межкомнатные двери - дерево, мягкая мебель, техника: телевизор, холодильник, стиральная машина, газовая плита, микроволновка и т.д. Продает хозяйн. 
ПРОСЬБА: РИЭЛТОРОВ НЕ БЕСПОКОИТЬ"
https://krisha.kz//a/show/676671620,1,13,16,nan,nan,63.0,nan,Шугыла,монолитный,15.4,nan,среднее,2012,Премьера,Алматы,Наурызбайский,nan,nan,nan,True,металлическая,nan,паркинг,nan,nan,False,nan,False,False,False,False,False,False,False,False,False,True,True,True,True,True,True,True,True,True,True,True,True,26500000,False,7,False,"Квартиру площадью 63 м2. С красивым видом. Большой, уютный двор, огороженные детские площадки. В шаговой доступности школы №174, 157, детские садики, кафе, акимат, ЦОН, поликлиника №36, служба скорой медицинской помощи №11 и все что нужно для комфортного проживания."
https://krisha.kz//a/show/677780392,1,2,5,Сауранбаева,nan,35.2,Тлеуберды,nan,монолитный,7.3,nan,хорошее,2013,nan,Алматы,Турксибский,отдельный,оптика,балкон,False,металлическая,совмещенный,рядом охраняемая стоянка,nan,линолеум,False,2.7,True,False,True,False,False,True,False,False,True,True,True,True,False,False,True,True,False,True,False,True,False,25000000,False,20,False,"Кондиционер, пластиковые окна, неугловая, улучшенная, встроенная кухня, новая сантехника, счётчики.
Однокомнатную улучшенную квартиру 35, 2(16, 8)7, 3 . санузел совместный, на окнах решетки, кондиционер, встроенная кухня, счётчики, балкон. Рядом в шаговой доступности находится Цон, поликлиники 9, 13, торговые центры Март, Жибек Жолы, стадион Алаш, школы гимназия 83, школы 59, 61, 76, детские сады, ДКЖ. цена 25000000 млн. тенге. Торга нет. в 
Возможен обмен на 2-3 комнатную с нашей доплатой в нашем районе."
https://krisha.kz//a/show/674267800,2,1,5,nan,nan,42.0,nan,Айнабулак-3 134,панельный,6.0,nan,хорошее,1984,nan,Алматы,Жетысуский,отдельный,ADSL,nan,False,металлическая,совмещенный,nan,nan,ламинат,False,2.5,True,False,True,False,False,True,False,False,False,True,False,False,False,False,True,True,False,True,True,False,True,28000000,False,13,False,"Пластиковые окна, удобно под коммерцию, встроенная кухня, новая сантехника, счётчики, тихий двор.
Квартиру в отличном состоянии! после ремонта, мебель новая, сантехнику заменили. Удобное расположение, рядом школы, сады, поликлиника, парк, магазины, базар. Полисадник огорожен, имеется вода для полива, все документе в норме!"
https://krisha.kz//a/show/677294594,2,6,10,Назарбаева,36,85.0,Маметовой,nan,монолитный,14.0,nan,хорошее,2020,Ush Qonyr,Алматы,Медеуский,nan,оптика,nan,False,бронированная,раздельный,паркинг,nan,ламинат,False,2.75,False,True,True,False,False,True,False,False,False,False,True,False,False,False,False,False,False,False,True,True,False,74500000,False,12,False,"Неугловая, тихий двор, кондиционер.
Торг в разумных пределах! 
Просмотр в вечернее время. 
Шикарная, просторная квартира с евроремонтом. Все материалы стоящие. Техника новая, имеются чеки, а также действующие гарантии на технику. Встроенный шкаф-гардероб и встроенная кухня выполнена из высококачественных материалов. квартира просторная и светлая. 
Жк расположен на границах улиц Фурманова и Кунаева в хорошо развитом районе города. Рядом с новостройкой проходят достаточно оживленные автомагистрали. Рядом имеются круглосуточные супермаркеты, продуктовые магазины, кафе, стоматологическая клиника и полицейский участок, почтовое отделение, банки и бизнес-центр. В полукилометре от ЖК есть крупные ТЦ «ГУМ», «ЦУМ», Арбат и «Магнум», пиццерия, мебельный магазин, ТЮЗ им. Г. Мусрепова и живописный сквер. 
В радиусе километра находится гимназия №147, ясли-сад №30, юношеская библиотека, детский сад, общеобразовательная школа №12, академия транспорта и коммуникаций, гуманитарный университет профсоюзов, колледж технологии и менеджмента и другие учебные заведения. 
Возле ЖК хорошо налажено движение городского транспорта. До станции метро «Райымбек батыра» можно дойти за три минуты. Возле новостройки имеется остановка – по проспекту Назарбаева"
https://krisha.kz//a/show/679476276,3,1,5,Радостовца,nan,70.0,Утепова,nan,кирпичный,14.0,nan,хорошее,1995,nan,Алматы,Бостандыкский,отдельный,ADSL,nan,False,металлическая,совмещенный,рядом охраняемая стоянка,nan,ламинат,False,nan,True,True,True,True,True,True,True,True,True,True,True,True,True,False,True,True,True,True,True,False,False,56900000,False,20,False,"Пластиковые окна, неугловая, улучшенная, комнаты изолированы, встроенная кухня, новая сантехника, кладовка, счётчики, тихий двор.
Квартира, светлая, теплая и уютная. Окна юг-север. Рядом 165 лицей, клиника ДостарМед, Мегацентр, университет Alma U, парк 'Южный', поликлиника, школы. и. т. д. Дом находится выше ул Утепова, тихий двор."
https://krisha.kz//a/show/674813609,1,10,10,nan,nan,38.0,Саина,Аксай-1,монолитный,nan,nan,хорошее,2018,Адиет,Алматы,Ауэзовский,nan,nan,балкон,True,металлическая,совмещенный,nan,nan,ламинат,False,3.0,False,True,True,False,False,True,False,False,False,True,True,False,False,True,True,True,False,True,False,False,False,31000000,False,7,False,"Встроенная кухня, счётчики, неугловая, кухня-студия, новая сантехника, пластиковые окна.
Здравствуйте! Срочно продаётся полутарка, с евроремонтом и полностью мебелью, в квартире даже есть посуда, заезжай и живи! Дом находится между Толе би и Ташкентской, Саина и Момышулы. Рядом ТРЦ Азия парк, гос садик, Школы, удобно проехать в любую часть города! Утеплённый балкон! Приятные соседи!"
https://krisha.kz//a/show/679453760,2,4,7,Толе би,69,76.0,Чайковского,nan,кирпичный,13.0,nan,хорошее,1992,nan,Алматы,Алмалинский,отдельный,оптика,балкон,True,металлическая,раздельный,рядом охраняемая стоянка,частично,ламинат,False,2.7,False,True,False,False,True,False,False,False,False,True,False,True,True,False,True,True,True,False,False,False,False,72000000,False,3,False,"Пластиковые окна, улучшенная, комнаты изолированы, встроенная кухня, новая сантехника, кладовка.
Продается двухкомнатная квартира, улучшенная, не требует вложений"
https://krisha.kz//a/show/678410499,3,4,12,nan,nan,75.0,Абая Момышулы,Жетысу-3 55,монолитный,21.0,nan,хорошее,2008,nan,Алматы,Ауэзовский,нет,через TV кабель,лоджия,True,металлическая,совмещенный,рядом охраняемая стоянка,nan,линолеум,False,2.8,False,False,False,False,False,False,False,False,False,True,True,True,True,True,True,True,True,True,True,True,True,57000000,True,14,False,"Здравствуйте! Продаём в связи с переездом в другой город! Квартира очень комфортная с хорошей аурой! 
Квартира идеальна для людей с евро вкусом ! Хорошая инфраструктура Метро, Магнум, магазин прям во дворе! 
Двор огорожден шлагбаумом, есть место на бесплатной стоянке! Этаж 4 не угловая, 2 лифта грузовой и пассажирский! Приходите смотрите и вы увидите плюсы этой квартиры!"
https://krisha.kz//a/show/679476109,1,1,5,nan,nan,40.0,Дежнева,Таугуль д 21,панельный,8.0,nan,nan,1989,nan,Алматы,Ауэзовский,nan,nan,nan,False,nan,раздельный,nan,nan,nan,False,2.8,True,False,True,False,False,True,False,False,False,True,False,True,False,False,False,False,False,False,True,False,False,28500000,False,22,False,"Пластиковые окна, улучшенная, тихий двор."
