uri,room_count,floor,max_floor,street,house_number,general_area,intersection,microdistrict,building_type,kitchen_area,living_area,condition,build_year,residential_complex,city,district,telephone,internet,balcony,is_balcony_glazed,door,bathroom,parking,furniture,floor_type,former_hostel,ceiling_height,bars_on_the_window,security,entry_phone,code_lock,alarm,video_security,video_entry_phone,concierge,exchange_possible,plastic_windows,non_angular,improved,rooms_isolated,studio_kitchen,kitchen_builtin,new_plumbing,pantry,counters,quiet_courtyard,air_conditioning,commercial_convenient,price,mortgaged,images_count,private_hostel,text
https://krisha.kz//a/show/677783976,2,17,18,Абая,164/1,65.0,Брусиловского,nan,монолитный,nan,nan,черновая отделка,2022,Terracotta,Алматы,Бостандыкский,есть возможность подключения,ADSL,лоджия,False,металлическая,раздельный,паркинг,nan,nan,False,3.0,False,False,True,False,False,True,True,False,False,True,True,False,True,False,False,False,False,False,False,False,False,42500000,False,2,False,"Пластиковые окна, неугловая, комнаты изолированы.
Ввод в эксплуатацию сентябрь. Окна смотрят во двор. 
2 очередь. 
 
Можно взять в ипотеку по 7-20-25 
 
квартира продается по переуступке прав. Остаток оплаты застройщику - 23 млн. Разница выплачивается продавцу."
https://krisha.kz//a/show/678761168,1,2,6,nan,nan,40.92,nan,Шугыла,монолитный,nan,nan,черновая отделка,2022,Alma City,Алматы,Наурызбайский,nan,nan,несколько балконов или лоджий,False,металлическая,nan,nan,nan,nan,False,2.8,False,False,False,False,False,False,False,False,False,True,True,True,True,True,True,True,True,True,True,True,True,18500000,False,3,False,"Дом построен, в настоящее время идет ремонт подъезда. Выдача ключей в конце сентября. переуступка прав, только наличными. 
Свободная планировка, можно сделать евро-двушку. 
Рядом Леруа Мерлен, Апорт, Магнум, Алтын-орда."
https://krisha.kz//a/show/679303035,1,5,7,Северное кольцо,86/7,29.0,nan,Ожет,монолитный,nan,nan,хорошее,2014,nan,Алматы,Алатауский,есть возможность подключения,оптика,балкон,True,металлическая,совмещенный,паркинг,nan,паркет,False,2.8,False,False,True,False,False,True,False,False,False,False,True,False,False,True,False,False,False,False,True,False,False,17500000,False,5,False,"Неугловая, кухня-студия, тихий двор.
Продается квартира в связи с переездом. Внутри остаётся вся техника. Возможен вариант косметического ремонта перед продажей."
https://krisha.kz//a/show/676883389,4,5,5,nan,nan,77.0,Тургут Озала,Тастак-3,панельный,10.6,nan,хорошее,1980,nan,Алматы,Алмалинский,есть возможность подключения,через TV кабель,несколько балконов или лоджий,True,металлическая,раздельный,рядом охраняемая стоянка,nan,ламинат,False,2.8,False,False,True,False,False,False,False,False,False,True,True,False,False,False,True,True,True,False,True,False,False,45000000,False,15,False,"Кладовка, новая сантехника, тихий двор, неугловая, встроенная кухня, пластиковые окна.
Квартира после ремонта. Ремонт делали для себя, из качественных и дорогих материалов, немецкие окна, польский ламинат, дорогие межкомнатные двери, все трубы заменены, встроенная мебель в подарок! Рядом несколько школ, детские сады, прогулочная зона, кафе, спортивные залы. Широкий двор где всегда есть место для парковки. Через дорогу остановка общественного транспорта."
https://krisha.kz//a/show/679112950,3,2,4,nan,nan,63.0,Гагарина,Алмагуль 12,панельный,6.0,nan,nan,1971,nan,Алматы,Бостандыкский,отдельный,проводной,nan,True,металлическая,раздельный,рядом охраняемая стоянка,nan,линолеум,False,2.8,False,False,False,False,False,True,False,False,False,True,True,False,True,False,False,True,False,True,True,False,False,43500000,False,6,False,"Пластиковые окна, неугловая, комнаты изолированы, новая сантехника, счётчики, тихий двор.
Продам трёх комнатную квартиру. 
в состоянии ремонта, поменяли потолки, трубы, сан технику, кафель. 
квартира находится на втором этаже, в середине, не угловая., мирные, тихие соседи. 
рядом 63, 73 школы, много дет модов, в двух остановках Магнум, в одной остановке ВДНХА, Ботанический сад. 17 больница, Санна, и многое другое. риэлторы не беспокоить. квартира хорошая, с хорошей аурой. от хозяина. фото не все соответствуют. так как начали ремонт"
https://krisha.kz//a/show/678925953,3,1,16,Абишева,nan,80.0,nan,nan,монолитный,nan,nan,хорошее,2020,Gulder,Алматы,Наурызбайский,nan,nan,лоджия,False,металлическая,2 с/у и более,паркинг,nan,nan,False,2.7,False,False,False,False,False,False,False,False,False,True,True,True,True,True,True,True,True,True,True,True,True,55000000,False,9,False,"Продам 3х комнатную, застрощиком является Bi group. Дом сдан в эксплуатацию 2020 году. Рядом с ЖК находятся все, что необходимо для комфортной жизни. Охраняемая территория, современный двор, паркинг, видео наблюдение…"
https://krisha.kz//a/show/678925953,3,1,16,Абишева,nan,80.0,nan,nan,монолитный,nan,nan,хорошее,2020,Gulder,Алматы,Наурызбайский,nan,nan,лоджия,False,металлическая,2 с/у и более,паркинг,nan,nan,False,2.7,False,False,False,False,False,False,False,False,False,True,True,True,True,True,True,True,True,True,True,True,True,55000000,False,9,False,"Продам 3х комнатную, застрощиком является Bi group. Дом сдан в эксплуатацию 2020 году. Рядом с ЖК находятся все, что необходимо для комфортной жизни. Охраняемая территория, современный двор, паркинг, видео наблюдение…"
https://krisha.kz//a/show/679479388,3,3,12,Кармысова,nan,72.0,Курмангазы,nan,монолитный,nan,nan,nan,2022,Exclusive Star,Алматы,Медеуский,nan,nan,лоджия,False,металлическая,раздельный,nan,без мебели,ламинат,False,2.85,False,True,False,False,False,False,False,False,False,True,False,False,True,False,False,False,False,False,False,False,False,73000000,False,11,False,"Пластиковые окна, комнаты изолированы.
Новая квартира в чистовой отделке, готовая для проживания, в новом доме, в центре города, удобное месторасположение."
https://krisha.kz//a/show/679112711,1,6,10,Кенесары хана,54/19к1,59.1,nan,Каргалы,монолитный,18.0,25.4,хорошее,2010,Хан Тенгри,Алматы,Наурызбайский,нет,оптика,лоджия,True,металлическая,совмещенный,рядом охраняемая стоянка,полностью,паркет,False,2.8,False,False,True,False,False,True,False,False,False,True,False,True,False,True,True,False,False,False,False,False,False,40000000,False,11,False,"Пластиковые окна, улучшенная, кухня-студия, встроенная кухня.
Евроремонт, дизайнерский проект, паркет, итальянская плитка, вся сантехника немецкая GROHE, включая не только смесители и душ, но и ванну, ликовские окна «Саламандер», индукционная варочная «Кайзер», духовка также этого бренда. Обои моющиеся итальянские. Красивый вид из окон на горы."
https://krisha.kz//a/show/679112885,1,nan,nan,Северное кольцо,86/3,40.0,nan,Ожет,монолитный,16.0,nan,nan,2016,Северное кольцо,Алматы,Алатауский,nan,nan,nan,False,nan,nan,nan,nan,nan,False,2.8,False,False,False,False,False,False,False,False,True,True,True,True,True,True,True,True,True,True,True,True,True,21000000,False,6,False,"Цоколь, по середине, вид на ТРЦ ""Метро"" теплая, уютная квартира, все доки в порядке, без ипотеки и кредитования."
https://krisha.kz//a/show/678592326,2,2,9,nan,nan,70.0,Суатколь,Акбулак 31,монолитный,12.0,nan,nan,2011,nan,Алматы,Алатауский,nan,nan,nan,False,nan,раздельный,nan,nan,nan,False,nan,False,False,False,False,False,False,False,False,False,True,True,True,True,True,True,True,True,True,True,True,True,35000000,False,8,False,Все рядом. Школы садики. Реальному покупателью торг есть. Кввртира не в залоге не аресте. Все документы есть.
https://krisha.kz//a/show/679479647,1,9,16,nan,nan,74.0,Калкаман,Шугыла 1,монолитный,12.0,nan,хорошее,2012,Премьера,Алматы,Наурызбайский,nan,nan,лоджия,True,металлическая,совмещенный,рядом охраняемая стоянка,nan,ламинат,False,2.8,False,False,True,False,False,True,False,False,True,True,False,True,True,True,False,False,True,True,False,False,False,27999999,False,9,False,"Пластиковые окна, улучшенная, комнаты изолированы, кухня-студия, кладовка, счётчики.
Продаю квартиру в микрорайоне Шугыла, жк премьера, однокомнатная переделанная в двухкомнатную, большая квадратура, зал двадцать две, кухня двенадцать, спальня двадцать, санузел совмещённый около десяти квадратов, ремонт свежий, остаётся только кондер, остальную мебель забираю или продаю, кухня без техники четыреста тыс, дерево, гардероб триста пятьдесят тыс, спальный гарнитур шестьсот пятьдесят тыс, диваны и кресла полтора миллиона, зеркало с консолью двести тыс, торг не большой, цена до конца месяца"
https://krisha.kz//a/show/677063098,3,5,5,nan,nan,80.0,nan,Кулагер 67,кирпичный,14.0,52.1,хорошее,2006,nan,Алматы,Жетысуский,есть возможность подключения,ADSL,балкон,True,металлическая,раздельный,рядом охраняемая стоянка,частично,ламинат,False,2.8,False,False,True,False,False,False,False,False,True,True,True,True,True,False,True,False,False,False,True,True,False,39500000,False,11,False,"Пластиковые окна, неугловая, улучшенная, комнаты изолированы, встроенная кухня, тихий двор, кондиционер."
https://krisha.kz//a/show/675107713,3,2,3,Жулдыз,1940,98.0,nan,nan,монолитный,nan,nan,черновая отделка,2022,Famous Town,Алматы,Бостандыкский,nan,nan,лоджия,True,металлическая,2 с/у и более,паркинг,nan,nan,False,3.3,False,True,False,False,False,True,False,False,False,True,True,True,True,False,False,False,False,False,True,False,False,60000000,False,0,False,"Пластиковые окна, неугловая, улучшенная, комнаты изолированы, тихий двор.
ЖК расположен в экологически чистом районе, предгорье Алматы, выше пр. Аль- Фараби (6мин), высокая сейсмоустойчивость, низкая плотнотность населения, всего 9 домов по 18 кв. Рядом школа 500м., детский сад 500м., магазин, супермаркет. На территории ЖК аптека, фитнесс клуб, кафе, спортивная и детская площадка. Территория - сквер и сад, подземная и гостевая парковка. Шикарный вид на горы, (2 окна и лоджия выходит на юг). Отличная возможность купить квартиру в рассрочку !___ 
первоначальный взнос _____43 712 000___ тенге, а остальная сумма 16 288 000 тенге в рассрочку на 3.5года по 392 000 тенге._____ 
сдача дома в декабрь 2022год."
https://krisha.kz//a/show/677144455,2,20,20,Гагарина,310,65.0,Аль,nan,монолитный,20.15,nan,черновая отделка,2023,Комфорт Сити,Алматы,Бостандыкский,nan,nan,nan,False,nan,nan,паркинг,nan,nan,False,3.0,False,False,False,False,False,False,False,False,True,True,True,True,True,True,True,True,True,True,True,True,True,43000000,False,4,False,"Новая квартира в строящемся доме, 4 блок, сдача 2 квартал 2023. Шикарный перспективный район, свежий воздух, отличный вид на горы, верхняя часть города. Рядом есть Мега центр, Магнум, 2 школы, магазины, кафе. Развитая инфраструктура. дом находится на пересечении Аль-Фараби/Гагарина за Land Rover центром, рядом есть также Hyundai Premium Almaty. Так же рассматриваю обмен на авто с вашей доплатой."
https://krisha.kz//a/show/678760997,2,7,8,Бокейханова,510Б,56.6,nan,nan,монолитный,12.0,nan,хорошее,2021,Dragon City,Алматы,Жетысуский,нет,ADSL,nan,False,металлическая,совмещенный,паркинг,nan,ламинат,False,2.8,False,False,False,False,False,False,False,False,False,True,True,True,True,True,True,True,True,True,True,True,True,32500000,True,15,False,"Продам 2-х комнатную квартиру с евроремонтом, есть все для комфортного проживания."
https://krisha.kz//a/show/679479480,2,5,10,Айтиева,46,62.0,Казыбек би,nan,монолитный,10.0,nan,хорошее,2004,nan,Алматы,Алмалинский,есть возможность подключения,оптика,лоджия,True,бронированная,раздельный,рядом охраняемая стоянка,nan,паркет,False,2.8,False,False,False,False,False,False,False,False,False,True,True,True,True,True,True,True,True,True,True,True,True,51000000,False,7,False,"2-комнатная квартира, свежий косметический ремонт, в качественном доме (застройщик Астана Строй Инвест, первый дом в проекте, самый качественный), расположенный во дворах, где всегда тихо и спокойно, на среднем этаже 5 из 10. На этаже расположены 3 квартиры. 
 
Имеется: 
1) просторный зал (22.2 кв. м. ) и спальня (15.2 кв. м. ) ; 
2) 1 лоджия со встроенным шкафом, выходит с кухни; 
3) раздельный санузел; 
4) раздельная кухня, НЕ студия; 
5) встроенный кухонный гарнитур немецкой фирмы Westfalia; 
6) 2 кондиционера: в гостиной и спальне; 
7) полностью меблирована. 
 
Рядом с домом находится облагороженный красивый сквер (парк), где можно с удовольствием гулять с детьми (окна гостиной открываются в сторону сквера). 
Развитая инфраструктура, поблизости расположены ясли-сады, школы, супермаркет Small, университеты и многое другое. 
Продаём в связи с расширением. Квартира будет освобождена до конца октября. 
 
Ипотеку рассматриваем, документы в порядке."
https://krisha.kz//a/show/673202976,2,4,10,nan,nan,63.4,nan,Шугыла,монолитный,12.0,nan,хорошее,2021,nan,Алматы,Наурызбайский,есть возможность подключения,через TV кабель,лоджия,False,металлическая,совмещенный,рядом охраняемая стоянка,nan,ламинат,False,2.8,False,True,True,False,True,True,True,False,False,True,True,False,False,False,True,True,False,False,True,False,False,35000000,False,11,False,"Пластиковые окна, неугловая, встроенная кухня, новая сантехника, тихий двор.
Апорт малл, Алтын орда, Садик, Школа, Магнум есть"
https://krisha.kz//a/show/679479415,2,1,17,Розыбакиева,20/1,48.0,nan,nan,монолитный,nan,nan,черновая отделка,2022,Heaven,Алматы,Бостандыкский,nan,nan,балкон,False,металлическая,nan,паркинг,nan,nan,False,3.0,False,True,True,False,False,True,False,False,False,True,True,True,True,True,True,True,True,True,True,True,True,35000000,False,7,False,"ЖК Heaven расположен в центре города. Недалеко от Меги. В шаговой доступности школы, садики, парки, футбольный клуб Кайрат и т.д."
https://krisha.kz//a/show/675629093,2,1,5,Халиуллина,nan,54.0,nan,nan,монолитный,nan,nan,nan,2022,Medeu City,Алматы,Медеуский,nan,проводной,nan,False,металлическая,совмещенный,паркинг,nan,nan,False,2.8,False,False,False,False,False,False,False,False,False,True,True,True,False,True,False,False,False,True,True,False,False,24248000,False,2,False,"Пластиковые окна, тихий двор, неугловая, улучшенная, кухня-студия, счётчики.
Переуступаю квартиру в ЖК Medeu City первоначальный 7400000займ от банка 16848000дом сдан в эксплуатацию документы на руках, можете оформить ипотеку 7/20/25 . Квартира улучшенная черновая отделка (стяжка пола, ровные стены, электричество проведено до щетка, мокрые точки выведены, окно радиаторы, входная дверь) в свободной планировке. отличный развивающийся район, все необходимое в шаговой доступности. Удобный выезд на улицу Халлиулина а, также Кульджинский тракт, Всего 10мин до центра Города."
https://krisha.kz//a/show/678089286,2,4,9,ул Райымбек Батыра,291,69.1,nan,nan,монолитный,nan,nan,свободная планировка,2022,nan,Алматы,Медеуский,nan,nan,nan,False,nan,nan,nan,nan,nan,False,2.9,False,False,False,False,False,False,False,False,False,True,True,True,True,True,True,True,True,True,True,True,True,35000000,False,10,False,Продам квартиру в черновой отделке квартира совсем новая
https://krisha.kz//a/show/677981922,3,7,12,Тажибаевой,157,77.0,nan,nan,монолитный,12.0,nan,nan,2019,ELEMENT,Алматы,Бостандыкский,nan,оптика,лоджия,True,металлическая,2 с/у и более,паркинг,nan,ламинат,False,3.0,True,False,True,True,True,True,True,False,False,True,True,True,True,True,True,True,True,True,True,True,True,82000000,False,8,False,"Квартира с евроремонтом, в отличном состоянии"
https://krisha.kz//a/show/676457647,1,3,8,nan,nan,42.0,nan,Жулдыз-2,монолитный,9.0,nan,хорошее,2008,nan,Алматы,Турксибский,отдельный,ADSL,балкон,False,металлическая,раздельный,рядом охраняемая стоянка,nan,ламинат,False,2.8,False,False,True,False,False,False,False,False,True,True,True,False,False,False,True,True,False,True,True,False,False,23500000,False,5,False,"Пластиковые окна, неугловая, встроенная кухня, новая сантехника, счётчики, тихий двор.
Однокомнатную квартиру, в спальном районе, с хорошим ремонтом. 
зимой тепло, летом прохладно. 
Низкий уровень шума и достаточная освещенность! 
Так же во дворе новые и очень много разных детских площадок, тренажерная, футбольное поле. 
Рядом школа, поликлиника, магнум, садик и новый спорт комплекс. 
Проходит по ипотеке. Все остальные вопросы по телефону. Реалторам не беспокоит."
https://krisha.kz//a/show/675119728,1,7,9,Казыбек би,125,20.0,Досмухамедова,nan,монолитный,nan,nan,хорошее,2014,Мечта на Казыбек би,Алматы,Алмалинский,nan,проводной,nan,False,металлическая,совмещенный,паркинг,nan,ламинат,False,nan,False,True,True,False,False,True,False,False,False,True,True,False,False,True,False,True,False,True,True,False,False,18500000,False,7,False,"Тихий двор, неугловая, кухня-студия, пластиковые окна, новая сантехника, счётчики.
В центре городе в пеши доступности Университет Ату глазной институт"
https://krisha.kz//a/show/672969934,3,5,12,Сатпаева,90,85.0,Туркебаева,nan,монолитный,11.7,nan,черновая отделка,2022,Акварель,Алматы,Бостандыкский,есть возможность подключения,ADSL,лоджия,True,металлическая,2 с/у и более,паркинг,nan,nan,False,nan,False,True,True,True,False,True,True,True,False,True,True,True,True,False,False,False,False,True,True,False,False,55000000,False,10,False,"Неугловая, улучшенная, тихий двор, счётчики, пластиковые окна, комнаты изолированы.
Продаётся квартира в новом жилом комплексе ! 
Лучший блок в Жк 
Средний этаж 
Вид на юг/север в блоке расположен дет садик 
ключи и документы на руках. 
 
 звоните и пишите, иногда сеть не ловит."
