uri,room_count,floor,max_floor,street,house_number,general_area,intersection,microdistrict,building_type,kitchen_area,living_area,condition,build_year,residential_complex,city,district,telephone,internet,balcony,is_balcony_glazed,door,bathroom,parking,furniture,floor_type,former_hostel,ceiling_height,bars_on_the_window,security,entry_phone,code_lock,alarm,video_security,video_entry_phone,concierge,exchange_possible,plastic_windows,non_angular,improved,rooms_isolated,studio_kitchen,kitchen_builtin,new_plumbing,pantry,counters,quiet_courtyard,air_conditioning,commercial_convenient,price,mortgaged,images_count,private_hostel,text
https://krisha.kz//a/show/678899865,2,6,9,nan,nan,49.0,nan,Алтай-1,панельный,6.0,nan,среднее,1988,nan,Алматы,Турксибский,отдельный,ADSL,балкон,False,деревянная,раздельный,рядом охраняемая стоянка,nan,ламинат,False,nan,False,False,False,False,False,False,False,False,False,True,True,True,True,True,True,True,True,True,True,True,True,25000000,False,15,False,"Продам квартиру в микрорайоне Алтай 1 ( Турксибского района). Продаём в связи с переездом в частный дом. Очень удобно для проживания т. к доступ есть ко всему, что нужно для комфортной жизни (абсолютно вся инфраструктура вокруг дома). Не новостройка, качество жизни проверено временем ! Квартира не угловая, не первый и не последний этаж, есть длинный балкон 9метров (не застеклен), санузел и ванная комната раздельно, комнаты не проходные ! Подходит под ипотеку, документы все в порядке ! В квартире остаётся холодильник, телевизор, плита, сантехника нормальньная. Посмотреть можно в любое время, заранее напишите пожалуйста в п и договоримся о просмотре ! 
 
Риэлторов прошу не беспокоить!"
https://krisha.kz//a/show/672652170,3,3,3,Натарова,nan,153.0,nan,nan,кирпичный,30.0,nan,хорошее,2019,nan,Алматы,Жетысуский,nan,nan,nan,False,nan,nan,nan,nan,nan,False,nan,False,False,False,False,False,False,False,False,False,True,True,True,True,True,True,True,True,True,True,True,True,55000000,False,9,False,"ПЕНТХАУС новая 3х комнатная квартира в малоэтажном доме. Дом сдан в экспуатацию в 2019 году. Прекрасный вид на горы. от центра 10 мин, без пробок! Ипотека. Идеально под сдачу в аренду, офис, вывод из жилого фонда. 100 квт. Тихий район. Метро на Саяхате 15 мин."
https://krisha.kz//a/show/679507126,2,14,16,Сатпаева,90/43а,79.0,nan,nan,монолитный,14.0,nan,хорошее,2020,Riviera,Алматы,Бостандыкский,nan,оптика,лоджия,False,nan,2 с/у и более,паркинг,полностью,nan,False,2.75,False,False,False,False,False,True,True,True,False,True,True,True,True,True,True,True,True,True,True,True,True,78500000,False,19,False,"Эксклюзивная, элитная квартира, построенная по дизайн-проекту в стиле эко-минимализм. 
 
Полностью меблированная, продается со всей мебелью и новой, дорогой бытовой техникой. В квартире сделан очень дорогой ремонт, не экономили, всё делали для себя. 
 
Распашонка, на высоком этаже с шикарным видом на горы и город, окна выходят на две стороны - на речку\горы и во двор. 
 
Камин, 2 шикарных с\у, теплые полы, 2 рабочих кабинета, кофе-уголок, вместительная отдельная гардеробная, много встроенной мебели — все делалось на заказ, шумоизоляция стен от соседей, полностью заменена вся проводка (Schneider Electric). 
 
Квартира находится в доме на речке вдали от шума дорог и пыли, с прекрасным видом на горы и город, в 7 минутах ходьбы станция метро, рядом 2 ТРЦ с супермаркетами, парковками, аптеками, фитнесцентром, автомойками, маленькими магазинами у дома, теренкуром и другими удобствами, рядом - школы, сады, поликлиники, оз. Сайран, McDonald’s, KFC, др. заведения общепита, выход прям на речку для прогулок. 
 
Двор без машин, территория ЖК огорожена, очень хорошо озеленена, за ней хорошо ухаживают и следят, установлено видеонаблюдение, с круглосуточным дежурством оператора и охраной. На территории много детских и спортивных площадок, сам ЖК класса «комфорт плюс» близко к бизнес классу — красивые интерьеры, с богатой отделкой подъездов, 2 скоростных грузовых лифта\подъезд, всё для максимального комфорта и проживания. 
Квартира мечты. 
 
Цена окончательная - ниже рыночной за такую квартиру. Квартира от хозяина."
https://krisha.kz//a/show/674705786,1,9,10,nan,nan,41.2,nan,Аксай-5 25,монолитный,6.0,26.7,хорошее,2018,Уш Сункар,Алматы,Ауэзовский,есть возможность подключения,проводной,балкон,True,металлическая,совмещенный,паркинг,полностью,ламинат,False,2.75,False,True,True,False,False,True,False,False,False,True,False,False,True,True,True,True,False,False,False,False,False,33000000,False,13,False,"Пластиковые окна, комнаты изолированы, кухня-студия, встроенная кухня, новая сантехника.
Продаётся 2-х комнатная квартира в ЖК ""Уш-Сункар"". Рядом очень развитая инфраструктура Magnum Express, рынок ""Арыстан"" итд. Внутри ЖК есть частный детский садик ""Нур-саби"" и частная школа ""ABC"" очень удобно семьям с детьми. Видео-наблюдения, что обеспечивает безопасность, магазины, кафе, салон красоты и фитнес залы. Касательно мебели вся мебель остаётся вплоть до ковров. Если вас заинтересует наша квартира можете приехать посмотреть до 20:00 вечера. обмен не предлагать. Ипотеку проходит! торг не большой!"
https://krisha.kz//a/show/679446397,2,16,16,Джандосова,140/2,71.0,Джандосова напротив Нархоза,nan,монолитный,19.0,nan,хорошее,2014,nan,Алматы,Ауэзовский,есть возможность подключения,оптика,несколько балконов или лоджий,True,металлическая,раздельный,рядом охраняемая стоянка,nan,ламинат,False,2.6,False,False,True,False,False,False,False,False,False,True,False,False,True,True,False,True,False,False,False,True,False,47000000,True,14,False,"Кондиционер, пластиковые окна, комнаты изолированы, кухня-студия, новая сантехника.
Кухня-студия. Новая мебель + электр. техника. Свежий ремонт. Новые двери. Два кондиционера. Два балкона: один - застеклен."
https://krisha.kz//a/show/675453091,3,1,3,nan,nan,151.0,nan,Мирас 55,монолитный,nan,nan,nan,2021,Hyde Park,Алматы,Бостандыкский,nan,nan,nan,False,nan,nan,nan,nan,nan,False,3.2,False,False,False,False,False,False,False,False,False,True,True,True,True,True,True,True,True,True,True,True,True,250000000,False,8,False,None
https://krisha.kz//a/show/679229389,2,9,10,Кенесары хана,54/29,48.0,nan,nan,монолитный,nan,nan,хорошее,2013,Хан Тенгри,Алматы,Наурызбайский,nan,nan,nan,False,nan,nan,паркинг,nan,nan,False,3.0,False,False,False,False,False,False,False,False,False,True,True,True,True,True,True,True,True,True,True,True,True,33000000,False,6,False,"Продаётся квартира в ЖК Хан-Тенгри, уютная, светлая, рядом школы, Магнум, очень удобно для семейных пар с детьми, тихий район, чистый воздух. Если утеплить балкон, то можно сделать ещё одну комнату и получится трехкомнатная квартира."
https://krisha.kz//a/show/675027799,4,6,8,nan,nan,100.0,Шаляпина между Саина и Момышулы,Мамыр-3,монолитный,14.0,nan,хорошее,2001,nan,Алматы,Ауэзовский,nan,ADSL,несколько балконов или лоджий,True,бронированная,2 с/у и более,гараж,nan,паркет,False,2.7,False,False,True,True,False,True,False,False,False,False,False,True,True,True,True,False,True,False,True,False,False,72000000,False,9,False,"Тихий двор, улучшенная, комнаты изолированы, кухня-студия, встроенная кухня, кладовка.
ЗвонИТЕ. 
Телефон 
СРОЧНО Продаётся квартира 4-х ком. в престижном спальном районе есть торг. Полностью мебелирована дорогой турецкой классической мебелью. Имеется два зала и два спальных комнат. Имеется место на крытом гараже на два авто. Дружные соседи. Рядом лицей N173 и гимназия N202, два государственных и множество частных детских садов. Образовательные центры, супермаркеты, метро, несколько банков и т.д. Транспорты на все стороны города. Двор безопасен для детей, огорожен, отремонтирован, благоустроен, в заднем дворе большой сад."
https://krisha.kz//a/show/679575768,2,3,5,Курмангазы,157,52.0,nan,nan,кирпичный,9.0,nan,nan,1982,nan,Алматы,Алмалинский,nan,оптика,nan,False,металлическая,раздельный,nan,nan,паркет,False,2.8,False,False,False,False,False,False,False,False,False,True,True,True,True,True,True,True,True,True,True,True,True,43000000,False,6,False,"Продаётся 2-з комнатная квартира в развитом районе. Рядом станция метро, 135 гимназия, 134 лицей, госсадики, трц глобус. Тихий двор и приятное соседство. Дом тёплый, с приятной аурой, кирпичный."
https://krisha.kz//a/show/678926843,3,6,10,Кенесары хана,54/37,90.0,nan,nan,монолитный,nan,nan,nan,2013,Хан Тенгри,Алматы,Наурызбайский,nan,ADSL,лоджия,True,nan,раздельный,паркинг,nan,ламинат,False,2.9,False,False,False,False,False,False,False,False,False,True,True,True,True,True,True,True,True,True,True,True,True,60000000,False,35,False,"Просторная квартира 90м2 с дизайном и отличной планировкой. Без мебели. Три утепленных и присоединенных лоджии. Качественный ремонт с применением только европейских материалов отделки. Изолированные комнаты. Два раздельных сан узла. Комфортный зеленый двор с видом на горы. большая и безопасная детская площадка. На территории жилого комплекса множество магазинов, аптек, кофейни, спортивных площадок, тренажерных залов, детских садов, новая частная школа «Zaman», поликлиника, химчистка, рестораны, кафе и многое другое. Дополнительно имеется подвальное помещение в доме на 8м2. 
 
Батареи – Zehnder 
Полы – Tarkett 
Сан узлы – Grohe 
Освещение - Eglo Leuchten 
Двери – Profil Doors 
Входная дверь – Gardian 
Керамогранит - Kerama marazzi 
Окна – Funke 
Электрика - Schneider Electric 
Покраска стен - Caparol"
https://krisha.kz//a/show/679351996,3,1,3,Акан Сери,nan,70.0,Акан Сери Спартака,nan,кирпичный,25.0,nan,хорошее,1979,nan,Алматы,Турксибский,есть возможность подключения,проводной,nan,False,металлическая,совмещенный,рядом охраняемая стоянка,nan,ламинат,False,2.8,True,False,True,False,False,False,False,False,False,True,False,True,False,True,True,True,True,True,True,False,True,59500000,False,24,False,"Пластиковые окна, тихий двор, кухня-студия, счётчики, кладовка, встроенная кухня, удобно под коммерцию, новая сантехника, улучшенная.
Продам трех комнатную квартиру улучшенную квартиру кухня встроенная вся бытовая техника остается микровалновка, посудомойка, газовая плита, духовка, вытежка все новая есть гарантия. Сантехника, электрика новая. Вход квартиру отдельно удобно под код комерцию. Практически все рядом:цон, школы59, 83, 61, детсады, рынки, магазины, торгово-равлекательные центры Март, Жибек Жолы, стадионы, банки, аэропорт, полеклиника номер9, 13, ЖД вокзал, общественный транспорт в любую точку города."
https://krisha.kz//a/show/677582301,3,3,12,nan,nan,70.0,nan,Акбулак 21,монолитный,13.0,68.0,хорошее,2018,Alatau City 2.0,Алматы,Алатауский,есть возможность подключения,через TV кабель,лоджия,True,металлическая,раздельный,паркинг,полностью,ламинат,False,2.7,True,False,True,False,False,True,False,False,True,True,False,True,True,False,True,True,False,True,True,False,False,40000000,False,9,False,"Пластиковые окна, тихий двор, улучшенная, комнаты изолированы, встроенная кухня, новая сантехника, счётчики.
Жк Алатау сити находится напротив Алматы Арена. Квартира уютная и светлая, в отличном состоянии. документы в порядке. Мы первые хозяева. с новым мебелем. Натяжной потолок. Зимой Квартира очень тёплая, квартира находится не у дороги, в доме два лифта, чистый и спокойный двор, рядом с домом находятся детские сады, школы, больница, магнум, цон, мечеть, Салоны красоты, стоматология аптеки. есть все для комфортного проживания. Разумный торг. Приходите посмотреть, звоните, пишите. обмен на 1 комнатной квартиру с доплатой"
https://krisha.kz//a/show/679189696,2,2,10,Алатау,18,52.0,nan,nan,nan,nan,nan,черновая отделка,2022,nan,Алматы,Наурызбайский,nan,nan,nan,False,nan,совмещенный,nan,nan,nan,False,2.7,False,False,True,False,False,False,False,False,False,True,True,True,False,False,False,False,False,False,True,False,False,20500000,False,3,False,"Пластиковые окна, тихий двор, неугловая, улучшенная.
Я хозяин. Алма сити 5/2, по переуступке 
С балконом 54 м2 
ключи на руках, тех паспорт и дкп будет в октябре 
 
Идеальный этаж, Окна смотрят во двор на детскую площадку 
 
Ипотеку рассматриваем, нужен дополнительный залог (другая квартира) 7-20-25 не проходит 
 
Черновая стяжка и штукатурка есть 
Можно заезжать делать ремонт, коммуникации проведены"
https://krisha.kz//a/show/678571629,3,5,5,nan,nan,83.0,Сатпаева,Самал-1 89,кирпичный,12.0,nan,хорошее,1981,nan,Алматы,Медеуский,отдельный,оптика,nan,True,бронированная,раздельный,nan,nan,паркет,False,2.8,False,False,False,False,False,False,False,False,False,True,True,True,True,True,True,True,True,True,True,True,True,73000000,False,7,False,"Отличная квартира с удобным расположением, уютная и с хорошей аурой. В квартире очень много дерева: паркетный пол, деревянные двойные окна, что создает комфорт при проживании. 
Толстые кирпичные стены сохраняют тепло в доме, а также акустический комфорт, соседней нисколечко не слышно. 
Все в шаговой доступности: Достык Плаза, Кок-Тобе, Дворец Республики, площадь Республики, через дорогу от дома Дворец школьников где есть все для развития детей: шахматы, музыка, спорт кружки, бассейн. Рядом теннисный корт ЦСКА. 
Квартира сухая, крыша не протекает, есть над квартирой еще технический этаж. 
Во дворе всегда есть место для парковки, так как территория закрыта на шлагбаум"
https://krisha.kz//a/show/679081398,2,5,5,Жарокова,171А,52.0,Жандосова,nan,кирпичный,nan,nan,хорошее,1985,nan,Алматы,Бостандыкский,nan,оптика,лоджия,False,nan,раздельный,nan,nan,ламинат,False,2.8,False,False,False,False,False,False,False,False,False,True,True,True,True,True,True,True,True,True,True,True,True,38900000,False,8,False,"Продам уютную квартиру с удобным расположением. Бытовая техника и вся мебель остаётся покупателю. Рядом есть супермаРКет Тоймарт, ТЦ Дархан, школа, дет. сад, аптека, салон красоты, почта. ТОРГ."
https://krisha.kz//a/show/677994235,5,2,3,nan,nan,275.0,nan,Мирас,кирпичный,nan,nan,nan,2009,Солнечная Долина,Алматы,Бостандыкский,nan,nan,nan,False,nan,2 с/у и более,паркинг,nan,паркет,False,2.7,True,False,False,False,True,False,False,False,False,True,True,True,True,True,True,True,True,True,True,True,True,179000000,False,5,False,"Современный таунхаус, 3 уровня, в экологически чистом районе города, в КГ Солнечная Долина. 
1 этаж: холл, гардеробная, кухня, просторная гостиная с камином и выходом на террасу с внутренним уютным двориком, санузел с душевой, кладовка. 
2 этаж: 2 просторные спальни, 2 санузла с душевой и ванной. Пространство можно переоборудовать и сделать 4 комнаты. 
Цокольный этаж: кабинет, спортивная зона, мастерская, прачечная. 
Перед домом – крытая парковка на 2 авто с автоматическим открыванием ворот. Электричество 3 фазы. Низкие коммунальные расходы. 
Удобное расположение, чистый воздух, комфортное проживание в доме с развитой инфраструктурой ЖК Солнечная Долина. Рядом детские сады, медицинские центры, школы, парки. Тихий и безопасный район. 
Быстрый выезд на транспортные магистрали города."
https://krisha.kz//a/show/679477856,1,6,9,nan,nan,39.5,nan,Зердели,монолитный,13.0,nan,хорошее,2014,nan,Алматы,Алатауский,nan,nan,nan,False,nan,nan,nan,nan,nan,False,2.8,False,False,False,False,False,False,False,False,False,True,True,True,True,True,True,True,True,True,True,True,True,21000000,False,5,False,"Продается квартира, светлая, теплая, не угловая, рядом школа, детский сад, поликлиника, тихий двор. Торг уместен"
https://krisha.kz//a/show/679446203,2,2,2,Суюнбая,292-ж,40.0,nan,13-й военный городок,кирпичный,7.4,nan,хорошее,1970,nan,Алматы,Турксибский,отдельный,проводной,nan,False,nan,nan,гараж,nan,линолеум,False,nan,False,False,True,False,False,False,False,False,False,True,True,True,True,True,True,True,True,True,True,True,True,21000000,False,28,False,"Продается 2-х комнатная квартира 2/2 . 40.0м2 от прямого хозяина в тихом безопасном районе (бывший военный городок). Есть капитальный гараж с погребом. Под окнами палисадник 10*10м. 
Дом кирпичный, теплый. комнаты изолированы. Квартира частично меблирована (2-х камерный холодильник Beko, стиральная машина автомат zanussi 1000, кухонный гарнитур, две тахты с выдвижными ящиками, небольшой платяной шкаф). Радиаторы отопления биметаллические, окна пластиковые. 
 
В районе имеется вся базовая инфраструктура. 
 
Три маршрута муниципального транспорта. По маршрутам торговые центры, парки, рынки, и пр. инфраструктура. 
Ближайшая станция метро пр. Раимбека (20 минут на машине) ."
