uri,room_count,floor,max_floor,street,house_number,general_area,intersection,microdistrict,building_type,kitchen_area,living_area,condition,build_year,residential_complex,city,district,telephone,internet,balcony,is_balcony_glazed,door,bathroom,parking,furniture,floor_type,former_hostel,ceiling_height,bars_on_the_window,security,entry_phone,code_lock,alarm,video_security,video_entry_phone,concierge,exchange_possible,plastic_windows,non_angular,improved,rooms_isolated,studio_kitchen,kitchen_builtin,new_plumbing,pantry,counters,quiet_courtyard,air_conditioning,commercial_convenient,price,mortgaged,images_count,private_hostel,text
https://krisha.kz//a/show/673323275,3,2,4,nan,nan,58.1,Жандосова,Мамыр,кирпичный,5.8,39.0,хорошее,1974,nan,Алматы,Ауэзовский,отдельный,оптика,балкон,False,металлическая,совмещенный,nan,полностью,ламинат,False,2.65,False,False,True,False,False,True,False,False,False,True,False,False,False,False,False,True,False,True,True,False,False,37000000,False,20,False,"Пластиковые окна, новая сантехника, счётчики, тихий двор.
Пластиковые окна и двухсвортчатая распашная дверь фирмы «Лик» на большой балкон 5, 7 метров, пол: деревянный перестелен, ламинат в комнатах, линолеум в коридоре и кухне, новые межкомнатные двери из настоящего дерева с богатым шпоном. Счётчики, батареи и трубы системы отопления заменены во всей квартире 2021г. (а также в квартирах выше и ниже этажом). домофон, телефон: отдельный, интернет проводной + Wi-Fi. В квартире не курили, кошек собак не держали. Соседи культурные и вежливые люди. В 5-ти минутах от дома школа №158, во дворе детская площадка. Садики, супермаркет, базар, автобусные остановки все рядом. 
Оставим по договоренности мебель. торг на месте!"
https://krisha.kz//a/show/679301652,1,2,4,nan,nan,12.0,Дала,Шугыла 76,монолитный,12.0,nan,nan,2017,nan,Алматы,Наурызбайский,nan,nan,nan,False,nan,nan,nan,nan,nan,False,nan,False,False,False,False,False,False,False,False,False,True,True,True,True,True,True,True,True,True,True,True,True,9000000,False,3,False,Состаение отлично 12кв ремонт есть санузел в нутри
https://krisha.kz//a/show/679109165,2,1,3,Оспанова,54,57.4,nan,nan,монолитный,nan,nan,nan,2022,Damac House,Алматы,Медеуский,nan,nan,nan,False,nan,nan,nan,nan,nan,False,nan,False,False,False,False,False,False,False,False,False,True,True,True,True,True,True,True,True,True,True,True,True,45000000,False,3,False,Клубный дом! Черновая отделка! Документы на руках! Введён в эксплуатацию!
https://krisha.kz//a/show/678924802,1,2,3,Мкр,nan,22.0,nan,nan,монолитный,nan,18.0,хорошее,2021,ZHARKYN,Алматы,Жетысуский,нет,проводной,балкон,False,металлическая,совмещенный,паркинг,полностью,линолеум,False,2.8,False,False,True,False,False,True,False,True,False,True,True,True,True,True,True,True,True,True,True,True,True,18000000,True,9,False,"Здравствуйте, комната Студия, отд кухни нет, сан узел совмещённый (душевая кабина). балкон выходит во двор, Шкафы, холодильник, стиральную машину авт, tv, диван, стол и стулья могу оставить. Всё новое, в использовании пол года. Дом 2021 года постройки. новый, чистый дом. Спокойный, тихий район-не на проезжей улице. Рядом #87 СШ. Можете оформить через отбасы Банк в ипотеку или любой др банк. Можете на себя переоформить займ, осталось выплатить 2, 2 млн. ежемесячно по 40 тыс тг будет. 
- 
Жилой комплекс Zharkyn – малоэтажная новостройка с квартирами эконом-класса и благоустроенной территорией, распложенная вблизи Северного кольца в районе с развитой торговой инфраструктурой. 
 
Расположение 
ЖК Zharkyn в Алматы находится в микрорайоне Кокмайса, 57б в 130 метрах от берега реки Есентай. Это озелененная часть города, в которой преобладает застройка малой и средней этажности. Стоит учитывать, что на расстоянии нескольких сотен метров от жилого комплекса расположены промышленные предприятия, а до ближайшей загруженной автомагистрали не менее 600 метров."
https://krisha.kz//a/show/678100056,3,nan,nan,nan,nan,112.0,nan,Тау Самал,монолитный,nan,nan,черновая отделка,2022,nan,Алматы,Медеуский,nan,nan,лоджия,False,бронированная,2 с/у и более,паркинг,nan,nan,False,3.1,False,True,False,False,False,True,True,False,False,True,False,False,False,False,False,False,False,False,False,False,False,61600000,False,3,False,"Пластиковые окна.
Таунхаусы L’HOME TOWN. 
 
Скидка до 10% 
Рассмотрим рассрочку без %. 
 
г. Алматы, Медеуский район, улица Оспанова 83/22 
с прекрасным чистым воздухом и шикарным видом на Коктобе, горы и на город! 
Количество Таунхаусов ограничено! 
На территории 8 Таунхауса с площадью от 112м2 до 131.1м2, своя паРКовка на 8 автомашин, зона для барбекью на 20-30 человек, и детская игровая площадка. Так же, имеется гостевая паРКовка на 10 автомашин. 
 Площадь участка 22 соток. 
Цена за квадратный метр 650.000тг. 
 
сдача в черновом в свободной планировке ноябрь-декабрь 2022года."
https://krisha.kz//a/show/679111280,1,8,9,nan,nan,25.0,nan,Атырау 158,монолитный,nan,nan,среднее,2020,Vostochka.kz,Алматы,Медеуский,nan,nan,балкон,True,металлическая,совмещенный,nan,nan,nan,False,2.7,False,False,False,False,False,False,False,False,False,True,True,True,True,True,True,True,True,True,True,True,True,18500000,False,4,False,Срочно торг!
https://krisha.kz//a/show/678591142,1,14,16,Жуалы,21,45.0,Сабденова,Шугыла,монолитный,12.0,nan,среднее,2012,Премьера,Алматы,Наурызбайский,nan,ADSL,лоджия,True,металлическая,совмещенный,паркинг,nan,линолеум,False,2.8,True,False,True,False,False,True,False,False,False,True,True,True,True,False,False,False,False,True,True,False,False,23900000,False,7,False,"Пластиковые окна, неугловая, улучшенная, комнаты изолированы, счётчики, тихий двор.
Продаётся квартира в монолитном доме. В отопительный сезон редко включаем отопление, так как квартира не угловая в квартире всегда тепло. Стены толстые (22см) слышимость низкая. Пару месяцев назад был сделан косметический ремонт, просторная кухня, солнечная сторона, просторная лоджия. На территории ЖК расположены аптеки, салоны красоты, автомойка, ателье, спортивный зал, бани, детские сады, кафе и т.д. В шаговой доступности русская и казахская школы, поликлиника, автобусные развязки во все направления. квартира не залоговая, документы на руках, готова к ипотеке. Из мебели оставляем кухоный гарнитур, большой шкаф-купе."
https://krisha.kz//a/show/678932465,2,8,13,Журавлева,26,47.2,Тажибаевой,Орбита-1,монолитный,nan,nan,черновая отделка,2022,Four Seasons,Алматы,Бостандыкский,nan,nan,nan,False,nan,nan,nan,nan,nan,False,3.0,False,False,False,False,False,False,False,False,False,True,True,True,True,True,True,True,True,True,True,True,True,38000000,False,6,False,"ЖК Four Seasons бизнес-класса, находится в перспективном и 
 динамично развивающемся районе! Квартира находится в 3 блоке 1 очереди. Свободная планировка, витражные алюминиевые окна ALPROF серии W62, электронный замок на входной двери. Две точки вывода коммуникации, что позволяет осуществить любое планировочное решение в рамках данной площади. Из окон квартиры открывается вид на юго-западную часть города и отличный вид на горы. На крыше блока располагается терраса для отдыха, встреч или ужина."
https://krisha.kz//a/show/678924371,3,3,22,Аль,nan,75.62,nan,nan,монолитный,nan,nan,nan,2022,nan,Алматы,Бостандыкский,nan,nan,nan,False,nan,2 с/у и более,nan,nan,nan,False,3.0,False,False,False,False,False,False,False,False,False,True,True,True,True,True,True,True,True,True,True,True,True,85000000,False,8,False,"ЖК Orion 2, класс жилья Премиум, срок завершения декабрь 2022"
https://krisha.kz//a/show/676736359,3,1,6,Ырысты,46/8,78.0,Рыскулова,Самгау,монолитный,nan,nan,хорошее,2022,Ырысты,Алматы,Алатауский,nan,nan,балкон,True,металлическая,раздельный,паркинг,nan,линолеум,False,2.7,False,True,True,False,False,True,False,False,False,True,True,True,True,True,True,True,True,True,True,True,True,40000000,False,16,False,"3-х ком. квартиру. мкр Самғау Жк Ырысты. Пластиковые окна, неугловая, улучшенная, новая сантехника, счётчики, тихий двор, удобно под коммерцию, комнаты изолированы. Готовая просторная квартира в чистовом варианте. Квартира уютная и чистая. Комнаты отдельные. дом газифицирован. Район перспективный. Удобная развязка. Рядом вся инфраструктура. Срочная в связи с переездом. с мебелью. Кухня в строенная, новая. Срочно"
https://krisha.kz//a/show/679300762,2,13,15,Ауэзова,nan,48.95,nan,nan,монолитный,nan,nan,хорошее,2022,Auezov City,Алматы,Алмалинский,есть возможность подключения,nan,лоджия,True,металлическая,совмещенный,паркинг,без мебели,nan,False,2.8,False,False,True,True,False,True,False,False,False,True,True,True,False,True,False,False,False,True,False,False,False,31000000,False,4,False,"Пластиковые окна, неугловая, улучшенная, кухня-студия, счётчики.
ЖК «Auezov City» BAZIS-A. Центр города, спокойный благоустроенный жилой комплекс в очень перспективном районе. Удобный как для проживания, как и для инвестиций. Евродвушка. С парковкой проблем нет. 
Великолепная транспортная развязка. Рядом - все: супермаркеты, остановки общественного транспорта, детские сады, школы, магазины, рестораны. 
Срок сдачи объекта в эксплуатацию - ноябрь 2022 года. 4-е пятно. 
Первое и второе пятно сдано в эксплуатацию. 
Гарантия о завершении строительства от государства. продается по переуступке договора долевого участия. торг."
https://krisha.kz//a/show/678478062,2,2,13,Просп,nan,44.3,nan,nan,монолитный,15.0,nan,черновая отделка,2022,RAIYMBEK,nan,nan,nan,оптика,nan,False,бронированная,совмещенный,рядом охраняемая стоянка,nan,ламинат,False,2.7,False,False,False,False,False,False,False,False,False,True,True,True,True,True,True,True,True,True,True,True,True,31000000,False,4,False,"Объявление от хозяина квартиры. 
Продаётся 2-х комнатная квартира (евродвушка) в самой лучшей планировке в новом ЖК Райымбек. Предчистовая отделка от застройщика. Отличное расположение в непосредственной близости к Золотому Квадрату. Станция метро находится прямо возле входа на территорию Жилого Комплекса. Всего в 200 метрах находится один из самых больших Магнумов города и ТЦ Мерей. 15 мин пешком до Зелёного базара и 10 мин до Арбата. документы уже на руках! 
Просторный коридор, изолированные комнаты, совмещённый санузел. Очень удобный этаж в случае поломки лифта, отсутствия электричества, пожара. 
цена окончательная. Ипотеку не рассматриваем! Риелторов прошу не беспокоить. Продаю без посредников!"
https://krisha.kz//a/show/674271566,2,1,6,Ш,nan,78.68,nan,Шугыла,монолитный,nan,nan,свободная планировка,2022,Alma City,Алматы,Наурызбайский,nan,nan,балкон,False,металлическая,nan,рядом охраняемая стоянка,nan,nan,False,2.8,False,False,False,False,False,False,False,False,False,True,True,True,False,False,False,False,False,False,True,False,False,30100000,False,4,False,"Улучшенная, неугловая, тихий двор, пластиковые окна.
Пластикалық терезелер, 4 бөлме жасауға болады саудалық үйге пайдалануға ыңғайлы"
https://krisha.kz//a/show/678489259,3,4,5,nan,nan,76.5,nan,Саялы,монолитный,nan,nan,хорошее,2017,nan,Алматы,Алатауский,есть возможность подключения,проводной,балкон,False,металлическая,раздельный,паркинг,nan,линолеум,False,2.8,False,False,True,False,False,False,True,False,False,True,True,True,True,False,True,False,True,True,True,False,False,35800000,False,17,False,"Пластиковые окна, неугловая, улучшенная, комнаты изолированы, встроенная кухня, кладовка, счётчики, тихий двор.
3 комнатная, с полностью изолированными комнатами, квартира в мкрн Саялы. 
Достаточно развитая инфраструктура (медицинские учреждение, магазины и супермаркеты, детсад. школы, кафе и рестораны) квартира не угловая, окны находятся с востока и с западных сторонах. + кладовка в подвале, вход в подьезд с двух сторон"
https://krisha.kz//a/show/679478260,1,5,10,Райымбека,nan,25.5,nan,nan,монолитный,nan,nan,хорошее,2018,Акниет,Алматы,Алатауский,nan,nan,nan,False,nan,nan,паркинг,nan,nan,False,2.8,False,False,False,False,False,False,False,False,False,True,True,True,True,True,True,True,True,True,True,True,True,16800000,False,9,False,"Продаётся квартира-студия. квартира очень тёплая, светлая, уютная. жили в нём недолго. ремонта не требует. можно заезжать и сразу жить. делали всё для себя с любовью и со вкусом. продаём в связи со срочностью. реальному покупателю будет хорошая скидка."
https://krisha.kz//a/show/678847470,2,2,3,Кажымукана,101/1,87.05,nan,nan,монолитный,17.1,nan,nan,2023,Elite Life,Алматы,Медеуский,nan,nan,nan,False,nan,nan,nan,nan,nan,False,3.15,False,False,False,False,False,False,False,False,False,True,True,True,True,True,True,True,True,True,True,True,True,105000000,False,2,False,"2-х комнатная квартира (3). Гостинная 28.75, прихожая 6, 53, гардеробная 1.08, спальня 14.75"
https://krisha.kz//a/show/674819139,2,5,9,nan,nan,62.0,Момышулы,Аксай-1А,монолитный,10.0,nan,хорошее,2008,nan,Алматы,Ауэзовский,есть возможность подключения,проводной,балкон и лоджия,True,металлическая,раздельный,рядом охраняемая стоянка,nan,ламинат,False,2.8,False,False,True,False,False,True,False,False,False,True,True,True,False,False,True,True,False,True,True,False,False,38000000,False,11,False,"Новая сантехника, пластиковые окна, неугловая, счётчики, улучшенная, встроенная кухня, тихий двор.
Продаем очень теплую и просторную квартиру. Все в шаговой в доступности: школы, детские сады, поликлиника, Small, Magnum, Карсити, Азия Парк. Транспортная развязка во все части города. Не требует никаких финансовых вложений, год назад делали ремонт, полы ламинат, установили новые двери. Окна выходят на юг и север, летом прохладно, совсем недавно обесшумили балкон. Продаем в связи с расширением."
https://krisha.kz//a/show/679300897,3,8,8,nan,nan,75.0,Макатаева,Айнабулак-2 32а,монолитный,nan,nan,хорошее,2009,nan,Алматы,Жетысуский,nan,nan,nan,False,металлическая,совмещенный,рядом охраняемая стоянка,nan,линолеум,False,2.8,False,False,False,False,False,False,False,False,False,True,True,True,True,True,True,True,True,True,True,True,True,30000000,False,11,False,"Продам Срочно 3 комнатную квартиру улучшеную в хорошем районе все в шаговом доступупности, алея, арбат, 2 школы, 3 гос садика, банки, рынок кенжехан, магнум, в квартире можно сказать жара зимой, дом манолитный, Лифт работает!Желательно наличными расчёт, ТОРГ РЕАЛЬНОМУ КЛИЕНТУ ИМЕЕТСЯ, Первые хозяева!СРОЧНО"
https://krisha.kz//a/show/677616262,3,2,5,Мкр Айнабулак,nan,60.0,nan,Айнабулак-1,панельный,6.0,nan,среднее,1980,nan,Алматы,Жетысуский,nan,ADSL,балкон,True,металлическая,раздельный,рядом охраняемая стоянка,nan,ламинат,False,2.8,False,False,True,False,False,False,False,False,False,True,True,False,False,False,False,False,False,False,True,False,False,45000000,True,5,False,"Пластиковые окна, неугловая, тихий двор.
Квартира в идеальном состоянии. не требует ремонта."
https://krisha.kz//a/show/672934549,3,1,10,Жумабаева,85,65.4,nan,Айнабулак-2,монолитный,nan,nan,свободная планировка,2020,Айнабулак,Алматы,Жетысуский,nan,через TV кабель,nan,False,металлическая,раздельный,паркинг,nan,ламинат,False,2.8,True,False,True,False,False,True,False,False,False,True,True,True,False,True,True,True,False,True,True,False,True,41500000,False,13,False,"Пластиковые окна, неугловая, кухня-студия, новая сантехника, улучшенная, встроенная кухня, счётчики, тихий двор, удобно под коммерцию.
Продаю квартиру полностью укомплектованной почти с новой мебелью (без техники), не угловая, с евроремонтом, уютная и ОЧЕНЬ ТЕПЛАЯ квартира, решётки на окнах, видеонаблюдение в подъезде. Перспективный район; школы (каз., рус. ), дет. сады (каз., рус. ), поликлиник, Магнум, ТЦ Белес, ТЦ Султан., все филиалы банка, рынок, маршрутки по всем направлениям города. Удобно под любой бизнес и жилье. 
ТОЛЬКО ЗА НАЛИЧНЫЙ РАСЧЕТ"
https://krisha.kz//a/show/676073632,1,3,5,Мкр,nan,44.1,nan,Саялы,монолитный,10.0,nan,хорошее,2017,в мкр. Саялы,Алматы,Алатауский,nan,nan,балкон,False,металлическая,совмещенный,nan,nan,nan,False,2.7,False,False,True,False,False,True,False,False,False,True,True,True,False,False,True,True,False,False,True,False,False,21500000,True,4,False,"Пластиковые окна, неугловая, улучшенная, встроенная кухня, новая сантехника, тихий двор.
Очень светлая, просторная квартира, вся мебель остаётся. Вся инфраструктура в шаговой доступности. В доме соседи доброжелательные, чистоплотные, в подъезде всегда чисто."
