uri,room_count,floor,max_floor,street,house_number,general_area,intersection,microdistrict,building_type,kitchen_area,living_area,condition,build_year,residential_complex,city,district,telephone,internet,balcony,is_balcony_glazed,door,bathroom,parking,furniture,floor_type,former_hostel,ceiling_height,bars_on_the_window,security,entry_phone,code_lock,alarm,video_security,video_entry_phone,concierge,exchange_possible,plastic_windows,non_angular,improved,rooms_isolated,studio_kitchen,kitchen_builtin,new_plumbing,pantry,counters,quiet_courtyard,air_conditioning,commercial_convenient,price,mortgaged,images_count,private_hostel,text
https://krisha.kz//a/show/671068835,3,9,16,Бальзака,8,86.0,Попова,Коктем-1,монолитный,12.0,nan,хорошее,2012,Солнечный Квартал,Алматы,Бостандыкский,нет,оптика,nan,True,металлическая,раздельный,паркинг,nan,ламинат,False,2.8,False,True,True,False,False,True,False,False,False,False,False,False,False,True,False,False,False,False,False,False,False,61000000,True,16,False,"Кухня-студия.
Вид тихий район. ! Окончательно."
https://krisha.kz//a/show/678918072,1,9,10,Жунисова,nan,31.0,nan,Шугыла,монолитный,nan,nan,черновая отделка,2022,Alma City,Алматы,Наурызбайский,nan,nan,балкон,False,металлическая,совмещенный,nan,без мебели,nan,False,nan,False,False,False,False,False,False,False,False,False,True,False,False,False,False,False,False,False,False,False,False,False,14500000,False,19,False,"Пластиковые окна.
Продам 1-комнатную квартиру-студию в ЖК Алма сити 5/2, это ниже Наурызбайского ЦОНа и Акимата, выше Леруа Мерлена на 2-3 остановки. Скоро рядом будет построена станция Метро, что увеличит стоимость квартир в данном ЖК. До ввода в эксплуатацию осталось 7-10 дней. Данный дом расположен ближе к проспекту Алатау, остановка рядом, ходят автобусы. На 55, 44 автобуе 7 минут до Абая Момышулы, там можно пересесть на метро и уехать в любую точку города за 15-20 минут. Хорошо проветриваемый район. Чистый воздух. 
Район очень перспективный. Только за наличный расчёт! Шикарное расположение. Новая школа, садик все рядом. Спешите купить по супер низкой цене в данном ЖК! торг. уместен, наличный расчет"
https://krisha.kz//a/show/670803429,3,5,5,nan,nan,74.1,nan,Саялы,монолитный,12.1,nan,хорошее,2015,nan,Алматы,Алатауский,есть возможность подключения,проводной,балкон,True,металлическая,2 с/у и более,nan,полностью,линолеум,False,2.8,False,False,True,True,False,True,False,False,False,True,True,False,True,False,False,False,False,True,True,False,False,36000000,False,17,False,"Неугловая, счётчики, тихий двор, комнаты изолированы, пластиковые окна.
Доброе время суток друзья! 
Вашему вниманию предлагается - светлая, уютная 3-х комнатная квартира в мкр. Саялы. 
Квартира не угловая, полностью мебелирована, комнаты изолированы (заезжай и живи). 
Плюс нового района в том, что она расположена выше города и хорошо проветривается, соответственно чистый воздух круглый год. 
Дополнительные плюсы: 
1) зимой квартира очень теплая; 
2) Дружелюбные соседи (тихий двор); 
3) Рядом находится СпецЦОН, школа и два гос. детских садиков (в пешей доступности), а также множество детских кружков (спортивные/творческие), частная поликлиника, аптеки и множество продуктовых магазинов. 
Остальные вопросы по телефону."
https://krisha.kz//a/show/677349869,1,10,13,Есенова,160/3,40.0,nan,nan,монолитный,nan,nan,черновая отделка,2022,Jetisu Park,Алматы,Жетысуский,nan,nan,балкон,False,металлическая,nan,паркинг,nan,nan,False,2.7,False,False,False,False,False,False,False,False,False,True,True,True,True,True,True,True,True,True,True,True,True,21900000,False,2,False,"Продам хорошую квартиру в ЖК Жетису Парк. 
сдача в эксплуатацию декабрь 2022 года. 
 
Пластиковые окна, улучшенная, комнаты изолированы, счётчики, тихий двор, новая сантехника. 
 
ЖК Jetisu Park находится в развивающемся районе в 10 минутах от центра г. Алматы 
 
Jetisu Park — это новый путь, ведущий Вас и Вашу семью к комфортной жизни. Начиная с экстерьеров домов и заканчивая объектами общего пользования - мы создаем новое пространство для гармоничной и наполненной жизни. 
Удобное расположение жилого комплекса позволяет поддерживать активный ритм жизни в мег.полисе, при этом предоставляя возможность уединения в собственном доме без лишнего шума и суеты. 
 
Проект Jetisu Park продуман до мелочей для комфортного проживания каждого члена семьи, начиная от внутренней инфраструктуры и заканчивая планировками квартир. 
Если Вы давно мечтали подарить себе или близким возможность создания комфортных условий для счастливой жизни, со всеми необходимыми в шаговой доступности, то Jetisu Park — это лучший вариант. 
Развитая инфраструктура, удобное расположение, светлые просторные квартиры с продуманными планировками — все, что Вам нужно и даже больше по привлекательной стоимости."
https://krisha.kz//a/show/675876645,1,10,10,Мкр,nan,47.88,nan,Шугыла,монолитный,nan,nan,черновая отделка,2022,Alem City,Алматы,Наурызбайский,есть возможность подключения,nan,балкон,False,металлическая,nan,паркинг,nan,nan,False,2.8,False,False,True,False,False,True,False,False,False,True,True,False,False,False,False,False,False,True,True,False,False,18000000,False,5,False,"Пластиковые окна, неугловая, счётчики, тихий двор.
Уважаемые покупатели, квартира. Не угловая, улучшенная, тихий двор. Окна выходят на горы. 
 
 по переуступке прав за наличные. 
 
Квартира в черновой отделке. дом выходит на улицу Абая. 
 
Металлические двери и 
батареи. 4-х камерные пластиковые окна и 
алюминиевые витражи, высокая теплоизоляция. 
Внутренние стены монолитной конструкции с 
заполнением газоблоками. 
 
Развитая инфраструктура: магазины, аптека, фитнес 
центр, салоны красоты, химчистка, кафе, детские дворовые клубы (шахматы, шашки, бокс, футбол, борьба) и площадки. Клуб по 
интересам для пенсионеров. 
 
В шаговой доступности: Акимат, Цон, ЗАГС, налоговая инспекция, МЕТРО, РУВД, ТЦ."
https://krisha.kz//a/show/677584721,3,7,9,nan,nan,74.0,Б,Аксай-3,монолитный,nan,nan,хорошее,1992,nan,Алматы,Ауэзовский,nan,nan,балкон,True,nan,раздельный,nan,nan,nan,False,2.8,False,False,False,False,False,False,False,False,False,True,False,True,True,False,True,False,False,False,True,False,False,41000000,False,2,False,"Пластиковые окна, улучшенная, комнаты изолированы, встроенная кухня, тихий двор.
Квартира в улучшенном доме мкрн Аксай 3 Ауезовском р-не вся инфраструктура, Хлебзавод Аксай Нан, аптеки, детские сады, школа лицей 123, тихий двор, хорошие соседи. продаем в связи с переездом в другой город. комнаты изолированные, просторные, сан. узел отдельный. окна север-юг."
https://krisha.kz//a/show/675688266,2,4,4,Орджоникидзе,nan,48.0,nan,nan,панельный,6.5,nan,среднее,1971,nan,Алматы,Турксибский,nan,nan,балкон,True,металлическая,раздельный,паркинг,nan,линолеум,False,nan,False,False,True,False,False,False,False,False,False,False,False,False,False,False,False,False,True,False,False,False,False,27000000,False,7,False,Кладовка.
https://krisha.kz//a/show/672056665,2,3,5,13 микрорайон,16,65.6,Монке би Момышулы,nan,монолитный,9.3,40.5,хорошее,2019,nan,nan,nan,есть возможность подключения,проводной,балкон,False,металлическая,совмещенный,nan,частично,линолеум,False,nan,False,False,False,False,False,False,False,False,False,True,True,False,False,False,False,False,False,False,True,False,False,31000000,False,6,False,"Пластиковые окна, неугловая, тихий двор.
Район перспективный, развивающийся. Рядом находятся Алматы арена, магнум, школа и сад. Имеются во дворе магазины, детские площадки, футбольное поле. Двор тихий, хорошие соседи."
https://krisha.kz//a/show/675468221,2,5,9,Брусиловского,23,56.0,Толе би,Тастак-2,панельный,nan,nan,nan,1984,nan,Алматы,Алмалинский,nan,nan,nan,True,металлическая,раздельный,nan,nan,nan,False,2.8,False,False,True,False,False,True,False,False,False,True,True,True,True,True,True,True,True,True,True,True,True,38000000,False,16,False,"Квартира тёплая, сквозная. Две лоджии. Расположение очень удобное! Не переходя дорогу находятся дет. садики (русский, казахский). 3 новые хорошие школы. Красивая, светлая, озелененная аллейка, тихий светлый двор полностью оснащённый. Поликлиника, стоматологии, аптеки, продуктовые магазины, овощные магазины, супермаркет Магнум, мечеть по Толе Би, церковь по Тлендиева!"
https://krisha.kz//a/show/679089028,2,1,6,Пер,nan,83.0,nan,nan,монолитный,nan,nan,свободная планировка,2015,Комильфо,Алматы,Медеуский,nan,nan,балкон,False,металлическая,совмещенный,паркинг,без мебели,nan,False,3.0,False,True,True,False,False,True,False,False,False,True,True,True,False,False,False,False,False,False,True,False,False,56000000,False,6,False,"Пластиковые окна, неугловая, улучшенная, тихий двор.
Просторная квартира в элитном жилом комплексе Комильфо. 
 
В предчистовой отделке, удобная планировка, светлая и комфортная. 
 
Двор жилого комплекса облагорожен, круглосуточно охраняется, ландшафт, детские игровые площадки, двухуровневый паркинг."
https://krisha.kz//a/show/679088904,3,1,6,Пер,nan,124.3,nan,nan,монолитный,nan,nan,хорошее,2015,Комильфо,Алматы,Медеуский,nan,nan,nan,False,металлическая,nan,паркинг,без мебели,nan,False,3.0,False,True,True,False,False,True,False,False,False,True,True,True,False,False,False,False,False,False,True,False,False,77500000,False,6,False,"Пластиковые окна, неугловая, улучшенная, тихий двор.
Просторная квартира в ЖК Комильфо 
 
В предчистовой отделке, удобная планировка, светлая и комфортная. 
 
В стоимость квартиры включено собственное паркинг место. 
 
Двор жилого комплекса облагорожен, круглосуточно охраняется, ландшафт, детские игровые площадки, двухуровневый паркинг."
https://krisha.kz//a/show/674710729,1,3,5,Ади Шарипова,nan,31.0,nan,nan,кирпичный,nan,nan,хорошее,1976,nan,Алматы,Алмалинский,отдельный,проводной,балкон и лоджия,True,металлическая,совмещенный,nan,nan,nan,False,nan,False,False,True,False,False,False,False,False,False,True,True,False,True,False,False,False,False,True,True,True,False,23000000,False,12,False,"Пластиковые окна, неугловая, комнаты изолированы, счётчики, тихий двор, кондиционер.
Gродается шикарная 1 ком. квартира. Большой совмещенный санузел, коридор 5 кв. м., утепленная лоджия. Ремонт в квартире сделан из стоящих материалов. На кухне, в санузле и коридоре на полу плитка, в комнате ламинат с рисунком « под паркет». При продаже в квартире остается почти вся мебель, бытовая техника, итальянские люстры, КРОМЕ детской кроватки, стиральной машинки, посудомоечной машинки, телевизора в комнате, так же летнего стола и стульев на лоджии. ВСЯ МЕБЕЛЬ новая, качественная ! В квартире проводной интернет, видеодомофон, установлены новые счетчики на воду. Вся инфраструктура в шаговой доступности. На территории есть детский сад, игровые и спортивные площадки, магазины, супермаркеты, парковка и т.д. Прямая. Квартира подходит под ипотеку."
https://krisha.kz//a/show/677684927,1,1,3,проспект Рыскулова,35,41.6,nan,nan,кирпичный,10.6,nan,хорошее,1985,nan,Алматы,Жетысуский,есть возможность подключения,проводной,nan,False,nan,совмещенный,паркинг,полностью,линолеум,False,nan,False,False,True,False,False,True,False,False,False,True,True,True,True,False,False,False,True,True,True,False,True,22500000,False,8,False,"Пластиковые окна, тихий двор, удобно под коммерцию, неугловая, улучшенная, комнаты изолированы, кладовка, счётчики.
Квартиру на 1 этаже 3 этажного дома. Установлены пластиковые окна, неугловая, счетчики, кладовка, тихий просторный двор(рядом патрульный полк. ) Детская площадка. Дом из красного кирпича, зимой тепло летом не жарко. Батареи отопления заменены. Кирпичные дома обладают хорошей звуко- теплоизоляцией зимой такие дома сохраняют тепло а летом защищают от зноя. ВСЕгда есть холодная и горячая вода, счетчики, газ 
Хорошая транспортная Доступность. Удобно под коммерцию окна выходят на улицу. Сделан косметический ремонт квартира чистая и свежая! Рядом школа и магазины как продуктовые так и строительные. Добратся до центра города можно без проблем (недалеко расположены барахолка, жд вокзалы, зеленый базар, оптовка и т.д)документы в порядке!Соседи тихие дружные. торг уместен"
https://krisha.kz//a/show/678748092,7,8,9,nan,nan,166.0,nan,Аккент 43,монолитный,12.0,nan,хорошее,2012,Аккент,Алматы,Алатауский,нет,оптика,несколько балконов или лоджий,True,металлическая,2 с/у и более,паркинг,nan,nan,False,2.6,False,False,False,False,False,False,False,False,False,True,True,True,True,True,True,True,True,True,True,True,True,82000000,False,9,False,"Продаётся 7 комнатная светлая, чистая и меблированная квартира в тихом Жилом Комплексе. 
 
Кухня удлинённая, 12 квадратов. 
В доме 2 совмещённых санузла и 2 отдельных туалета. 
Большие окна в зале, 3 балкона на всю квартиру. 
 
Инфраструктура: в доме имеется продуктовый магазин, 2 овощных магазина, Центр развития детей, в 20 метрах Детский сад. 
В шаговой доступности школа #181 и Лицей #178. 
 
Сам ЖК как небольшой город с охраной, на его территории находятся салоны красоты, салоны маникюра, аптеки, мясные магазины, кондитерские, столовые и мини-маркеты. 
Так же в 100 метрах от дома расположен Банный комплекс и Спортзал. 
Множество детских площадок, прогулочных зон, и медицинских центров. 
 
Под домом имеется охраняемый паркинг."
https://krisha.kz//a/show/677183924,2,4,6,nan,nan,63.0,nan,Кокжиек 51,монолитный,14.0,nan,среднее,2010,nan,Алматы,Жетысуский,nan,nan,балкон,True,металлическая,раздельный,nan,nan,линолеум,False,2.7,False,False,False,False,False,True,False,False,False,True,True,True,True,True,True,True,True,True,True,True,True,28000000,False,5,False,None
https://krisha.kz//a/show/672773145,1,9,9,nan,nan,40.0,nan,Жетысу-1,панельный,9.8,nan,хорошее,1990,nan,Алматы,Ауэзовский,nan,проводной,nan,False,металлическая,совмещенный,nan,nan,линолеум,False,2.8,False,False,True,False,False,True,False,False,False,True,True,True,True,False,True,True,True,True,True,True,False,32000000,True,14,False,"Новая сантехника, улучшенная, встроенная кухня, пластиковые окна, счётчики, тихий двор, кондиционер, комнаты изолированы, кладовка, неугловая.
Однокомнатная улучшенная квартира в одном из самых востребованных районов города. Квартира в хорошем состоянии, не требует вложении. В шаговой доступности все необходимое для комфортного проживания. Рядом Магнум, Базар Арыстан, станция метро. В квартире очень тепло и уютно. Во дворе имеется Камера наружного наблюдения, свой шлагбаум."
https://krisha.kz//a/show/678285565,2,nan,nan,ул,nan,45.0,nan,nan,кирпичный,nan,nan,nan,1977,nan,Алматы,Алатауский,отдельный,проводной,nan,False,металлическая,совмещенный,nan,nan,линолеум,False,2.8,False,False,False,False,False,True,False,False,False,True,True,True,True,True,True,True,True,True,True,True,True,24000000,False,5,False,"В центре города 
до пр. Райымбека 50 м 
Рядом остановка, поликлиника, садик, русская и казахская школа, магазины"
https://krisha.kz//a/show/678007400,3,10,10,Жунисова,8/8,91.0,nan,nan,монолитный,16.0,nan,nan,2019,Alma City,Алматы,Наурызбайский,nan,nan,nan,False,nan,nan,nan,nan,nan,False,nan,False,False,False,False,False,False,False,False,False,True,True,True,True,True,True,True,True,True,True,True,True,42000000,False,8,False,"Продам уютную квартиру со всеми удобствами и мебелью. Свежий евро ремонт, мебель и техника с нуля новая. Имеется кондиционер. 
2 санузла, 1 кладовка, комнаты раздельные"
https://krisha.kz//a/show/662521473,3,2,5,Саина,18,65.0,Кабдолова,nan,панельный,9.0,nan,хорошее,1976,nan,Алматы,Ауэзовский,отдельный,оптика,nan,False,металлическая,раздельный,рядом охраняемая стоянка,частично,nan,False,2.5,True,False,True,False,True,True,False,False,False,True,True,False,True,False,True,True,True,True,True,True,False,37500000,False,16,False,"Пластиковые окна, неугловая, комнаты изолированы, встроенная кухня, новая сантехника, кладовка, счётчики, тихий двор, кондиционер.
$! очень светлая, уютная, теплая квартира😍. большая, новая, современная детская площадка!☝️рядом г.пермаркеты OBI, Metro. кладовка рядом с квартирой."
https://krisha.kz//a/show/678095381,2,19,21,Аль,nan,74.1,nan,nan,монолитный,nan,nan,требует ремонта,2022,AL’FARABI 27,nan,nan,nan,nan,nan,False,nan,nan,nan,nan,nan,False,3.0,False,True,False,True,False,True,True,True,False,True,True,True,True,True,True,True,True,True,True,True,True,79180000,False,5,False,"Реальному покупателю 5% скидка. AL’FARABI 27 - один из лучших жилых комплексов, бизнес-класс, развитая инфраструктура, безопасные и обустроенные дворы, игровые площадки, Fitness Center с тренажерными залами, большой бассейн и SPA комплекс - все продумано до мелочей. 
Уютная двухкомнатная квартира с шикарным панорамным видом на город и горы (юго-запад). Комфортное местоположение, надежный застройщик, высокое качество."
