uri,room_count,floor,max_floor,street,house_number,general_area,intersection,microdistrict,building_type,kitchen_area,living_area,condition,build_year,residential_complex,city,district,telephone,internet,balcony,is_balcony_glazed,door,bathroom,parking,furniture,floor_type,former_hostel,ceiling_height,bars_on_the_window,security,entry_phone,code_lock,alarm,video_security,video_entry_phone,concierge,exchange_possible,plastic_windows,non_angular,improved,rooms_isolated,studio_kitchen,kitchen_builtin,new_plumbing,pantry,counters,quiet_courtyard,air_conditioning,commercial_convenient,price,mortgaged,images_count,private_hostel,text
https://krisha.kz//a/show/674434850,3,5,5,nan,nan,58.0,Левитана,Алмагуль,панельный,6.0,nan,хорошее,1978,nan,Алматы,Бостандыкский,отдельный,ADSL,nan,True,металлическая,совмещенный,рядом охраняемая стоянка,nan,ламинат,False,2.5,False,False,True,False,False,True,False,False,False,True,True,False,False,False,False,False,False,True,True,False,False,36500000,False,5,False,"Пластиковые окна, неугловая, счётчики, тихий двор.
Квартира уютная, светлая, чистая. рядом находятся школы, аптеки, магнум, цон. экологический чистый район. не в залоге. документы в порядке."
https://krisha.kz//a/show/679481912,1,2,12,nan,nan,35.0,Момышулы Байтерекова,Акбулак 87,монолитный,nan,nan,хорошее,2020,Алмалы,Алматы,Алатауский,есть возможность подключения,проводной,лоджия,False,металлическая,совмещенный,nan,nan,ламинат,False,2.7,False,False,False,False,False,False,False,False,False,True,True,True,True,True,True,True,True,True,True,True,True,23000000,False,12,False,Реальному покупателю торг
https://krisha.kz//a/show/678928917,2,8,9,Жунисова,nan,52.8,nan,nan,монолитный,nan,nan,свободная планировка,2021,Alma City,Алматы,Наурызбайский,nan,nan,несколько балконов или лоджий,False,nan,nan,рядом охраняемая стоянка,nan,nan,False,2.8,False,False,False,False,False,False,False,False,False,True,True,True,True,True,True,True,True,True,True,True,True,25500000,False,15,False,None
https://krisha.kz//a/show/679306193,4,9,19,Аль,nan,140.0,nan,nan,монолитный,18.0,nan,nan,2020,Metropole,Алматы,Бостандыкский,nan,nan,лоджия,True,бронированная,2 с/у и более,паркинг,nan,паркет,False,3.0,False,False,False,False,False,False,False,False,False,True,True,True,True,True,True,True,True,True,True,True,True,240000000,False,12,False,Квартира в идеальном состоянии
https://krisha.kz//a/show/679116367,2,1,2,Самал,24/2,69.5,nan,Алгабас,иное,nan,nan,хорошее,2006,nan,Алматы,Алатауский,nan,ADSL,nan,False,металлическая,раздельный,паркинг,nan,линолеум,False,nan,False,False,True,False,False,False,False,False,False,True,False,True,False,False,False,False,False,False,True,False,False,38000000,False,10,False,"Пластиковые окна, улучшенная, тихий двор."
https://krisha.kz//a/show/679306117,1,2,5,Сейфуллина,nan,36.0,nan,nan,кирпичный,84.0,nan,хорошее,1994,nan,Алматы,Турксибский,отдельный,оптика,балкон,True,металлическая,совмещенный,nan,nan,линолеум,False,2.8,False,False,True,False,False,True,False,False,False,True,True,False,False,False,True,True,False,False,False,False,False,28000000,False,15,False,"Пластиковые окна, неугловая, встроенная кухня, новая сантехника.
Пластиковые окна, неугловая, тихий двор, новая сантехника, горячая вода через бойлер, встроенная кухня, купе-шифонер. Очень теплая! Кирпичный дом! Ремонт свежий, сделан 2021г. Рядом Магнум, март, МАКДОНАЛЬДС, Акжол, Эльнас, базар, стадион, спортивный комплекс Аблай Хан, парк, сквер, вокзал, есть школы, детские сады, акимат, поликлиника, новая пешеходная улица (Арбат), а также все что необходимо находится в шаговой доступности. Дружелюбные соседи, транспорт до любой точки города."
https://krisha.kz//a/show/679116301,6,9,12,Тажибаевой,nan,135.0,Розыбакиева,nan,монолитный,nan,nan,хорошее,2019,ELEMENT,Алматы,Бостандыкский,nan,ADSL,лоджия,False,металлическая,2 с/у и более,паркинг,nan,ламинат,False,3.0,False,True,True,False,True,True,True,False,False,True,True,True,True,False,False,False,True,False,True,True,False,255000000,False,45,False,"Пластиковые окна, тихий двор, кондиционер, неугловая, улучшенная, комнаты изолированы, кладовка.
Большая, светлая квартира. Две квартиры объединены, есть кладовое помещение. Возведены стены из прочного гипсокартона. Рядом ТРЦ Mega Center Alma-Ata, университеты, детские сады, колледжи, школы, магазины, рестораны, фитнес-залы (MegaGym, Fitnation). Имеются 2 подземных паркингов, вид на футбольное поле. Удобное расположение, дружелюбные соседи. На территории будет большой парк."
https://krisha.kz//a/show/678928766,2,8,9,nan,nan,79.0,nan,Аксай-1А 17,монолитный,18.0,nan,хорошее,2006,nan,Алматы,Ауэзовский,nan,оптика,балкон,False,бронированная,2 с/у и более,nan,nan,ламинат,False,2.8,False,False,False,False,False,False,False,False,False,True,True,True,True,True,True,True,True,True,True,True,True,45000000,False,12,False,"Только после Евро ремонта, Вся техника и Мебель новая (дорогая), делали ремонт для себя. торг в разумных пределах"
https://krisha.kz//a/show/678381203,1,4,8,nan,nan,39.2,Северное кольцо,Ожет,монолитный,11.5,nan,черновая отделка,2023,nan,Алматы,Алатауский,nan,проводной,балкон,False,металлическая,совмещенный,nan,nan,nan,False,3.0,False,False,False,False,False,False,False,False,True,True,False,False,False,False,False,False,False,False,False,False,False,18000000,False,3,False,"Пластиковые окна.
Дом комфорт класса высота потолков 3м и состоится она из 6 блоков /8 этажей. Удобный и продуманный планировка. сдача 1 квартал 2023года. Перспективный и развивающий район. Детский сады и школы рядом. Рынок Кенжехан."
https://krisha.kz//a/show/679306030,2,7,10,Наурызбай батыра,2,64.5,nan,nan,монолитный,nan,nan,nan,2022,nan,Алматы,Бостандыкский,nan,nan,nan,False,nan,2 с/у и более,nan,nan,nan,False,3.0,False,False,False,False,False,False,False,False,False,True,True,True,True,True,True,True,True,True,True,True,True,53000000,False,3,False,"Продаётся квартира в ЖК ORTAU, которая находится в центральной части города Алматы, в экологически чистом районе Керемет, Сейфуллина – Сатпаева. Несмотря на то, что комплекс расположен на тихой и уютной улице, в шаговой доступности — большое количество крупных бизнес-центров, кафе, ресторанов, торгово-развлекательных и учебных заведений. ТРЦ Forum Алматы. Парк развлечений Мир Фантазий. Университет Туран. Центральный стадион 
Кроме того, здесь очень хорошая транспортная развязка, которая позволит легко и быстро добраться в любую часть города."
https://krisha.kz//a/show/677034390,3,1,5,nan,nan,55.0,nan,№11 33,панельный,nan,nan,среднее,1975,nan,Алматы,Ауэзовский,nan,nan,nan,False,металлическая,совмещенный,nan,nan,nan,False,2.6,True,False,True,False,False,True,False,False,True,True,False,False,False,False,False,False,False,False,True,False,False,33000000,False,7,False,"Пластиковые окна, тихий двор.
Квартира расположена на 1 этаже, имеется свой огород. комнат 3, но между 2-мя комнатами мы соорудили ещё одну небольшую комнату. Это можно увидеть на фотографиях. 
Просторный двор, детская площадка также имеется. Поблизости очень много магазинов, также торговых домов, салонов красоты. Квартира находится в спальном районе города. Район очень тихий и, считается одним из лучших районов. Очень развитая инфраструктура. Рядом в 100-200 м. есть садик и школа. Неподалёку расположен ТРЦ Москва, также парк развлечений, аквапарк. Не упустите свой шанс."
https://krisha.kz//a/show/677264025,4,nan,nan,Байтурсынова,nan,114.0,Тимирязева,nan,монолитный,nan,nan,nan,2021,Forum Residence,Алматы,Бостандыкский,nan,nan,nan,False,nan,2 с/у и более,nan,nan,nan,False,3.0,False,False,False,False,False,False,False,False,False,True,True,True,True,True,True,True,True,True,True,True,True,127000000,False,10,False,Торг небольшой
https://krisha.kz//a/show/679116224,2,13,13,Толе би,nan,50.0,Жарокова,nan,монолитный,7.0,nan,хорошее,2022,Nomad,Алматы,Алмалинский,nan,ADSL,nan,False,бронированная,совмещенный,паркинг,nan,паркет,False,2.7,False,False,False,False,False,False,False,False,False,True,True,True,True,True,True,True,True,True,True,True,True,52000000,False,4,False,"Продам хорошую, светлую, уютную 2-х комнатную квартиру! ремонт сделан по авторскому проекту (дорого), продумано всё до мелочей. Вся бытовая техника. С хорошим расположением, всё рядом! Продажа без посредников!"
https://krisha.kz//a/show/678594737,4,1,3,nan,nan,123.8,nan,Ерменсай участок 9,монолитный,nan,nan,черновая отделка,2022,Alma Villa,Алматы,Бостандыкский,nan,nan,nan,False,nan,nan,паркинг,nan,nan,False,3.15,False,False,False,False,False,False,False,False,False,True,True,True,True,True,True,True,True,True,True,True,True,92850000,False,3,False,"Комплекс сдан в эксплуатацию 1-й этаж, Терраса 20 м2, балкон 7 м2, окна север-юг 
ЖК Alma Villa расположен в перспективном, экологически чистом, тихом и зеленом микрорайоне Ерменсай. Рядом – Парк имени Первого Президента, школы (TAMOS, NGS, KIS), Esentai mall. 
Во дворе расположены детские игровые площадки, участок с уличными тренажерами, зона отдыха. В здании ЖК находятся спа-зона, фитнес центр с бассейном 
💥 В квартирах на первых этажах предусмотрена личная терраса; 💥 На территории ЖК также будет функционировать собственный фитнес центр с бассейном; 
💥 Территория комплекса по периметру огорожена и освещена; 💥 Охраняемая территория постами КПП и видеонаблюдением."
https://krisha.kz//a/show/678927913,2,3,9,Талгарский тракт,6,49.5,nan,nan,монолитный,nan,32.65,черновая отделка,2023,Hayat Apartments,Алматы,Медеуский,nan,nan,nan,False,nan,nan,паркинг,nan,nan,False,2.7,False,False,False,False,False,False,False,False,False,True,True,True,True,True,True,True,True,True,True,True,True,23500000,False,6,False,"Не угловая, свободная планировка 3 этаж окна смотрят в сторону города 
2 этап строительства, сдача октябрь 2023 года 
 
продажа по переуступке прав. 
Для оформления достаточно иметь 30 процентов от суммы 
остальное после ввода в эксплуатацию 
 
Выбирали жилой комплекс от застройщика Hayat Construction потому что компания использует качественные материалы строительства, понравились компактные и удобные планировки, современный дизайн комплекса, большие окна и выгодная цена."
https://krisha.kz//a/show/679305928,3,5,5,nan,nan,70.0,Момышулы,Мамыр-1,панельный,11.0,nan,хорошее,1993,nan,Алматы,Ауэзовский,nan,через TV кабель,несколько балконов или лоджий,True,металлическая,раздельный,рядом охраняемая стоянка,nan,ламинат,False,2.8,True,False,True,False,False,False,False,False,False,True,False,True,True,False,True,True,False,True,True,False,False,45000000,False,7,False,"Пластиковые окна, улучшенная, комнаты изолированы, встроенная кухня, новая сантехника, счётчики, тихий двор.
Представляем Вашему вниманию эксклюзивный вариант для компортного проживания, комнаты изолированные, отличная планировка, два просторных балкона выходящие на детские площадки, просторная кухня, вложений не требуется, КСК функционирует на 100 %, чистый подъезд, ухоженный тихий двор. Местоположение дома исключает шум дорог, рассмотриваем ипотечное приобретение. 
Рядом ТРЦ Спутник, школы, садики, новая поликлиника, отделение банков. 
По всем вопросам звонить в удобное для Вас время."
https://krisha.kz//a/show/676304900,2,8,13,Утеген батыра,17б,57.0,nan,nan,монолитный,12.0,nan,хорошее,2018,UTEGEN,Алматы,Ауэзовский,есть возможность подключения,nan,балкон,True,металлическая,совмещенный,паркинг,nan,паркет,False,2.85,False,True,True,False,False,True,False,True,False,True,True,True,True,True,True,True,True,True,True,True,True,38000000,False,14,False,"Заезжай и живи ! 
Полноценная 2х комнатная квартира с отдельной кухней. 
 
Изолированный двор с детской площадкой. Двор без машин. 
2х уровневый паркинг с охраной. 
 
ЖК огорожен и охраняется 24/7 
Ведётся видео наблюдение 
 
В шаговой доступности: 
Гранд парк, остановка, магазины, салоны красоты 
5 мин ходьбы до озера Сайран и Магнум. 
 
В ЖК есть центр раннего развития детей 
Также рядом Мед центры: Хак, Сунар, Сункар. 
 
Напротив находится Ауэзовское РОВД. 
Соседи добрые, отзывчивые. 
квартира в аренду не сдавалась, мы первые хозяева. 
 
Аура квартиры чистая. 
Зимой квартира теплая. 
На окнах решетки для защиты детей. 
Балкон застеклён. 
 
есть лоджии где ваше гости могут подышать свежим воздухом. 
 
В подъезде 2 лифта очень удобных для молодых Мам с детьми. 
Продаем связи с расширением. 
 
Успейте купить 
По номеру 
 
Прошу Риелтеров не беспокоить !"
https://krisha.kz//a/show/679115862,2,9,13,Макатаева,127/25,41.32,nan,nan,монолитный,nan,nan,черновая отделка,2023,12 месяцев,Алматы,Алмалинский,отдельный,оптика,лоджия,True,металлическая,раздельный,паркинг,без мебели,nan,False,2.8,False,True,True,True,False,False,False,False,False,True,True,True,True,True,False,False,False,False,False,False,False,18900000,False,3,False,"Пластиковые окна, неугловая, улучшенная, комнаты изолированы, кухня-студия.
Представляю Вашему вниманию новое отличное предложение! Квартира уютная, просторная, новая. Все в шаговой доступности. отличная локация. квартира в черновой отделке в строящемся жк комфорт класса ""12 месяцев"" со свободной планировкой, лоджия, витражные окна, бесшумные лифты, детские площадки, паРКинг. Развитая инфраструктура всё что необходимо для комфортной жизни в шаговой доступности. 
Юридически чистая, не залоговая. 
звоните! 
Инвестируйте в будущее, приобретайте квартиру по выгодной цене! 
Тихий район с пересечением инфраструктуры, многочисленными зелеными насаждениями. 
Успейте приобрести по выгодной цене! 
срок сдачи 4 квартал 2023го года."
https://krisha.kz//a/show/676808963,1,8,10,Жунисова,nan,31.03,Алатау,Шугыла,монолитный,nan,nan,черновая отделка,2022,Alma City,Алматы,Наурызбайский,nan,nan,балкон,False,металлическая,nan,nan,nan,nan,False,2.8,False,False,False,False,False,False,False,False,False,True,True,True,True,True,True,True,True,True,True,True,True,16200000,False,0,False,"1 комнатную квартиру, студия от застройщика казахстрой, жк Alma city 5/2 ключи на руках"
https://krisha.kz//a/show/677728379,2,2,2,Коктем,84/1,46.0,nan,Ремизовка,кирпичный,10.0,nan,хорошее,1976,nan,Алматы,Бостандыкский,отдельный,ADSL,nan,False,металлическая,раздельный,рядом охраняемая стоянка,полностью,ламинат,False,nan,False,False,True,False,False,False,False,False,False,True,False,True,True,False,True,True,False,True,True,False,False,24000000,False,12,False,"Пластиковые окна, улучшенная, комнаты изолированы, встроенная кухня, новая сантехника, счётчики, тихий двор.
Квартира расположена для тех кто любит горный свежи воздух. Отличный панорамный вид из окна в город."
https://krisha.kz//a/show/679305729,3,3,5,nan,nan,65.0,nan,Кемел,иное,nan,nan,хорошее,1990,nan,Алматы,Жетысуский,nan,nan,nan,False,nan,nan,nan,nan,nan,False,nan,False,False,False,False,False,False,False,False,False,True,True,True,True,True,True,True,True,True,True,True,True,43000000,False,12,False,"3х комнатная квартира, со свежим ремонтом, сан узел раздельные, балкон, лоджия. Удобная развязка, рядом школа, дет сад, площадки, магазины."
https://krisha.kz//a/show/677909538,2,5,12,3,nan,58.7,nan,nan,монолитный,11.0,nan,хорошее,2018,Alatau City 2.0,Алматы,Алатауский,nan,проводной,лоджия,False,металлическая,раздельный,nan,полностью,ламинат,False,2.8,False,False,True,True,False,True,False,False,True,True,True,True,True,False,True,False,False,True,True,False,False,32000000,False,7,False,"Пластиковые окна, неугловая, улучшенная, комнаты изолированы, встроенная кухня, счётчики, тихий двор.
Срочно торг уместен ипотеку рассмотрим."
https://krisha.kz//a/show/679115314,2,9,9,Кенесары хана,54,87.5,nan,Каргалы,монолитный,nan,nan,хорошее,2011,Хан Тенгри,Алматы,Наурызбайский,nan,оптика,балкон и лоджия,True,металлическая,совмещенный,паркинг,частично,ламинат,False,2.9,False,True,False,False,False,True,False,False,False,True,False,False,False,False,False,False,False,False,False,False,False,57500000,False,15,False,"Пластиковые окна.
Продажа от хозяина. Уютная, светлая, теплая квартира. С хорошим и качественным ремонтом, с возможностью переделать под 3 комнатную. Экологически чистый и тихий район, большая лоджия с видом на горы. Все что необходимо рядом - магнум, школы, аптеки."
https://krisha.kz//a/show/679115570,3,6,9,nan,nan,70.0,nan,Аксай-1 23,панельный,nan,nan,хорошее,1990,nan,Алматы,Ауэзовский,отдельный,оптика,несколько балконов или лоджий,True,металлическая,раздельный,рядом охраняемая стоянка,nan,nan,False,2.8,False,False,True,False,False,True,False,False,False,True,True,True,False,False,False,False,True,True,True,False,False,42000000,False,5,False,"Пластиковые окна, неугловая, улучшенная, кладовка, счётчики, тихий двор.
Продам квартиру улучшенной планировки. Владеем этой квартирой с момента постройки. Продаем в связи с переездом. Квартира не в новом ЖК, НО! в доме есть всё, для комфортного проживания и в первую очередь - крепкие, толстые, надёжные, тёплые стены! комнаты большие и светлые, есть 2 большие застеклённые лоджии, туалет и ванная раздельные. есть отдельное помещение для гардероба или хранения вещей. В доме новый лифт. Хорошие, дружелюбные соседи. Тихий двор. Во дворе дома имеются магазины, школы, в том числе новая школа, детские центры, торговые центры. Автобусы во все направления, выделенная автобусная полоса. В доступности - метро. В 5 минутах ходьбы - ТРЦ Asia Park. Рядом с домом охраняемая стоянка."
