uri,room_count,floor,max_floor,street,house_number,general_area,intersection,microdistrict,building_type,kitchen_area,living_area,condition,build_year,residential_complex,city,district,telephone,internet,balcony,is_balcony_glazed,door,bathroom,parking,furniture,floor_type,former_hostel,ceiling_height,bars_on_the_window,security,entry_phone,code_lock,alarm,video_security,video_entry_phone,concierge,exchange_possible,plastic_windows,non_angular,improved,rooms_isolated,studio_kitchen,kitchen_builtin,new_plumbing,pantry,counters,quiet_courtyard,air_conditioning,commercial_convenient,price,mortgaged,images_count,private_hostel,text
https://krisha.kz//a/show/679182065,3,2,5,Сатпаева,4а,93.3,Валиханова,Самал-1,кирпичный,10.0,51.1,среднее,1974,nan,Алматы,Медеуский,есть возможность подключения,оптика,лоджия,False,металлическая,раздельный,nan,частично,линолеум,False,3.0,True,False,True,True,False,True,False,False,False,True,True,False,False,False,False,False,True,True,False,False,True,64330000,False,17,False,"Пластиковые окна, неугловая, кладовка, счётчики, удобно под коммерцию.
Продается 3х-комнатная квартира по адресу Сатпаева 4а. (Медеуский район) Общая площадь квартиры 93, 3 м². Жилая площадь 51, 1 м². Площадь кухни 9, 9 м². Площадь всех отдельных комнат можете посмотреть на плане в фотографиях. 
 
Собственник один. При заключении договора готовы освободить квартиру за 3 календарных дня. Есть возможность покупки в ипотеку. 
 
Планировка очень удобная, высокие потолки, 3 просторных комнаты, большая кухня и широкая лоджия. Перепланировок не было. Санузел раздельный. В каждой комнате установлены батареи: зимой в квартире температура комфортная. Летом в квартире не жарко, т. к окна выходят на север и юг. Квартиру можно переделать в общежитие. Подходит под коммерцию. 
 
 
На кухне и в комнате установлены пластиковые окна, в двух других комнатах установлены деревянные советские стеклопакеты. Лоджия огорожена металлическими решетками, не застеклена. Если застеклить лоджию можно значительно увеличить жилую площадь и расширить 2 прилегающие к ней комнаты. 
 
На лестничной площадке есть кладовка с замком. 
 
На въездах во двор установлены шлагбаумы, всегда найдется парковочное место. Возле подъезда установлена камера видеонаблюдения. 
 
Инфраструктура: в шаговой доступности есть 2 торговых центра, несколько крупных супермаркетов, множество различных кафе и ресторанов, остановки общественного транспорта и 2 крупных транспортных магистрали (Абая, Аль-Фараби). Очень удобное расположение квартиры для комфортной жизни или для ведения бизнеса."
https://krisha.kz//a/show/679150820,2,2,4,Розыбакиева,153Г,52.0,Утепова,nan,кирпичный,12.0,nan,хорошее,1974,nan,Алматы,Бостандыкский,отдельный,оптика,несколько балконов или лоджий,True,бронированная,раздельный,nan,полностью,паркет,False,nan,False,False,True,False,True,False,False,False,False,True,False,True,False,True,False,False,False,False,False,False,False,45000000,False,15,False,"Пластиковые окна, улучшенная, кухня-студия.
Свежий качественный стильный ремонт. Перепланировка узаконена: раздельные с/у, балконы объединены с гостиной и кухней. Качественные стеклопакеты. Матовый натяжной потолок. 
Интернет - оптоволокно. Охранная сигнализация. 
Продаётся со всей мебелью и встроенной бытовой техникой. 
Возможна продажа через ипотечный кредит. торг."
https://krisha.kz//a/show/679260906,2,3,10,Кенесары хана,54/34,66.0,nan,nan,монолитный,12.0,nan,nan,2014,nan,Алматы,Бостандыкский,nan,nan,nan,False,nan,nan,nan,nan,nan,False,nan,False,False,False,False,False,False,False,False,False,True,True,True,True,True,True,True,True,True,True,True,True,45200000,False,18,False,Продам новую квартиру после ремонта ! Не кто не проживал. Жк Хан Тенгри. Качественные материалы. Двери не стандарт 2.3 метра. Ламинат Польша кронопол.
https://krisha.kz//a/show/678967126,1,3,9,nan,nan,39.6,Аносова,Тастак-2 218,панельный,10.0,17.8,хорошее,1990,nan,Алматы,Алмалинский,отдельный,оптика,nan,False,металлическая,совмещенный,рядом охраняемая стоянка,полностью,линолеум,False,3.0,False,False,True,False,False,False,False,False,False,True,True,True,True,False,True,False,True,True,True,True,False,29800000,False,13,False,"Пластиковые окна, неугловая, улучшенная, комнаты изолированы, встроенная кухня, кладовка, счётчики, тихий двор, кондиционер.
Продается улучшенная однокомнатная квартира от собственника. Квартира очень светлая, теплая, не углавая, окна выходят во двор на ЮГ. 
Рядом оптовка, Small, Magnum. Порядочные соседи. Ухоженный и благосутроенный двор. по документам чистая, не в залоге. Кладовка внутри квартиры и входит в план."
https://krisha.kz//a/show/679541811,2,6,10,Мкр,nan,61.0,nan,nan,монолитный,nan,nan,свободная планировка,2022,Alem City,nan,nan,nan,nan,балкон,True,металлическая,раздельный,паркинг,nan,nan,False,2.7,False,False,False,False,False,False,False,False,False,True,True,True,True,True,True,True,True,True,True,True,True,28000000,False,4,False,"Продам полноценную 2-х комнатную квартиру или же можно сделать 3-х комнатную квартиру в перспективном районе Наурызбайского района от застройщика QAZAQSTROY ! Жк комфорт класса, с панорамными окнами, фасад жк покрыт фиброцементными панелями… жк в пяти метрах от улицы Абая ! Возле жк акимат Наурызбайского района, ЦОН, школа, детский сад ! И самое крутое рядом имеется Алем парк) рядом будет проходить метро ! 
Документы на руках можно в ипотеку !"
https://krisha.kz//a/show/679063976,3,2,5,nan,nan,86.0,nan,Саялы,монолитный,12.0,nan,хорошее,2017,nan,Алматы,Алатауский,nan,через TV кабель,лоджия,True,металлическая,раздельный,паркинг,nan,линолеум,False,2.8,False,False,True,False,False,True,False,False,False,True,True,True,True,False,False,False,False,False,True,False,False,45000000,False,3,False,"Пластиковые окна, неугловая, улучшенная, комнаты изолированы, тихий двор.
Продам трехкомнатную улучшеную квартиру в хорошем состоянии санузел раздельный не угловая второй этаж лоджии застеклены торг обмен не интересует"
https://krisha.kz//a/show/667102870,3,1,6,nan,nan,110.6,nan,Баганашыл 4к13,монолитный,nan,nan,nan,2014,Наурыз-2,Алматы,Бостандыкский,отдельный,ADSL,балкон,True,бронированная,2 с/у и более,паркинг,полностью,паркет,False,3.0,False,False,False,False,False,False,False,False,False,True,True,True,True,True,True,True,True,True,True,True,True,115000000,False,19,False,"Авторский дизайн проект с использованием дорогих материалов. 2 спальни, 2 гардеробные, 2 сан. узла. ремонт делали для себя. В квартире много солнца, выходит на Восток-ЮГ. 
- канадский дубовый паркет Coswick (не паркетная доска) - сан. узлы Villeroy&Boch, Hansgrohe 
- дорогая встроенная техника 
- мебель на заказ, МДФ крашенный 
- электрика Shneider, германия 
- мрамор натуральный, гипсовые споты и рамки на стенах 
- два кондиционера 
Агентства и риелторы, просьба не беспокоить."
https://krisha.kz//a/show/679515791,2,5,9,Жунисова,8/9,44.0,nan,nan,монолитный,nan,nan,хорошее,2021,Alma City,Алматы,Наурызбайский,nan,nan,балкон,False,металлическая,совмещенный,nan,nan,ламинат,False,2.8,False,False,False,False,False,False,False,False,False,True,True,True,True,True,True,True,True,True,True,True,True,23000000,False,10,False,None
https://krisha.kz//a/show/679512638,3,5,5,Толе би,157,86.0,Байзакова,nan,кирпичный,8.0,nan,хорошее,1976,nan,Алматы,Алмалинский,nan,оптика,балкон и лоджия,True,металлическая,совмещенный,рядом охраняемая стоянка,nan,ламинат,False,2.8,False,False,False,False,False,False,False,False,False,True,True,True,True,True,True,True,True,True,True,True,True,50000000,False,32,False,"Грамотное планировочное решение с кухней-студией делает квартиру комфортной для большой семьи. В кухне пол с подогревом. 
Обе спальни выходят на восток, поэтому квартира в ясную погоду залита солнечным светом. В хозяйской спальне – большая застекленная лоджия с тёплым полом и дополнительным местом для хранения – встроенным шкафом. 
Вообще эргономика квартиры позволяет хранить много вещей незаметно: в зале есть специальные ниши с глубокими полками, в коридоре и на балконе – встроенные шкафы. 
Совминовский дом, поэтому квартира тёплая и тихая. Адекватные соседи, хороший двор с детской и футбольной площадками, оживленный район с развитой инфраструктурой: три школы в шаговой доступности, детская поликлиника, ТЦ СитиЦентр, базар «Стрела»."
https://krisha.kz//a/show/671260780,2,2,12,nan,nan,70.0,nan,Достык,монолитный,nan,nan,nan,2018,Alim,Алматы,Ауэзовский,nan,ADSL,nan,False,металлическая,nan,паркинг,nan,ламинат,False,2.8,False,True,True,False,True,True,False,False,False,True,False,False,True,False,True,True,False,False,True,False,False,45000000,False,6,False,"Пластиковые окна, комнаты изолированы, новая сантехника, встроенная кухня, тихий двор.
Срочно Продаётся НОВАЯ 2 комн. квартира 
Риелторов прошу не беспокоить."
https://krisha.kz//a/show/678986846,3,2,9,Аксай,nan,72.0,nan,Аксай-5,панельный,12.0,nan,хорошее,1998,nan,Алматы,Ауэзовский,есть возможность подключения,проводной,лоджия,True,металлическая,раздельный,nan,nan,ламинат,False,2.85,False,False,False,False,False,False,False,False,False,True,True,True,True,True,True,True,True,True,True,True,True,48000000,False,10,False,Риэлторов не беспокоить
https://krisha.kz//a/show/673807965,3,10,10,nan,nan,91.81,nan,Шугыла 14,монолитный,nan,nan,nan,2021,Alma City,Алматы,Наурызбайский,nan,через TV кабель,nan,True,металлическая,nan,рядом охраняемая стоянка,nan,ламинат,False,2.8,True,False,False,False,False,True,True,False,False,True,False,False,True,False,False,True,False,False,False,True,False,41900000,False,15,False,"Комнаты изолированы, кондиционер, пластиковые окна, новая сантехника.
Продается улучшенная 3 комнатная квартира в ЖК Алма сити. 
Район быстро развивается, рядом ТЦ Апорт, Леруа Марлен, Магнум, ЦОН, школы, детские сады и т.д. Экологический чистый район. Новая поликлиника, рядом новый проспект Абая, пробиваемый Толе би. строится станция метро. Ремонт делали для себя, все материалы качественные, дорогие, планировка удобная. Витражный балкон утепленнный. Обои, ламинат все дорогие, решетки на окнах, кондиционер, современный дизайн. Все новое, продаём в связи с переездом. Можно на ипотеку через банк."
https://krisha.kz//a/show/678764877,3,17,17,улица Жандосова,144/2,70.0,Жандосова Алтынсарин,nan,монолитный,12.0,70.0,хорошее,2018,nan,Алматы,Ауэзовский,отдельный,ADSL,несколько балконов или лоджий,True,бронированная,совмещенный,паркинг,полностью,ламинат,False,2.8,False,False,True,False,False,True,True,False,False,True,False,True,True,False,True,True,True,True,True,True,True,57000000,False,20,False,"Кондиционер, пластиковые окна, удобно под коммерцию, улучшенная, комнаты изолированы, встроенная кухня, новая сантехника, кладовка, счётчики, тихий двор.
Свежий евро ремонт, шикарный вид, очень хорошая квартира, хорошая инфраструктура, хорошие соседи, панорамные окна, вид на Горы"
https://krisha.kz//a/show/677971001,4,8,8,проспект Назарбаева,48/69,95.2,Жибек Жолы,nan,панельный,12.0,nan,хорошее,1975,nan,Алматы,Медеуский,nan,nan,nan,False,бронированная,раздельный,рядом охраняемая стоянка,nan,nan,False,2.85,False,False,True,True,False,True,False,False,False,True,True,True,True,True,True,True,True,True,True,True,True,68000000,False,48,False,"Продаётся прекрасная 4-х комнатная квартира, после ремонта. 
 
Дом -- 8 жилых этажей, плюс 9 - й, технический этаж. 
 
Во дворе детская и спортивная площадки. 
 
Въезд во двор ограничен 2 шлагбаумами (с ул. Тулебаева и проспекта Назарбаева). 
 
Во дворе и на лестничной площадке видеонаблюдение. 
 
Окна на восток и на запад. 
Прекрасный панорамный вид на горы и город. 
 
Развитая инфраструктура. 
В шаговой доступности : Арбат, ""Пассаж"", Зелёный базар, паРК 28-ми Панфиловцев, магазин ""Юбилейный"", школа 54 (после капитального ремонта), детские учреждения, центральная аптека, 5 минут до станции метро ""Жибек Жолы"". и многое другое. 
 
Квартира после ремонта. 
Новые пластиковые окна, Новые приборы учёта, Пол -- паРКет (дуб, бук, ясень), немецкие обои. 
 
Стены коридора и кухни облагорожены Канадским рустиком. 
 
В коридоре встроенные шкафы и ниши. 
При входе в квартиру гардероб, с зеРКальными дверями, от пола до потолка (Германия). 
 
Кухня со встроенным гарнитуром и техникой (Италия). 
посудомоечная и стиральная машина. 
 
Плита на газе и электричестве. 
Гриль с приводом. 
 
В зале новая, классическая стенка (фасад из дуба). 
Производство Бельгия. 
 
Шикарный, классический спальный гарнитур из натурального дерева (бук), производство Румыния. 
 
Хрустальные, классические люстры. 
Производство Чехословакия. 
 
ВАЖНО ! 
ВСЁ ОСТАЁТСЯ НОВОМУ ВЛАДЕЛЬЦУ квартиры!"
https://krisha.kz//a/show/679550894,2,11,18,Брусиловского,167,80.0,nan,Тастак-2,монолитный,nan,nan,хорошее,2012,Алтын Булак,Алматы,Алмалинский,nan,оптика,лоджия,True,бронированная,2 с/у и более,паркинг,nan,ламинат,False,2.8,True,True,True,False,True,False,True,False,False,True,True,True,False,True,True,True,False,False,True,True,False,53000000,False,21,False,"Кондиционер, пластиковые окна, неугловая, улучшенная, кухня-студия, встроенная кухня, новая сантехника, тихий двор.
Продается идеальная просторная двухкомнатная квартира с отличным видом на горы (окна на юго- восток). Квартира с отличной аурой, со свежим ремонтом, в отличном состоянии, мебелирована, без каких либо вложений. Богатый ремонт, использованы только качественные и дорогие материалы, кухня Gorenge, приводы Blum, вся сантехника Bravat, окна и двери Rehau, прозрачные решётки на окнах (не портят вид из окна+ безопасность), жалюзи на окнах (обеспечат ощущение ночи в квартире даже в самый яркий солнечный день), электрические теплые полы, два сан узла. В собственности удобное парковочное место. Юридически чистая! В ипотеку/кредит без проблем. Отличное расположение, всё в шаговой доступности: ТРЦ ADK, Magnum Express, ЦСКА (спортивные секции), станция метро Сайран, озеро Сайран (отличное место для прогулок), рынок Тастак."
https://krisha.kz//a/show/678862282,3,9,9,nan,nan,90.0,nan,Нуркент,монолитный,15.4,nan,хорошее,2014,Нуркент,Алматы,Алатауский,nan,ADSL,nan,False,nan,раздельный,паркинг,nan,ламинат,False,3.0,False,False,False,False,False,False,False,False,False,True,True,True,True,True,True,True,True,True,True,True,True,49000000,False,20,False,"Продаётся просторная, светлая и очень уютная квартира в хорошем и перспективном районе. Зимой очень тепло в квартире. Рядом вся необходимая инфраструктура- Алматы Арена, огромный гипермаркет-Магнум, поликлиники, Мешіт, спорт комплекс, бани, кафе и рестораны, прямо рядом есть школа-гимназия. Так же на 10-ом этаже есть кладовая для хранения (шин, банок и других лишних вещей) квартира с отличным ремонтом, витражные пластиковые окна от REHAU. Ухоженный и чистый двор, много количеств магазинов. Удобная транспортная развязка по всем направлениям города. Продаём в связи переездом. Первые хозяева квартиры. Все документы в порядке 
Объявления от хозяина, можете звонить в любое время!"
https://krisha.kz//a/show/675315570,1,1,9,nan,nan,38.0,Саина,Аксай-4 81,панельный,10.0,nan,хорошее,1983,nan,Алматы,Ауэзовский,отдельный,оптика,nan,False,металлическая,совмещенный,nan,nan,nan,False,2.8,True,False,True,False,False,True,False,False,False,True,True,True,False,False,True,True,True,True,True,False,True,24000000,False,13,False,"Пластиковые окна, удобно под коммерцию, неугловая, улучшенная, встроенная кухня, новая сантехника, кладовка, счётчики, тихий двор."
https://krisha.kz//a/show/676975746,1,3,10,Толе би,285,32.0,Отеген батыра,nan,монолитный,nan,nan,nan,2022,CITY PLUS,Алматы,Ауэзовский,nan,оптика,балкон,True,металлическая,совмещенный,nan,nan,ламинат,False,2.8,False,True,False,False,False,True,False,False,False,True,True,True,False,True,False,True,False,True,True,False,False,26000000,False,17,False,"Пластиковые окна, неугловая, улучшенная, кухня-студия, новая сантехника, счётчики, тихий двор."
https://krisha.kz//a/show/678316016,3,4,5,Шагабутдинова,nan,66.3,Карасай батыра,nan,панельный,nan,nan,хорошее,1981,nan,Алматы,Алмалинский,nan,проводной,балкон,True,металлическая,раздельный,рядом охраняемая стоянка,nan,линолеум,False,nan,False,False,False,False,False,False,False,False,False,True,False,False,False,False,False,True,False,False,False,False,False,44000000,False,7,False,"Пластиковые окна, новая сантехника."
