uri,room_count,floor,max_floor,street,house_number,general_area,intersection,microdistrict,building_type,kitchen_area,living_area,condition,build_year,residential_complex,city,district,telephone,internet,balcony,is_balcony_glazed,door,bathroom,parking,furniture,floor_type,former_hostel,ceiling_height,bars_on_the_window,security,entry_phone,code_lock,alarm,video_security,video_entry_phone,concierge,exchange_possible,plastic_windows,non_angular,improved,rooms_isolated,studio_kitchen,kitchen_builtin,new_plumbing,pantry,counters,quiet_courtyard,air_conditioning,commercial_convenient,price,mortgaged,images_count,private_hostel,text
https://krisha.kz//a/show/678588083,4,4,5,Макатаева,nan,100.0,проспект Сакена Сейфуллина,nan,кирпичный,11.0,nan,среднее,1992,nan,Алматы,Алмалинский,отдельный,nan,несколько балконов или лоджий,True,nan,2 с/у и более,nan,nan,nan,False,nan,False,False,True,False,False,False,False,False,False,True,False,False,False,False,False,False,False,False,False,False,False,80000000,False,5,False,"Пластиковые окна.
Удобный и востребованный район. Рядом есть практически все необходимое: Мега, Школы, ЦУМ, Гипермаркет, остановки общественного транспорта и пр."
https://krisha.kz//a/show/679008513,1,2,10,nan,nan,28.0,nan,Шугыла 8 к 9,монолитный,nan,nan,хорошее,2021,Alma City,Алматы,Наурызбайский,есть возможность подключения,оптика,балкон,False,металлическая,совмещенный,рядом охраняемая стоянка,частично,линолеум,False,2.8,False,True,True,False,False,False,False,False,False,True,True,False,False,False,True,False,False,True,True,False,True,16500000,False,19,False,"Пластиковые окна, неугловая, встроенная кухня, счётчики, тихий двор, удобно под коммерцию.
Продажа от собственника. 
Пластиковые окна, неугловая, встроенная кухня, новая сантехника, счётчики, тихий двор, удобно под коммерцию. 
Продается 1- комнатная квартира (кухня-студия) в ЖК Alma city 3, в активно развивающемся районе г. Алматы. 
✅в Ипотеку 17, 5 млн! Квартира проходит по ипотечным программам: через любой банк. а так же пенсионные выплаты рассматриваются. (Желательно наличный расчет). 
✅Удобная транспортная развязка, все необходимое расположено в шаговой доступности. 
✅Рядом с будущей остановкой метро по дорожной карте. Квартира светлая, уютная, 2, 8м потолки. 
✅ Жилой комплекс сдан в эксплуатацию в 4- квартале 2021 года. 
✅Все коммуникации центральные и подключены: вода, отопление, электричество и газ (газ будет попозже). Благоустроенный двор. 
✅Предусмотрена парковочная площадка. 
✅Все документы и ключи на руках."
https://krisha.kz//a/show/678778107,3,2,9,Кульджинский тракт,16/8,89.0,nan,Атырау,монолитный,18.0,nan,хорошее,2018,nan,Алматы,Медеуский,nan,через TV кабель,лоджия,True,металлическая,раздельный,nan,nan,ламинат,False,2.7,False,False,True,False,False,True,False,False,False,True,False,True,True,False,True,True,False,True,False,True,False,57000000,True,22,False,"Кондиционер, пластиковые окна, улучшенная, комнаты изолированы, встроенная кухня, новая сантехника, счётчики.
Евроремонт, полностью мебилировано, витражные окна"
https://krisha.kz//a/show/677937926,3,5,12,Сатпаева,90/66,85.0,Туркебаева,nan,монолитный,11.0,nan,хорошее,2021,Акварель,Алматы,Бостандыкский,есть возможность подключения,ADSL,балкон,True,металлическая,2 с/у и более,паркинг,частично,ламинат,False,2.8,False,True,True,False,True,True,False,False,False,True,True,True,True,False,True,True,False,True,True,True,False,66000000,False,13,False,"Неугловая, новая сантехника, счётчики, кондиционер, пластиковые окна, встроенная кухня, комнаты изолированы, тихий двор, улучшенная.
Трёхкомнатная квартира в ЖК Акварель, комфорт+ класс. Отличная планировка, все комнаты раздельные, гостиная большая просторная, можно разделить и сделать закрытую. Два окна выходят на запад, два на восток. Хорошая проветриваемость в доме. В каждой жилой комнате кондиционер. Два полноценных санузла, в одной ванная, в другой душевая. Кухня Блум, имеет встроенные духовой шкаф, электроплита, посудомоечная машина и вытяжка. На полу ламинат, в коридоре и спальне шкаф гардероб. дом сдан в эксплуатацию в сентябре 2021, все новое, и на Гарантии до 2023. В самом ЖК детский сад, планируется ещё один в соседнем. Разумный торг. Хозяин"
https://krisha.kz//a/show/679474897,3,10,10,Толе би,285,98.0,Отеген батыра,nan,монолитный,nan,nan,свободная планировка,2022,CITY PLUS,nan,nan,nan,nan,nan,False,nan,nan,nan,nan,nan,False,2.8,False,False,False,False,False,False,False,False,False,True,True,True,True,True,True,True,True,True,True,True,True,40000000,False,10,False,"Просторная квартира, можно сделать 4-ком, 3 балкона и 1 окно, окна на запад и восток, срочно, ипотеку рассматриваем, все документы имеются"
https://krisha.kz//a/show/679474812,3,7,9,nan,nan,90.0,Напротив Магнума,Акбулак 123,монолитный,nan,nan,хорошее,2011,nan,Алматы,Алатауский,отдельный,оптика,балкон,True,бронированная,раздельный,nan,nan,ламинат,False,2.8,False,False,True,True,False,True,True,False,False,True,True,True,True,False,True,True,False,True,True,True,False,55000000,False,16,False,"Комнаты изолированы, новая сантехника, встроенная кухня, неугловая, кондиционер, пластиковые окна, улучшенная, счётчики, тихий двор.
Квартира с евроремонтом, полностью мебелирована, дорогая техника bosch, вид с окна на горы, все в шаговой доступности, напротив магнум, школы, дет. сады, магазины."
https://krisha.kz//a/show/679298918,1,7,12,Си Синхая,17,38.0,Жарокова,nan,монолитный,nan,nan,черновая отделка,2022,Union,Алматы,Бостандыкский,nan,nan,nan,False,nan,nan,паркинг,nan,nan,False,3.0,False,False,False,False,False,False,False,False,True,True,True,True,True,True,True,True,True,True,True,True,True,30000000,False,0,False,"Сдаётся в конце года, бизнес класс, окна витражи, турецкий застройщик, черновая улучшенная стены белые, пол залит, отопление включено, дворовая инфраструктура, чистый воздух (ботанический сад, южный парк) два квартала до меги центр, вид с 7 этажа на горы, 3 подъезда, очень спокойно и не далеко от альфараби. Возможен обмен на г. Астана 2 комн. Договор переуступки, 20 млн наличными, остальное можно ипотеку оформить"
https://krisha.kz//a/show/661011214,3,2,8,nan,nan,78.0,Саина,Орбита-3 26,панельный,12.0,48.0,хорошее,1977,nan,Алматы,Бостандыкский,nan,через TV кабель,nan,False,металлическая,совмещенный,nan,частично,ламинат,False,2.8,False,False,True,False,False,False,False,False,False,True,True,True,True,True,True,True,True,True,True,True,True,55000000,False,15,False,"Квартира светлая, чистая, после капитального ремонта, тёплый пол в прихожей и на кухне, кондиционер, решетки на окнах, зелёный двор, летом не жарко. Рядом поликлиника, базар, университеты, школы, мечеть, мед. центры, Мега центр, Парк Первого Президента, и т.д. Возможен обмен на частный дом в городе."
https://krisha.kz//a/show/678920995,1,12,13,Просп,nan,45.96,nan,nan,монолитный,16.23,nan,черновая отделка,2022,RAIYMBEK,nan,nan,nan,nan,nan,False,nan,совмещенный,nan,nan,nan,False,2.0,False,False,False,False,False,False,False,False,False,True,True,True,True,True,True,True,True,True,True,True,True,31200000,False,0,False,Срок сдачи октябрь 2022г.
https://krisha.kz//a/show/678945948,2,3,4,Бухтарминская,3,47.75,Кульжинский трак,nan,монолитный,nan,nan,черновая отделка,2022,Атмосфера,Алматы,Турксибский,nan,nan,nan,False,nan,nan,паркинг,nan,nan,False,nan,False,False,False,False,False,False,False,False,False,True,True,True,True,True,True,True,True,True,True,True,True,23000000,False,3,False,"Новый дом, сдача в эксплуатацию ноябрь 2022 г., дополнительно за отдельную плату имеется кладовая 7 кВ. м. на 1 этаже"
https://krisha.kz//a/show/677738700,3,3,4,nan,nan,61.4,nan,№4 26,панельный,6.0,nan,nan,1972,nan,Алматы,Ауэзовский,есть возможность подключения,оптика,nan,True,металлическая,совмещенный,рядом охраняемая стоянка,полностью,ламинат,False,2.5,False,False,True,False,False,True,False,False,False,True,True,False,True,False,True,True,True,True,True,False,False,40000000,False,33,False,"Пластиковые окна, тихий двор, встроенная кухня, комнаты изолированы, новая сантехника, неугловая, кладовка, счётчики.
Срочно продам очень хорошую квартиру, средний этаж, в квартире очень хорошая продуваемость, окна север -юг, кухня и спальня смотрят на уютный и чистый двор с новой дет площадкой и где два своих обозначенных парковочных места со шлагбаумом, зал и спальня смотрят на аллею, три изолированные комнаты, где семья из 5 человек не мешают друг другу. Акимат сделал полную реконструкцию, положили брусчатку, провели капельное орошение для новой газонной травы на всю территорию аллеи, вообщем теперь красота, зимой и летом есть куда выйти вечером выгуливать детей, внуков и домашних питомцев. Рядом все в шаговой доступности : поликлиника, рынок большойСарыАрка, магнум, метро Москва и Сарыарка в шаговой доступности, кинотеатр Сарыарка, парковая зона (Фемели парк), аквапарк итд, короче самый цивильный мкр из всех микрорайонов. Квартира ухоженная, никогда не курили, животных не было в квартире, полы ламинат немецкий, в прихожей и на кухне плитка керамогранит ""керамомораци"", стены, потолки ровные. Подьезд чистый, есть подвальное помещение, куда можно сложить все что на потом, КСК отменное, дом 1972 года постройки, в Отбасы банке проходит, в других тоже, зимой очень тепло и сухо в квартире, летом прохладно без кондиционера, соседи просто родные люди, двор уютный, чистый, тихий. Рядом две школы, чз дорогу 27 гимназия, 6 шк, 104 казахская школа, чз парк 122, 97и 111 гимназия. Продаем со всей что есть в квартире мебелью (спальные гарнитуры в двух спальнях Италия, Белоруссия, в зале сервант, комод, стол со стульями дубовый Россия, раздвигается до 3 м, диван, телевизор, на кухне кух гарнитур МАСТЕРГРАД, холодильник, духовка плита и вытяжка, все в отличном состоянии, стиральная машинка стоит в ванной) люстрами и текстилем. Двери Россия белые ""неоклассика"", входная дверь мощная ТОРЕХ Россия, в общем заезжайте и живите долго и счастливо, как прожили мы все эти годы в этом доме, продаем в связи с расширением. от хозяина. А еще что очень важно, уезжаешь и доезжаешь домой быстрее, млн маршрутов с Абая Правды во все четыре стороны. Фото не все покажет, так что если ищете комфортный и счастливый дом (берекели уй ыздесеныз) то можете прийти посмотреть и увидеть все своими глазами. Добро пожаловать !"
https://krisha.kz//a/show/54674116,4,nan,nan,Достык,290,260.0,nan,nan,монолитный,nan,nan,хорошее,2000,nan,Алматы,Медеуский,отдельный,оптика,nan,True,бронированная,2 с/у и более,паркинг,полностью,паркет,False,3.5,True,True,True,True,False,True,False,False,True,True,False,True,False,True,False,False,False,True,True,True,True,165000000,False,14,False,"Пластиковые окна, улучшенная, кухня-студия, счётчики, тихий двор, кондиционер, удобно под коммерцию.
Квартира с мансардным этажом состоит из трех спальных комнат, просторного зала и кухни. Три санузла, джакузи, постирочная, кладовка. На втором этаже спорт зал, кинотеатр, и сауна."
https://krisha.kz//a/show/679474497,1,1,6,проспект Алатау,nan,40.37,проспект Райымбека,Шугыла,монолитный,nan,nan,черновая отделка,2022,Alma City,Алматы,Наурызбайский,nan,nan,несколько балконов или лоджий,False,металлическая,nan,nan,nan,nan,False,2.8,False,False,False,False,False,False,False,False,False,True,True,False,False,False,False,False,False,False,False,False,True,17500000,False,8,False,"Пластиковые окна, неугловая, удобно под коммерцию.
От хозяина. Очень удобно под коммерцию. Середина ЖК Алма Сити 4. В шаговой доступности Апорт, Алтын Орда, Акимат Наурызбайского района, Цон, школы, поликлиника, детский сад. Транспорт в любую часть города. В перспективе станция метро и ЛРТ. Пробивается улица Толе Би. Огороженная и охраняемая территория, современные детские и воркаут площадки, мини-футбольное поле, много мест для парковки авто. переуступка ДДУ. ключи на руках. 
 
Алма Сити 4 Түрғын Үй Кешені, кілт қолымызда. Жаяу қашықтықта Алтын Орда базары, мол Апорт, 147 аралас орта мектебі, 174 мектеп-гимназия, емхана, Наурызбай ауданының әкімдігі, ХҚҚО, мемлекеттік және жеке-меншік бала-бақшалар бар. Қоршалған және күзетілетін аумақ, балалар аланы, мини-футбол аланы бар. Қаланын кез-келген жеріне транспорт жүреді. Болашақта метро станция және ЛРТ қасында болады."
https://krisha.kz//a/show/671570924,2,12,16,Абая,nan,101.0,Тургута Озала,nan,монолитный,nan,nan,хорошее,2009,Гаухартас,Алматы,Бостандыкский,nan,nan,лоджия,True,металлическая,2 с/у и более,паркинг,полностью,ламинат,False,3.0,False,False,False,False,False,False,False,False,False,True,True,True,True,True,True,True,True,True,True,True,True,58000000,False,12,False,"Большая лоджия, гардеробная, 2 сан. узла. квартира уютная, ухоженная, светлая, состояние идеальное- заезжай и живи, ремонт делали для себя. Остается вся мебель на фото. 
В шаговой доступности ТРЦ АДК. Станция метро, школы и детские сады."
https://krisha.kz//a/show/674380697,2,4,4,nan,nan,55.0,nan,Акжар,монолитный,12.0,nan,хорошее,2021,Alatau Golf Residences,Алматы,Наурызбайский,nan,оптика,балкон,False,бронированная,совмещенный,паркинг,nan,паркет,False,3.2,False,True,True,False,False,True,True,False,False,True,False,True,False,True,True,True,False,True,True,False,False,53000000,False,22,False,"Пластиковые окна, новая сантехника, счётчики, улучшенная, встроенная кухня, кухня-студия, тихий двор.
В квартире сделан ремонт с дизайном в современном стилье из самых дорогих материалов и со вкусом имеется биокамин, двери невидимка, во всех комнатах парящие потолки, кафель керамогранит 120*60, вся техника известной ипроверенной фирмы “Hansa” все делалось не для продажи а для себя, люстры немецкого бренда «Maitoni”, шторы дизайнерские это все надо посмотреть и пощупать чтобы понять качество и стиль. 👍Жилой комплекс бизнес класса «ALATAU GOLF RESIDENCES» расположен в одном из наиболее экологически чистых районов города Алматы, рядом с оздоровительным санаторием «Алатау», а также по соседству с гольф клубом «NURTAU». В жилом комплексе квартира с балконом, а также квартира с видом на фантан который расположен перед домом и с шикарными видом на гольф поля комплекс состоит большими панорамными окнами, с высокими потолками 3, 20 м. 
В ремонте использовались все качественные стройматериалы, все смесители “Frap” качественные и с гарантией."
https://krisha.kz//a/show/679474374,2,2,9,Жунисова,14,44.0,nan,Шугыла,монолитный,15.0,nan,хорошее,2020,Alma City,Алматы,Наурызбайский,nan,оптика,nan,False,металлическая,совмещенный,nan,nan,ламинат,False,2.8,False,False,True,False,False,True,True,False,False,True,True,True,True,True,True,True,True,True,True,True,True,28000000,False,12,False,"Продам 2-х ком. квартиру (2 ком + кухня студия). в отличном состоянии, свежий ремонт. Теплая зимой. ДОКУМЕНТЫ все впорядке, все узаконенно. рядом с домом есть все необходимое. начинается пробивка ул. Толе-би."
https://krisha.kz//a/show/676949744,4,4,9,Радостовца,154А,131.0,Тимирязева,nan,монолитный,16.0,nan,хорошее,2014,nan,Алматы,Бостандыкский,отдельный,проводной,несколько балконов или лоджий,True,бронированная,2 с/у и более,рядом охраняемая стоянка,nan,паркет,False,3.0,False,True,True,False,True,True,False,False,False,True,True,True,True,True,True,True,True,True,True,True,True,111000000,False,17,False,"Шикарную, улучшенную квартиру с удачной планировкой, комнаты все квадратные и большие (юг-север). Очень развитая инфраструктура, все в шаговой доступности. Рядом выставка ВДНХ, чистый воздух, очень хорошая продуваемость. отдельностоящий, двухподьездный дом, огорожен со всех сторон, своя охрана, детская площадка и парковка, удалённый от центральных улиц. Собственное парковочное место под навесом, есть своя кладовая в подвальном помещении. Продаём в связи с переездом."
https://krisha.kz//a/show/679474273,3,2,5,nan,nan,67.0,nan,Кемел,кирпичный,10.0,nan,nan,1994,nan,Алматы,Жетысуский,отдельный,ADSL,nan,True,бронированная,раздельный,рядом охраняемая стоянка,nan,ламинат,False,2.7,False,False,False,False,False,False,False,False,False,True,True,True,True,True,True,True,True,True,True,True,True,42000000,False,6,False,"Подаётся тёплая уютная квартира в тихом чистом районе города. Кирпичный дом построенный 1994 г, специально для строительного СМУ (геодезистов), квартира очень светлая, не угловая, окна выходят на обе стороны. Заехали в июне месяце после капитального ремонта. Ремонт делали для себя, использовали только качественные строй материалы. Немецкая сантехника, встроенная мебель. Заменены все окна, электрика, полы. Квартира полностью под охраной, так же есть охраняемая стоянка для автомобиля. Рядом Детский садик, школа, спорт комплекс."
